Datetime,headline,description,article,link,analysis
2025-06-27 09:00:00,"PCE data, consumer sentiment, F1 the Movie: What to Watch","Asking for a Trend host Josh Lipton takes a look at the top stories for investors to watch on Friday, June 27. Personal Consumption Expenditures (PCE) data — the Federal Reserve's preferred inflation gauge — will be released for the month of May. The final reading for June consumer sentiment will be published. Economists are expecting the reading to hold steady at 60.5. Apple Studios' (AAPL) film ""F1 the Movie"" will be released in theaters and IMAX (IMAX) in North America. To watch more expert insights and analysis on the latest market action, check out more Asking for a Trend here.","Asking for a Trend host Josh Lipton takes a look at the top stories for investors to watch on Friday, June 27..Personal Consumption Expenditures (PCE) data — the Federal Reserve's preferred inflation gauge — will be released for the month of May..The final reading for June consumer sentiment will be published. Economists are expecting the reading to hold steady at 60.5..Apple Studios' (AAPL) film ""F1 the Movie"" will be released in theaters and IMAX (IMAX) in North America..To watch more expert insights and analysis on the latest market action, check out more Asking for a Trend here..Time now for to watch Friday, June 27th. Gonna start off on the economy. We're going to be getting some fresh inflation data on Friday with personal consumption expenditures or PCE. Economists forecasting that the Fed's preferred inflation gauge will hold steady at 0.1% on a month over month basis. On a year over year basis, both total and core PCE expected to tick up respectively to 2.3 and 2.6%, signaling inflation will remain sticky as the Fed charts the path forward with interest rates. Take a look at the consumer. The final reading for consumer sentiment in June that's coming out on Friday. Economists anticipating no change from the prior reading of 60.5. That number would be about an eight-point bump compared to May, suggesting US consumers are feeling more optimistic about the economy. And shifting gears, entertainment, F1 the movie is releasing in theaters and IMAX in North America on Friday. The Brad Pitt led film is the latest theatrical release for Apple Studios with a budget of more than $200 million. Well, that's a wrap on today's Ask for a trend. Be sure to come back tomorrow at 4:30 p.m. Eastern for all of the latest market moving stories affecting your wallet. Have a great night. ",https://finance.yahoo.com/video/pce-data-consumer-sentiment-f1-230052643.html," The article discusses potential risks related to macroeconomic factors such as inflation (as indicated by PCE data) and consumer sentiment. These elements can influence economic growth, investor behavior, and financial markets.   Risk classification: Macroeconomic Factors"
2025-06-26 18:37:00,Meta’s quest to dominate the AI world,Meta is on a quest to dominate the AI world. One way or another.,"Facebook parent Meta (META) is spending billions of dollars to grab the lead in the AI race, building out the data centers needed to develop and power high-end large language models. And now, the company is pouring billions more into snatching up top talent and technologies to grab the lead in the AI wars..In its latest hiring coup, Meta has poached three OpenAI (OPAI.PVT) researchers — Google DeepMind alums Lucas Beyer, Alexander Kolesnikov, and Xiaohua Zhai — from its Zurich office, The Wall Street Journal reported late Wednesday. OpenAI CEO Sam Altman claims that Meta CEO Mark Zuckerberg has offered the company's employees upward of $100 million to join his AI efforts..Meanwhile, Meta is reportedly in talks to bag Safe Superintelligence CEO Daniel Gross and former Github CEO Nat Friedman for its planned superintelligence lab. Zuckerberg was initially eyeing all of Safe Superintelligence, but was shot down by co-founder Ilya Sutskever, according to CNBC..The moves come after Meta invested $14.3 billion in AI startup Scale AI and hired its CEO and co-founder Alexandr Wang. That’s not all: Meta also wanted to buy Perplexity AI (PEAI.PVT) but couldn’t come to terms on a deal..“Meta is doing this because they want to win the AI race, period,” Forrester analyst Mike Proulx told Yahoo Finance. “AI is everything right now.”.All of this follows Meta’s decision to postpone the debut of its massive Llama 4 Behemoth AI model. According to The Wall Street Journal, the company won’t launch the model until later this fall over concerns that it isn’t a big enough upgrade over prior models..“I think this is two things: No. 1 [is] confirmation that Llama is struggling,” Deepwater Asset Management managing partner Gene Munster told Yahoo Finance. “And second, is [it’s] also a sign that Zuckerberg is not OK with that.”.For Meta, the goal is clear: bring in as much fresh talent as possible to push its AI program forward and take the lead in the AI wars..Meta’s effort to rule the AI world differs from its chief rivals, OpenAI, Google, xAI, and others. Rather than closing off its AI models, the company offers them as open-source software that developers and companies can use on their own..Meta imposes some restrictions on how users can take advantage of its models. For instance, the company requires firms to request a license from Meta if their product has more than 700 million monthly active users..Regardless, Meta’s ultimate goal is to get as many people as it’s comfortable with using and developing products via its AI models. Why not charge everyone who wants to access its software? Because Meta benefits every time a company alters its models, giving it greater insights into how it can improve them down the line.",https://finance.yahoo.com/news/metas-quest-to-dominate-the-ai-world-184836143.html," The article reflects a high-risk scenario. The reasons include substantial investment requirements for AI development, potential competition from established players, regulatory challenges, ethical concerns, and the risk of displacing jobs across various industries."
2025-06-27 08:30:00,"This Is The Ultimate Warren Buffett Stock: Is It A Buy After CEO News, These Portfolio Moves?","Warren Buffett is widely regarded as one of the greatest investors of all time.  One way to share in his success is to invest in his firm, Berkshire Hathaway.  Let's take a close look at the fundamental and technical performance of the ultimate Warren Buffett stock.","Warren Buffett is widely regarded as one of the greatest investors of all time. One way to share in his success is to invest in his firm, Berkshire Hathaway. Let's take a close look at the fundamental and technical performance of the ultimate Warren Buffett stock.",https://finance.yahoo.com/m/d3a26930-53e1-34d7-84a4-b2665868a0a2/this-is-the-ultimate-warren.html, No risk.
2025-06-27 05:31:00,FalconEye Ventures Acquires Premium Mixed-Use Development Scottsdale Quarter,"SCOTTSDALE, Ariz., June 26, 2025--FalconEye Ventures today announced it has acquired Scottsdale Quarter, a premier, 755,000-square-foot open-air mixed-use destination encompassing retail, dining, and office components, complemented by nearly 600 residential units.","Real Estate Investment Group Plans $100 Million Capital Improvement Campaign to Enhance 755,000-Square-Foot Destination.SCOTTSDALE, Ariz., June 26, 2025--(BUSINESS WIRE)--FalconEye Ventures today announced it has acquired Scottsdale Quarter, a premier, 755,000-square-foot open-air mixed-use destination encompassing retail, dining, and office components, complemented by nearly 600 residential units..FalconEye Ventures is a real estate investment company founded by tech entrepreneur George Kurtz in 2020..The company also announced today that Vestar, a leading owner and operator of open-air shopping centers across the Western United States, will be a strategic partner and oversee operations at the property..As part of the acquisition, a $100 million capital improvement program is planned to further elevate the property's positioning within the luxury retail sector and expand its Class-A office offerings to cater to technology and creative industry tenants..Home to iconic retail brands such as Apple, Restoration Hardware, lululemon, Jenni Kayne, Veronica Beard, Dominick’s Steakhouse, and True Food Kitchen, Scottsdale Quarter has long been a cornerstone of the Southwest’s retail landscape. FalconEye’s planned investment in the property will support its long-term vision to build upon the presence of these powerful brands to create a vibrant live-work-play environment that blends contemporary luxury retail, chef-driven dining, and innovation-focused office space..""Scottsdale Quarter is a powerful asset with even greater future potential as a magnet retail destination and a hub for breakthrough technology companies,"" said Kurtz. ""This acquisition aligns with our commitment to investing in and developing leading mixed-use properties that serve as catalysts for innovative companies and economic growth."".""Working with FalconEye Ventures represents a strategic opportunity to advance our shared vision for Scottsdale Quarter,"" said David Larcher, President and CEO, Vestar. ""The planned enhancements will build upon the property’s strong foundation while positioning it as a destination for continued growth in an evolving retail and office landscape."".The capital improvement program for Scottsdale Quarter will focus on tenant curation, infrastructure enhancements, and experiential retail concepts designed to differentiate the property. Implementation is scheduled to commence in late 2025, with phased execution designed to minimize operational disruption to existing tenants and maintain continuity of service to visitors.",https://finance.yahoo.com/news/falconeye-ventures-acquires-premium-mixed-213100377.html," The news about FalconEye Ventures acquiring Scottsdale Quarter involves several potential risks. These include regulatory scrutiny, market fluctuations, supply chain disruptions, economic sensitivity, and integration challenges.  Risk Classification: Medium"
2025-06-27 05:18:00,Apple Stock Gets Price-Target Cut On Mounting Challenges,"Investment bank JPMorgan on Thursday cut its price target on Apple stock, citing growing challenges for the iPhone maker.","Investment bank JPMorgan on Thursday cut its price target on Apple stock, citing growing challenges for the iPhone maker.",https://finance.yahoo.com/m/343ae75b-bcf6-3564-b19a-6865397eb287/apple-stock-gets-price-target.html, The risk associated with the news is classified as **market sentiment risk**.
2025-06-27 04:38:00,Apple updates the rules for its EU App Store by adding more complicated fees,"Apple on Thursday announced a series of updates to its developer policies to comply with the EU’s Digital Markets Act (DMA). The news, which was expected, arrived just in time to meet the deadline of June 26, after which the iPhone maker would risk new fines. The changes involve both how app developers can communicate […]","Apple on Thursday announced a series of updates to its developer policies to comply with the EU’s Digital Markets Act (DMA). The news, which was expected, arrived just in time to meet the deadline of June 26, after which the iPhone maker would risk new fines. The changes involve both how app developers can communicate with their customers and the fees Apple charges..EU regulators had earlier fined Apple €500 million for noncompliance with the DMA and were threatening to impose further penalties, forcing Apple’s hand..In terms of Apple’s new “anti-steering” rules, which dictate customer communications, EU app developers will now be able to link to alternative ways to pay for subscriptions and other in-app purchases outside the App Store across any channel. That means they can share this link on a website, an alternative app marketplace, within another app, and more. These links can also be accessed outside the app or within the app using a web view or native experience, Apple said, and don’t have to use warning screens or the text that Apple previously required..In addition, instead of dropping its Core Technology Fee (CTF), Apple introduced a more complex fee structure..There’s now an initial acquisition fee (2%) and a store services fee. The latter is either 13% or 5%, depending on the tier the developer chooses. (Small Business program members pay 10%.) Tier 1 developers have access to a more limited set of App Store services, including app reviews, manual updates, and antifraud measures. Tier 2 provides access to marketing tools, automatic updates, curation and personalization features, app insights, and more..Then, for apps that want to link to alternative methods of payment via the StoreKit External Purchase Link Entitlement (EU) Addendum, there’s a Core Technology Commission (CTC). This will ultimately replace the CTF..Before today, the developers paid the CTF of €0.50 for each app install after the app topped 1 million downloads. That will continue for developers on the alternative EU business terms..For developers on the standard terms in the EU, the CTC — a 5% commission — will instead apply. Developers who currently pay the old CTF will move to the new rules by January 1, 2026..“The CTC reflects the value Apple provides developers through ongoing investments in the tools, technologies, and services that enable them to build and share innovative apps with users,” Apple said in a statement..Epic Games CEO Tim Sweeney, whose company sued Apple and won the right to use alternative payments without a commission in the U.S., reacted to the news on X, calling it more malicious compliance from Apple..“Apple’s new Digital Markets Act malicious compliance scheme is blatantly unlawful in both Europe and the United States and makes a mockery of fair competition in digital markets. Apps with competing payments are not only taxed but commercially crippled in the App Store,” he said.",https://finance.yahoo.com/news/apple-updates-rules-eu-app-203829383.html, Legal/Regulatory Risk
2025-06-27 05:02:00,Apple's Tariff Bump Loses Steam,"Early buyers warm up the market, then things cool off","You know how everyone was rushing to buy the iPhone before those new tariffs kicked in? Well, J.P. Morgan thinks that early surge could leave sales of the upcoming iPhone 17 a bit flat later on..They've kept Apple (NASDAQ:AAPL) at Overweight, but they nudged their price target down from $240 to $230 because they see demand cooling off once the tariff-driven buying frenzy and China subsidies subside..On the upside, JP's team isn't worried about margins as much as you might thinkthey're betting Apple's shift of U.S.-destined assembly to India will help keep costs in check..And don't forget the iPhone 18 cycle: word is there'll be a foldable model plus some AI features that have been long delayed. That's the real kicker for themstronger growth in fiscal 2027 rather than right now..So, in their view, 2026 is going to feel pretty pedestrianthink single-digit top-line growthbefore things pick up again when the foldable/AI-powered iPhone lands. If you're eyeing Apple, you might sit tight until we see actual sell-through on the iPhone 17, then dive in ahead of the bigger rebound..This article first appeared on GuruFocus.",https://finance.yahoo.com/news/apples-tariff-bump-loses-steam-200230377.html, The risk classification for the news about Apple's tariff bump losing steam is:  Competitive Risk
2025-06-27 03:25:00,Apple Reworks European App Store Policy to Swerve More EU Fines,Apple has reworked the terms and conditions for developers that use its highly lucrative App Store in the European Union in a bid to avoid racking up more fines under the EU’s digital antitrust law.,Apple has reworked the terms and conditions for developers that use its highly lucrative App Store in the European Union in a bid to avoid racking up more fines under the EU’s digital antitrust law.,https://finance.yahoo.com/m/b1ef9ee9-8e9d-3c3e-a93a-ec631482badf/apple-reworks-european-app.html," The news relates to **Financial Risk**, as Apple may face increased penalties under EU antitrust regulations if they avoid compliance."
2025-06-27 03:00:00,Alibaba Just Released New AI Models for Apple. Does That Make AAPL Stock a Buy?,"Apple needs China, and Alibaba just helped unlock its AI future with the Qwen3 model. Is this the catalyst AAPL bulls were waiting for?","For Apple (AAPL), artificial intelligence is the key to future-proofing its robust devices and services ecosystem. Yet in China, Apple’s second-largest market, the company’s AI ambitions have hit a wall. Between trade tensions, strict regulations, Beijing’s data-localization demands, fierce competition for device sales, Apple’s Intelligence suite remained locked out of the mainland..Alibaba Group (BABA) has just handed Apple a potential key. Its Qwen3 AI models have been fine-tuned for Apple’s MLX framework, enabling them to run natively on iPhones, iPads, and Macs..Tesla’s Robotaxis Reportedly Sped and Veered Into the Wrong Lanes. Does This Crush the Bull Case for TSLA Stock?.1 Dividend Stock to Buy Yielding Over 7%.Ditch Big Tech and Buy These 3 Popular Stocks in 2025 Instead.Get exclusive insights with the FREE Barchart Brief newsletter. Subscribe now for quick, incisive midday market analysis you won't find anywhere else..It is a strategic play. Apple needs a domestic AI partner to navigate China’s tight controls, and Alibaba’s open-source route gives it both flexibility and local legitimacy. This could finally pave the road for Apple Intelligence to launch in China - a much-needed boost for iPhone sales..Nearly six months into 2025, and Apple bulls are still bruised, with shares 23% off their peak. So, will this Alibaba alliance reignite the rally or trigger more turbulence?.Apple (AAPL), the $3 trillion global tech titan from Cupertino, redefined technology with the iPhone, Mac, and iPad. But its real power play now is the services segment. With over a billion paid subscribers and high-margin offerings like iCloud, Apple Music, and the App Store, it is weathering global headwinds while tightening its grip on the digital ecosystem..Despite being big on innovation, AAPL’s stock has slumped 19.5% in 2025, making Apple the worst YTD performer among the Magnificent Seven. Regulatory headwinds and mounting competition have eroded investor confidence. While large-cap tech rebounded in May, Apple missed the rally and dropped 6% that month alone. The decline deepened with rising tariff tensions, especially fears of a 25% hit if Apple doesn’t shift manufacturing to the U.S..Yet the core issue extends beyond geopolitics and trade friction. “Apple Intelligence” debuted at WWDC 2024, failed to generate lasting enthusiasm, hindered by limited device compatibility and the postponement of key features like the enhanced Siri. Legal pressures and underwhelming developments at WWDC 2025, where cosmetic updates overshadowed bold innovation, further reinforced perceptions that Apple is trailing AI leaders such as Google (GOOGL). While the company’s ecosystem remains robust, its current AI narrative lacks the momentum to inspire market confidence.",https://finance.yahoo.com/news/alibaba-just-released-ai-models-190002370.html," The risk classification is **No risk** because the article suggests a potential positive impact on Apple's AI future and strategic partnership with Alibaba, which may not inherently pose significant financial risks upon closer examination of the stated benefits."
2025-06-27 01:42:00,Apple Continues to Expand Services Business: What's the Path Ahead?,AAPL's Services arm hits 1B+ paid subscribers as Apple Intelligence boosts offerings from Wallet to Music.,"Apple AAPL is continuously upgrading features of its Services offerings that revolve around the flagship device, iPhone. The company now has more than 1 billion paid subscribers across its Services portfolio, more than double what it had four years ago. In the fiscal second quarter, Services revenues grew 11.6% year over year to $26.65 billion. Infusion of Apple Intelligence into Services offerings like Apple Wallet and Apple Music is expected to drive top-line growth. At its latest annual Worldwide Developers Conference, Apple announced expansion to the Services business with AutoMix and Lyrics Translation features in Apple Music. Sing will allow users to transform their iPhones into a handheld microphone for Apple TV, while preferred routes and visited places in Apple Maps make navigation easier for users. Apple Intelligence is now getting added to Apple Wallet, and users can make purchases with Apple Pay. Powered by Apple Intelligence, Apple Wallet can now automatically identify, summarize and display order tracking details from emails sent from merchants or delivery carriers. Meanwhile, Apple Pay expands the ability to pay with rewards and installments to in-store purchases for added flexibility and choice. The company also introduced an update to Apple Maps that helps users search and discover top-ranked restaurants, hotels, golf courses and more, with the addition of rankings and insights from expert sources.Per our model, Apple’s Services revenues are expected to see a CAGR of 15.6% between 2024 and 2027..Netflix NFLX and Disney DIS are major competitors in the Services space. Netflix is benefiting from its growing subscriber base, thanks to a robust localized and foreign-language content portfolio and healthy engagement levels with about two hours of viewing per member per day, indicating strong member retention. Netflix has set an ambitious target to double its revenues by 2030, supported by a diversified content strategy, including international programming, live events and gaming initiatives.Disney, on the other hand, has built up a massive global audience for its ad-supported streaming content. It has an estimated 157 million active users worldwide, 112 million of whom are of Disney’s streaming platforms in the United States. Disney is benefiting from strength in Domestic Parks & Experiences revenues driven by growth at domestic parks, Disney Vacation Club and Disney Cruise Line..Apple shares have dropped 19.5% year to date (YTD), underperforming the broader Zacks Computer & Technology sector’s return of 4.5%.",https://finance.yahoo.com/news/apple-continues-expand-services-business-164200525.html," The risk classification is High Risk.  Factors contributing to this classification include potential competition from established players like Google and Amazon, regulatory scrutiny due to varying laws across regions, possible impact of economic downturns on subscriber growth, supply chain disruptions affecting production efficiency, increased customer acquisition costs, higher churn rates, and integration challenges with existing Apple ecosystems. These factors could negatively impact the success of Apple's service expansion."
