Datetime,headline,description,article,link,analysis
2025-06-26 00:10:00,Adobe Deepens AI in Creative Workflows: Is ARR Growth Set to Scale?,"With Firefly and Express gaining traction, ADBE leans into AI to scale ARR and sharpen its creative workflow edge.","Adobe ADBE is expanding generative AI across its Digital Media offerings to improve productivity and support recurring revenue growth. Firefly, Acrobat AI Assistant and Express are being embedded into creative workflows, helping enterprises, individuals, and small teams generate content more efficiently.Ongoing innovation and deeper AI integration are emerging as key growth drivers. The new Firefly App enables users to generate and edit images, videos, vectors and audio through a unified interface, while a new mobile version extends creative capabilities on the go. These additions follow the launch of Firefly Image Model 4 Ultra and the general availability of the Firefly Video Model, which supports 4K video generation through simple text prompts.The advancements are strengthening momentum in Express. Tools like Animate from Audio and Clip Editor are enhancing content production, while integrations with Google Ads and Vimeo are improving distribution. Express usage within Acrobat rose nearly 11x year over year in the second quarter of 2025, driven by growing interest in embedded design tools. Adobe also added 8,000 new Express for Enterprise customers, including ServiceNow, Workday and Major League Baseball.The adoption of Adobe’s AI-powered tools is growing across enterprise teams. Newell Brands is using Firefly and Express to optimize its content supply chain, while Cisco and Ulta Beauty are scaling Adobe’s AI stack across creative workflows. These developments supported 12% revenue growth in the Digital Media segment, which reached $4.35 billion in the second quarter. AI-led offerings are expected to drive sustained ARR momentum for ADBE in the long term..Adobe faces growing competition from Apple AAPL and Microsoft MSFT, both of which are advancing AI-led creative platforms tailored to individuals and small teams.Apple is upgrading Final Cut Pro and Logic Pro with AI features, such as voice isolation and text-to-video generation. Apple’s tools are optimized for speed and precision, increasingly overlapping with Adobe Express and Firefly.Microsoft is scaling Microsoft Designer and embedding Copilot across Office apps to support automated content creation. Microsoft’s tools now allow users to generate visuals, presentations and documents with AI. With Microsoft 365’s broad user base, Microsoft is deepening its competitive position against Adobe’s Express and Acrobat workflows..Adobe shares have declined 14% year to date, while the broader Zacks Computer & Technology sector has returned 1.8% and the Computer-Software industry has risen 12%.",https://finance.yahoo.com/news/adobe-deepens-ai-creative-workflows-151000155.html," The announcement by Adobe to deepen its use of AI in creative workflows presents several risks:  1. **Job Displacement**: The adoption of AI could lead to automation of creative tasks, potentially resulting in job losses for human creatives.  2. **Data Security and Privacy**: Increased reliance on AI may expose sensitive user data, posing risks of breaches and misuse.  3. **Regulatory Challenges**: Navigating regulations specific to AI use in creative industries across different regions could introduce legal challenges.  4. **Technical Implementation Risks**: Integration of AI into existing workflows might face compatibility issues and technical hurdles.  5. **Market Competition Pressure**: Intense competition from other tech giants using similar AI strategies could lead to price wars, affecting profit margins for Adobe.  6. **User Adoption and Training**: Insufficient training may hinder effective use of AI tools, reducing their benefits and possibly even lowering efficiency.  These risks highlight the need for careful consideration as Adobe moves into AI-driven creative workflows."
2025-06-25 22:47:00,S&P 500 Companies Bought Back More Stock Than Ever Last Quarter,"The buybacks, led by tech and financial companies, top the previous record of $281 billion set in the first quarter of 2022.  The total is up nearly 21% from the fourth quarter of 2024, data released Wednesday by S&P Dow Jones Indices showed.  The current quarter might be less rosy, with buybacks likely more more limited to companies with secure cash flows, said Howard Silverblatt, a senior index analyst at S&P Dow Jones Indices.","The buybacks, led by tech and financial companies, top the previous record of $281 billion set in the first quarter of 2022. The total is up nearly 21% from the fourth quarter of 2024, data released Wednesday by S&P Dow Jones Indices showed. The current quarter might be less rosy, with buybacks likely more more limited to companies with secure cash flows, said Howard Silverblatt, a senior index analyst at S&P Dow Jones Indices.",https://finance.yahoo.com/m/a070b523-531b-3f5c-9f0e-5160c7c9b762/s-p-500-companies-bought-back.html," The news regarding S&P 500 companies buying back more stock than ever before primarily relates to **market sentiment and potential volatility**. This trend could lead to increased investor reactions, potentially causing price fluctuations as investors interpret these actions based on current market conditions and expectations."
2025-06-25 22:30:00,"Home Automation Market Size to Grow USD 135.13 Billion by 2031, at a CAGR of 10.8% | The Insight Partners","According to a new comprehensive report from The Insight Partners, the global home automation market is observing healthy growth owing to the adoption and integration of artificial intelligence home automation.","NEW YORK, June 25, 2025 /PRNewswire/ -- According to a new comprehensive report from The Insight Partners, the global home automation market is observing healthy growth owing to the adoption and integration of artificial intelligence home automation..The home automation market is expected to reach US$ 135.13 billion by 2031 from US$ 65.88 billion in 2024; it is expected to record a CAGR of 10.8% during the forecast period. Voice control is becoming the primary mode of engagement, with platforms such as Amazon Alexa, Google Assistant, and Apple Siri leading the way. Voice recognition technology has advanced dramatically, allowing users to provide commands in natural language. For instance, ""dim the living room lights to 50%"" will soon become the standard. Smart homes will learn from their users' habits and modify settings depending on individual preferences, personalizing experiences in significant ways. The consumer demand for voice control-featured smart home devices drives market growth..The report runs an in-depth analysis of market trends, key players, and future opportunities. Trade shows are a robust platform that allows companies to showcase their entire business at one booth, raising company awareness among customers. This is further boosting the market growth..To explore the valuable insights in the Home Automation Market report, you can easily download a sample PDF of the report -  https://www.theinsightpartners.com/sample/TIPTE100000139.Overview of Report Findings.Increased Focus on Security: Smart technology is changing the way people secure their homes. Traditional alarms and cameras are turning into more comprehensive security systems. Improved home security systems use new technology, including AI and analytics, to provide better protection. This trend is significant in the coming year due to rising homeowner safety concerns. AI-powered surveillance is an attractive advancement. These devices can analyze camera feeds for unexpected movements and notify homeowners in real-time. Furthermore, smart locks can be programmed for certain access hours, and biometric technology is gaining traction by requiring unique identifiers such as fingerprints for entrance. According to a recent survey, 80% of homeowners believe that solid security features are vital when selecting smart home solutions. Thus, homeowners' focus on safety and security creates demand for advanced systems and solutions is driving the market..Growing Demand for Sustainable Smart Homes: With climate change at the center of global concerns, sustainability has become a top priority in home automation. Smart houses will increasingly be created with eco-friendly technologies that save energy and reduce environmental effects while remaining sophisticated. Sustainable automation, which includes solar-powered electronic devices as well as energy-efficient lighting and heating systems, is becoming a trend in the home automation market. Moreover, homeowners are increasingly opting for real-time automation systems that monitor energy usage, allowing them to make more educated consumption decisions. For instance, smart thermostats are capable of learning consumers' routines and changing temperatures accordingly, lowering energy consumption. Additionally, combining renewable energy sources with smart home technology makes homes smarter and greener, contributing to a healthier environment..Integration of AI in Home Automation: Artificial intelligence (AI) is transforming home automation by enabling a real customized living experience. AI technology integrated with home devices —from lighting to temperature to music—adjusts automatically to consumer preferences. AI-driven personalization learns and adapts to consumers' routines, transforming into home. This technology extends beyond simple voice instructions to anticipate users' needs, making consumers' daily routines smooth and natural. For instance, task management systems such as the Butler Module are integrated with AI technology to make consumers' lives easier. It converts each request into a dialog with the home's personnel, ensuring that users' preferences are met without requiring frequent physical intervention. Moreover, whether scheduling duties or controlling preferred settings, AI ensures that the home works seamlessly with users' lifestyles, contributing to a stress-free environment..Geographical Insights: In 2024, North America led the market with a substantial revenue share, followed by Europe and Asia Pacific, respectively. Asia Pacific is expected to register the highest CAGR during the forecast period.",https://finance.yahoo.com/news/home-automation-market-size-grow-143000695.html, The news article relates to the Home Automation Market and its projected growth. The primary risk associated with this development is the potential for a market bubble due to rapid growth leading to speculative investments or irrational expectations among stakeholders.  Risk Classification: Market Bubble (Speculative Investment)
2025-06-25 22:06:00,Stocks See Support Ahead of Fed Chair Powell Testimony,"The S&P 500 Index ($SPX ) (SPY ) today is up +0.25%, the Dow Jones Industrials Index ($DOWI ) (DIA ) is down -0.09%, and the Nasdaq 100 Index ($IUXX ) (QQQ ) is up +0.58%. September E-mini S&P futures (ESU25 ) are up +0.21%, and September E-mini Nasdaq futures...","The S&P 500 Index ($SPX) (SPY) today is up +0.25%, the Dow Jones Industrials Index ($DOWI) (DIA) is down -0.09%, and the Nasdaq 100 Index ($IUXX) (QQQ) is up +0.58%.  September E-mini S&P futures (ESU25) are up +0.21%, and September E-mini Nasdaq futures (NQU25) are up +0.56%..Stock indexes today are mostly higher, with the S&P 500 posting a 4-month high and the Nasdaq 100 posting a new all-time high.  Stocks are awaiting the second day of testimony from Fed Chair Powell about the economy.  Reduced geopolitical risks in the Middle East have boosted market sentiment and prompted a risk-on for asset markets as the ceasefire between Israel and Iran appears to be holding..US MBA mortgage applications rose +1.1% in the week ended June 20, with the purchase mortgage sub-index down -0.4% and the refinancing mortgage sub-index up +3.0%. The average 30-year fixed rate mortgage rose +4 bp to 6.88% from 6.84% in the prior week..Late Tuesday evening, Kansas City Fed President Schmid stated that the current “wait and see” monetary policy posture is appropriate, as the Fed should wait to see how tariffs and other policies impact the economy before adjusting interest rates..The markets this week will watch to see if the ceasefire holds between Israel and Iran. Also, any new tariff news or trade deals will be scrutinized.  Later today, Mr. Powell will testify before the Senate Banking Committee on monetary policy.  Also, US Mar new home sales are expected to fall -6.7% m/m to 693,000.  On Thursday, Q1 GDP is expected to be unrevised at -0.2% (q/q annualized).  Also, weekly initial unemployment claims are expected to be unchanged at 245,000. Friday brings May personal spending (expected +0.1% m/m) and May personal income (expected +0.3% m/m). Also on Friday, the May core PCE price index, the Fed’s preferred price gauge, is expected to rise by +0.1% m/m and +2.6% y/y.  Finally, Friday’s June University of Michigan US consumer sentiment index is expected to be revised lower by -0.2 points to 60.3..The markets are discounting the chances at 21% for a -25 bp rate cut at the July 29-30 FOMC meeting..Overseas stock markets today are mixed.  The Euro Stoxx 50 is down -0.39%.  China’s Shanghai Composite rallied to a 6-1/4 month high and closed up +1.04%.  Japan’s Nikkei Stock 225 closed up +0.39%..Interest Rates.September 10-year T-notes (ZNU25) today are down -6 ticks.  The 10-year T-note yield is up +2.4 bp to 4.318%.  Sep T-notes fell from a 1-1/2 month high today and are moving lower, and the 10-year T-note yield rebounded from a 1-1/2 month low of 4.275%.  T-notes are under pressure today on negative carryover from weakness in European government bonds.  Also, hawkish comments from Kansas City Fed President Schmid undercut T-notes when he said the Fed should wait to see how tariffs and other policies impact the economy before adjusting interest rates.  Supply pressures are negative for T-notes ahead of the Treasury’s $28 billion auction of 2-year floating rate notes and the $70 billion auction of 5-year T-notes later today.",https://finance.yahoo.com/news/stocks-see-support-ahead-fed-140644264.html, The article discusses potential market reactions around Federal Reserve Chair Powell's testimony. The mention of mixed index movements suggests underlying uncertainty despite some positive signs. The possibility of significant policy changes influencing markets introduces Market/Political Risk.  Market/Political Risk
2025-06-25 22:02:00,"If You Invested $10K in the Magnificent 7 in 2015, What Would It Be Worth Now?","If you'd had the foresight (and money) to invest $10,000 in each of the ""Magnificent 7"" stocks a decade ago, you'd be a multimillionaire right now. Read more.","If you’d had the foresight (and money) to invest $10,000 in each of the “Magnificent 7” stocks a decade ago, you’d be a multimillionaire right now. That’s how high and fast each of the stocks has risen since 2015..The Magnificent 7 is comprised of Alphabet (GOOG), Amazon (AMZN), Apple (AAPL), Meta (META), Microsoft (MSFT), Nvidia (NVDA) and Tesla (TSLA). These are not only some of the most recognizable names in technology but also among the most powerful drivers of the S&P 500..Check Out: Warren Buffett’s Berkshire Hathaway Bought Over $73 Million in Shares of This Tech Company — Here’s Why.Read Next: 6 Popular SUVs That Aren't Worth the Cost -- and 6 Affordable Alternatives.Here’s a look at how much June 2015 $10,000 investments made in each of the Magnificent 7 stocks would be worth now..June 2015 price (accounting for stock splits): $26.03 per share.Closing price on June 16, 2025: $177.94.10-year return: 583.6%.Current value of $10,000 investment: $68,360.Alphabet is best known as the parent company of Google, the world’s dominant search engine by a very wide margin. But it has also gotten a lift from other leading brands like YouTube, Fitbit and Waze..Explore More: I’m a Self-Made Millionaire: 5 Stocks You Shouldn’t Sell.June 2015 price (accounting for stock splits): $21.70.Closing price on June 16, 2025: $216.10.10-year return: 895.9%.Current value of $10,000 investment: $99,590.Amazon’s dominant position in online retail has made it a winning bet on Wall Street through the years. Other contributors to the stock rise include Amazon Prime, Whole Foods and the Amazon Web Services cloud computing platform..June 2015 price (accounting for stock splits): $31.36.Closing price on June 16, 2025: $198.42.10-year return: 532.7%.Current value of $10,000 investment: $63,270.Apple is the world’s leading producer of computers and smartphones, and has boosted its business through sales of streaming services, apps, headphones, earbuds and speakers. But U.S. tariff threats against China — a leading supplier of Apple components — poses a risk moving forward..June 2015 price: $44.15.Closing price on June 16, 2025: $479.14.10-year return: 985.3%.Current value of $10,000 investment: $108,530.Like most companies on this list, software giant Microsoft benefits from a dominant and entrenched market position thanks to its ubiquitous Windows operating system. That alone would make it a decent stock bet, but much of its recent buzz comes from its investment in OpenAI, the creator of ChatGPT.",https://finance.yahoo.com/news/invested-10k-magnificent-7-2015-140213738.html, High Risk
2025-06-25 22:41:00,Trump Trade: Trump slams Powell while Fed chair appears before Congress,"Catch up on the top industries and stocks that were impacted, or were predicted to be impacted, by the comments, actions and policies of President Trump with this daily recap compiled by The Fly: CEASEFIRE: President Donald Trump posted to Truth Social on Monday night that there has been a “complete and total” ceasefire between Israel and Iran. He said: “CONGRATULATIONS TO EVERYONE! It has been fully agreed by and between Israel and Iran that there will be a Complete and Total CEASEFIRE (in appr","Catch up on the top industries and stocks that were impacted, or were predicted to be impacted, by the comments, actions and policies of President Trump with this daily recap compiled by The Fly:.Easily unpack a company's performance  with TipRanks' new KPI Data for smart investment decisions.Receive undervalued, market resilient stocks right to your inbox  with TipRanks' Smart Value Newsletter.CEASEFIRE: President Donald Trump posted to Truth Social on Monday night that there has been a “complete and total” ceasefire between Israel and Iran. He said: “CONGRATULATIONS TO EVERYONE! It has been fully agreed by and between Israel and Iran that there will be a Complete and Total CEASEFIRE (in approximately 6 hours from now, when Israel and Iran have wound down and completed their in progress, final missions!), for 12 hours, at which point the War will be considered, ENDED! Officially, Iran will start the CEASEFIRE and, upon the 12th Hour, Israel will start the CEASEFIRE and, upon the 24th Hour, an Official END to THE 12 DAY WAR will be saluted by the World. During each CEASEFIRE, the other side will remain PEACEFUL and RESPECTFUL. On the assumption that everything works as it should, which it will, I would like to congratulate both Countries, Israel and Iran, on having the Stamina, Courage, and Intelligence to end, what should be called, “THE 12 DAY WAR.” This is a War that could have gone on for years, and destroyed the entire Middle East, but it didn’t, and never will! God bless Israel, God bless Iran, God bless the Middle East, God bless the United States of America, and GOD BLESS THE WORLD!”.Israel later accused Iran of what it described as a “severe violation” of President Donald Trump’s ceasefire,  a charge Iran denies, NBC News reports. Trump acknowledged that both Iran and Israel violated the ceasefire, telling a group of reporters that he is going to see if he can stop the ceasefire violations. “We basically have two countries that have been fighting so long and so hard that they don’t know what the f— they’re doing,” he said..FED RATE SHOULD BE LOWER: On Monday night, President Donald Trump posted to Truth Social: “Too Late” Jerome Powell, of the Fed, will be in Congress today in order to explain, among other things, why he is refusing to lower the Rate. Europe has had 10 cuts, we have had ZERO. No inflation, great economy – We should be at least two to three points lower. Would save the USA 800 Billion Dollars Per Year, plus. What a difference this would make. If things later change to the negative, increase the Rate. I hope Congress really works this very dumb, hardheaded person, over. We will be paying for his incompetence for many years to come. THE BOARD SHOULD ACTIVATE. MAKE AMERICA GREAT AGAIN!”",https://finance.yahoo.com/news/trump-trade-trump-slams-powell-134130286.html," The news pertains to potential shifts in Federal Reserve policy under President Trump's influence, which could lead to market volatility and uncertainty, particularly affecting fixed income markets. This creates a risk environment characterized by possible changes in interest rates impacting various asset classes.   Risk classification: Interest Rate Risk"
2025-06-25 18:18:00,"Exclusive-US exchanges, SEC in talks to ease public company regulations","NEW YORK (Reuters) -U.S. exchange operators are in talks with the Securities and Exchanges Commission on easing regulatory burdens for public companies, as they seek to encourage more richly valued startups to list, according to four people familiar with the matter.  These deliberations, the details of which are reported here for the first time, involve the SEC, Nasdaq and the New York Stock Exchange.  The reforms under discussion range from reducing the quantum of disclosures and the costs of going public to making it harder for minority investors to agitate, the sources said, requesting anonymity as they were not authorized to speak publicly.","By Anirban Sen and Chris Prentice.NEW YORK (Reuters) -U.S. exchange operators are in talks with the Securities and Exchanges Commission on easing regulatory burdens for public companies, as they seek to encourage more richly valued startups to list, according to four people familiar with the matter..These deliberations, the details of which are reported here for the first time, involve the SEC, Nasdaq and the New York Stock Exchange. The reforms under discussion range from reducing the quantum of disclosures and the costs of going public to making it harder for minority investors to agitate, the sources said, requesting anonymity as they were not authorized to speak publicly..The talks, which the sources said have been ongoing for several months, come amid a renewed push to ease regulations under President Donald Trump, whose administration has said it wants to do so to spur economic growth..Taken together, some market experts said these discussions could mark the most significant push to introduce regulatory reform for companies since the Jumpstart Our Business Startups Act was signed into law by former President Barack Obama in 2012, and build on efforts seen during Trump's first term..""The numbers are very clear that companies are staying private longer,"" Nasdaq President Nelson Griggs told Reuters. Griggs said the exchange operator has discussed making public markets more attractive with regulators in Washington but did not specify which agencies..""We need to make the public markets attractive because that is really how you democratize access to these companies. So it's a big focus of ours,"" Griggs said. Nasdaq has publicly made the case for easing burdens by using remedies such as the modernization of the process for proxy filings..In a statement to Reuters, Jaime Klima, general counsel of NYSE Group, said the exchange will ""continue to advocate for our listed companies with regulators and policymakers.”.""We strongly believe that effective and efficient regulation is key to maintaining the attractiveness of our markets,"" Klima said, without specifying any specific discussions ongoing..The SEC, led by new chairman Paul Atkins, said it is looking to ease rules that can impede capital formation..""The SEC is considering addressing regulatory burdens that undermine capital formation, including (ensuring) that initial public offerings are again something companies are eager to do,"" a spokesperson for the agency said..The SEC did not comment on specific discussions it has held with exchanges and other stakeholders.",https://finance.yahoo.com/news/exclusive-us-exchanges-sec-talks-101858903.html," The article discusses regulatory changes in U.S. exchanges aimed at easing public company regulations to encourage startups' listings. The potential risks include:  1. **Market Volatility**: Reduced disclosure requirements may decrease investor information, leading to market volatility.  2. **Transparency Concerns**: Looser regulations could reduce transparency, affecting investor confidence and market efficiency.  3. **Regulatory Gaps**: These changes might create loopholes or weaken existing safeguards against fraud, increasing financial risks for companies.  4. **Market Competition**: Increased competition from new IPOs could impact valuations and affect company stability.  5. **Investor Influence**: Making it harder for minority investors to agitate might limit their influence but also reduce their ability to impact market decisions effectively.  Overall, while the changes aim to stimulate growth, they carry risks that could undermine market integrity and investor confidence, potentially leading to increased uncertainty and financial instability."
