Datetime,headline,description,article,link,analysis
2025-06-19 22:00:00,Dan Ives' Wedbush Just Launched an ETF -- Should You Buy In?,"The Dan Ives Wedbush AI Revolution ETF invests in companies at the forefront of innovation.  A 0.75% expense ratio is pricey, but could be worth it if the Ives ETF strategy manages to outperform.  Prominent Wall Street analyst Dan Ives, a frequent voice in financial media and an expert in disruptive technologies like artificial intelligence (AI), has launched the Dan Ives Wedbush AI Revolution ETF (NYSEMKT: IVES).","The Dan Ives Wedbush AI Revolution ETF invests in companies at the forefront of innovation..The fund offers targeted exposure to large-cap tech leaders, complemented by emerging AI disruptors..A 0.75% expense ratio is pricey, but could be worth it if the Ives ETF strategy manages to outperform..10 stocks we like better than Wedbush Series Trust - Dan Ives Wedbush Ai Revolution ETF ›.Prominent Wall Street analyst Dan Ives, a frequent voice in financial media and an expert in disruptive technologies like artificial intelligence (AI), has launched the Dan Ives Wedbush AI Revolution ETF (NYSEMKT: IVES). This exchange-traded fund (ETF) offers investors a disciplined, transparent way to access his high-conviction stock picks, focusing on 30 leading companies driving the AI transformation..Over the past two decades, Ives has earned a respected reputation through bold, often accurate predictions on major technology trends, including bullish calls on companies like Apple, Palantir Technologies, and Tesla..Can this history of success be translated into a winning investing strategy, and should you buy into the Ives ETF now? Here's what you need to know to make a more informed decision..Dan Ives is a Managing Director and senior technology sector analyst at Wedbush Securities, one of the largest privately owned securities brokerages and asset managers in the United States..Leveraging his experience and proprietary research, the Dan Ives Wedbush AI Revolution ETF is based on the flagship ""AI 30 Research Report"" produced by Dan and his team. This semi-annual publication identifies companies at the forefront of AI technologies, encompassing the development and application of systems that enable machines to perform tasks traditionally requiring human intelligence..Recent advancements in the field are proving transformative to the global economy, ushering in a new paradigm of productivity and creativity by automating complex workflows and delivering predictive insights. According to Wedbush Securities, AI represents a $2 trillion market opportunity and a major secular growth runway for innovation leaders across AI software and generative AI, cloud infrastructure, specialized AI semiconductors, AI services, and related equipment..The ETF is passively managed, meaning it's not necessarily intended to beat the market but instead provides targeted exposure to a thematic index based on a basket of stocks selected through a methodological approach. The predefined investing criteria include the following:",https://finance.yahoo.com/news/dan-ives-wedbush-just-launched-140000730.html, High Risk
2025-06-19 20:00:00,Should You Forget Apple and Buy 2 Artificial Intelligence (AI) Stocks Instead?,"Apple is falling behind in the artificial intelligence field, and the business is growing slowly.  ASML and Taiwan Semiconductor can benefit from increased spending on AI computer chips.  Both semiconductor-related companies are projected to grow faster than Apple this year.","Apple is falling behind in the artificial intelligence field, and the business is growing slowly..ASML and Taiwan Semiconductor can benefit from increased spending on AI computer chips..Both semiconductor-related companies are projected to grow faster than Apple this year..10 stocks we like better than ASML ›.Apple (NASDAQ: AAPL) has been a huge winner in the smartphone era, which it pioneered with the iPhone. Now, it looks to be at risk of falling behind in the age of artificial intelligence (AI), cloud computing, and mixed reality. The tech giant failed with the launch of its Vision Pro product and has struggled to release any products related to consumer AI while the competition pushes ahead aggressively..It is time to forget Apple stock. Here's why you should buy two AI beneficiaries, Taiwan Semiconductor Manufacturing (NYSE: TSM) and ASML (NASDAQ: ASML), for your portfolio instead..Revenue growth has been stagnant at Apple for many years now. The iPhone is maturing, and while it is still a great product, there are only so many dollars floating around the world that can be dedicated to buying a smartphone. In the last decade it has released some successful ancillary products such as the Apple Watch and Air Pods, but these are not large enough to move the needle for a company with a market capitalization of $3 trillion..Management claims the company has not been resting on its laurels, but the results so far have been underwhelming. The iPhone is increasingly similar with each yearly update, minimal AI features have been added to its branded ""Apple Intelligence"" products, and the Vision Pro virtual reality headset was a flop. Other big technology companies such as Alphabet, Amazon, and Meta Platforms are pushing ahead with these cutting-edge technologies, leaving Apple in the dust..Unsurprisingly, Apple's revenue growth has slowed down quite a bit as a result. This year, analysts project just 4% revenue growth for the technology giant, which will mostly come from software and services revenue. The stock trades at an expensive price-to-earnings ratio (P/E) of 31 even though it is barely growing anymore. This leaves much to be desired with the stock's valuation. There is not much upside to owning Apple stock today versus other fast-growing technology players around the world..Speaking of fast-growing technology companies, we have ASML and Taiwan Semiconductor Manufacturing (TSMC, for short). These are two players in the computer chip and semiconductor supply chains -- suppliers to Apple, it should be noted -- that are benefiting immensely from the rising spend on AI.",https://finance.yahoo.com/news/forget-apple-buy-2-artificial-120000731.html, **Risk Classification:** Investment-specific
2025-06-19 18:30:00,Magnificent 7 May Need to Make Room for Broadcom,"Broadcom joined the trillion-dollar club late last year, and its market cap has only continued to climb since.","Broadcom joined the trillion-dollar club late last year, and its market value has continued to climb since. The software and chip company has been riding the AI wave as companies like Alphabet and Meta place orders for its custom AI chips..The tech giant’s stock doubled in each of the past two years, climbing more than 350% from the start of 2023 to yesterday’s close. With a $1.2 trillion market cap, Broadcom is the S&P 500’s seventh-most-valuable company, worth more than either Walmart or Berkshire Hathaway..Broadcom’s skyrocketing value has some Wall Streeters wondering whether it’s time for a shakeup of the Magnificent Seven, which currently includes Alphabet, Amazon, Apple, Meta, Microsoft, Nvidia and Tesla..READ ALSO: What Does Mamdani’s Primary Win Mean for New York Real Estate? and Shell Dismisses BP Takeover Talks as Mere ‘Speculation’.Analysts expect Broadcom’s sales to soar 22% this fiscal year and 21% in 2026. Broadcom reported earnings earlier this month that topped analysts’ estimates after raking in $15 billion in revenue in its most recent quarter..Nvidia is the only company in the Magnificent Seven whose sales growth surpasses Broadcom’s. In contrast, Tesla’s revenue has contracted 1% this year, and its shares have tanked. The automaker’s market cap is just above the $1 trillion mark. Four of the companies in the Magnificent Seven have seen their shares fall this year..Meanwhile, Broadcom’s business is booming, especially its AI arm:.Broadcom has a sprawling empire of technology that ranges from Wi-Fi and Bluetooth chips to cybersecurity software, but its custom AI chips now make up nearly a third of its revenue..The tech company made $4.4 billion of its revenue from AI in the second quarter (a 60% annual uptick) and expects $5.1 billion next quarter as cloud providers like Alphabet place more orders. The company predicts AI growth will continue next year..Name Games: The Magnificent Seven is a way of grouping together some of the S&P 500’s most influential companies, similar to its predecessor FAANG (made up of Facebook, Amazon, Apple, Netflix, and Google before Facebook and Google changed their names). But some experts say the purpose of these groupings is to track trends, not just the most valuable companies. If the trend investors are eyeing now is AI, then swapping Tesla out for Broadcom may not make sense since Tesla is also leveraging AI (for robotaxis and humanoid robots). Another option might be to simply expand the Magnificent 7 to a Magnificent 8..This post first appeared on The Daily Upside. To receive delivering razor sharp analysis and perspective on all things finance, economics, and markets, subscribe to our free The Daily Upside newsletter.",https://finance.yahoo.com/news/magnificent-7-may-room-broadcom-103000484.html," The article discusses Broadcom's growth as a company that has reached the trillion-dollar market cap. While this indicates strong financial health, potential risks include:  1. **Overvaluation**: As the stock continues to rise, there may be a risk of valuations becoming inflated relative to earnings, leading to market correction or value decline.  2. **Operational Risks**: Rapid expansion into new markets or acquisitions could introduce challenges such as integration issues or increased competition for resources.  3. **Revenue Diversification Risks**: Dependency on key clients or product lines could be vulnerable to downturns in specific sectors.  4. **Macroeconomic Sensitivity**: The tech sector's reliance on broader economic conditions, including interest rates and inflation, poses indirect risks affecting performance.  5. **Cybersecurity Risks**: As a major provider of semiconductors for critical infrastructure, potential vulnerabilities could result in significant impacts or reputational damage.  In summary, while Broadcom's growth is positive, these factors suggest that careful management is essential to mitigate associated risks."
2025-06-19 18:05:00,Why UBS Is the Only Wirehouse to Allow Podcasting,"For years, Mitch Slater urged UBS to let its advisors launch their own shows. Now, more than 50 advisors have them.","The future is here, and it’s now available wherever you get your podcasts..For the past several years, UBS has built out its podcasting program to help its advisors launch their own shows, expand their online reach and connect with younger audiences. The initiative is designed to help advisors connect with the next generation of wealth management clients and bring in new assets, according to Mitch Slater, executive director of digital communications for the wirehouse’s national sales. A recent report found that every dollar spent on podcasting may generate an additional dollar in new revenue, and that podcasts’ ability to attract clients increases over time..“The fact is, it’s $80 trillion being moved over from my generation to the generations below,” said Slater. “If you’re not skating to where the puck is, and the puck is [phones]… we just got to get there. To me, the podcast seems to be a really great way to do this.”.READ ALSO: Morningstar’s CEO Kunal Kapoor on Private Assets and ‘Extracting Gold’ and Succession Planning Vacuum Risks Alienating RIA Clients, Next-Gen Leaders.Podcasting in general is in its heyday, with the number of Americans who listened to one in the past month jumping to 158 million in 2025 from 135 million a year earlier, according to data from Backlinko. More than half of the US population are now monthly listeners, an important fact to consider amid the Great Wealth Transfer, Slater said..UBS is the only wirehouse that lets its advisors market their businesses via podcast, Slater said, adding that every episode, before it gets uploaded to Apple Podcasts or Spotify, is subject to regulatory approval based on the Series 9, 10 and 24 exams advisors take. Although only about 1% of UBS’s advisor workforce — roughly 60 out of 6,000 advisors — are podcasting, he expects the venture to expand quickly and said there are another 10 to 15 podcasts in the works. UBS now has dozens of podcasts that speak to such niches, including:.“Lightning in a Bottle,” a podcast led by the UBS advisors Josh Pottinger and Jason Chirogianis, which focuses on how advisors can monetize their ownership positions..“Huvane Wealth Management Conversations,” another show led by a New York-based UBS team, which focuses on portfolio strategies, taxes, next-gen investors and sustainable investing..But First, Lemme Take a Selfie (Video). Slater is also involved with the firm’s “selfie video program,” in which advisors learn how to film themselves vertically, primarily for LinkedIn. At the height of the coronavirus pandemic, he said, the videos helped calm nervous clients. “Everyone has to have some form of marketing,” Slater said. “Whether it’s podcasts, whether it’s videos, whether it’s a better LinkedIn engagement program — there’s something that’s right for everybody.”.This post first appeared on The Daily Upside. To receive financial advisor news, market insights, and practice management essentials, subscribe to our free Advisor Upside newsletter.",https://finance.yahoo.com/news/why-ubs-only-wirehouse-allow-100500233.html," The news regarding UBS allowing its Advisors to start Podcasting involves several risks.   1. **Reputational Risk**: The lack of regulation around Podcasting could lead investors to question UBS's transparency and integrity, potentially damaging their reputation.  2. **Regulatory Risks**: Without clear guidelines, UBS may face legal issues as regulations on financial promotions through media become stricter in various jurisdictions.  3. **Investor Concerns**: Advisors using Podcasting might promote unsuitable investment strategies, leading to investors making risky or incorrect decisions based on potentially biased advice.  These factors suggest that while Podcasting could offer value, the associated risks require careful management for UBS."
2025-06-19 16:50:00,Is This the Real Reason Apple Is So Far Behind Its Rivals on Artificial Intelligence?,Apple's valuation has nosedived this year as it has fallen behind its peers on next-gen technologies.  The company's researchers aren't convinced that generative artificial intelligence can reason like humans.  Apple (NASDAQ: AAPL) has disappointed investors this year.,"Apple's valuation has nosedived this year as it has fallen behind its peers on next-gen technologies..The company's researchers aren't convinced that generative artificial intelligence can reason like humans..The business has struggled to generate much growth in recent quarters..10 stocks we like better than Apple ›.Apple (NASDAQ: AAPL) has disappointed investors this year. It has delayed some artificial intelligence (AI) features for its iPhones until next year, and that has resulted in a lot of bearishness around the business as there are rival phones with advanced AI capabilities already available..Shares of Apple are down more than 21% thus far in 2025 (as of June 13), with its valuation dipping below the $3 trillion mark..AI is a hot topic these days, with consumers seeking the latest tech on their phones to help with many day-to-day tasks. However, Apple recently published a report about AI that could shed some light as to why it may not be leading the charge and investing as heavily in next-gen technologies as other tech companies..Researchers at Apple have been testing multiple AI reasoning models, and while they have seen that they can perform better than standard models, they fail as tasks become more complex..As a result, the researchers believe that there are limits to the reasoning that AI can achieve, and they don't appear to be as convinced of its abilities as the general public. They found that the models couldn't follow steps in complex tasks and appeared to rely heavily on the familiarity of data, as opposed to applying advanced reasoning skills..AI chatbots have become more sophisticated because they have been trained on existing data, but the ability for them to truly reason like humans is by no means a certainty. If Apple isn't convinced of the potential that AI possesses, that may be part of the reason it hasn't been investing as heavily in these types of technologies as its peers..Whether or not AI can reason like a human doesn't excuse the fact that Apple has fallen well behind other companies in terms of innovation. While Apple has made changes to the look and feel of its icons with its Liquid Glass design, the company's newest iPhones haven't given consumers a compelling reason to upgrade their devices. Apple's product sales over the six-month period ending March 29 have totaled $166.7 billion -- up just 2% from the same period last year. And iPhone revenue during that stretch was nearly unchanged.",https://finance.yahoo.com/news/real-reason-apple-far-behind-085000525.html, The risk associated with this news falls under **Technology - AI/ML Risks**.
2025-06-19 15:45:00,"The Best Warren Buffett Stocks to Buy With $1,000 Right Now",Amazon is using artificial intelligence to strengthen its e-commerce business.  Apple has a growing installed base of devices and is generating nearly $100 billion in annual profit.  Warren Buffett is one of the greatest investors of all time.,"Amazon is using artificial intelligence to strengthen its e-commerce business..Apple has a growing installed base of devices and is generating nearly $100 billion in annual profit..10 stocks we like better than Amazon ›.Warren Buffett is one of the greatest investors of all time. From 1965 through 2024, Buffett guided Berkshire Hathaway stock to an astounding 5,502,284% cumulative return, smashing the S&P 500 index's 39,054% return..Although Buffett will be retiring at the end of this year, Berkshire's stock holdings are full of competitively strong companies that can grow your savings. Amazon (NASDAQ: AMZN) and Apple (NASDAQ: AAPL) are dominant tech firms with millions of loyal customers. If you have $1,000 to invest right now, these are excellent stocks to anchor a well-diversified portfolio..Berkshire has held a stake in the leading e-commerce and cloud computing provider since 2019. Amazon has multiple high-margin revenue streams that make it a solid investment for a long-term investor. The stock has returned 66% over the last five years and should continue to grow in value..Amazon's e-commerce and cloud services form a potent combination. It's important to understand that e-commerce is the largest revenue driver, totaling 38% of the company's $650 billion of trailing-12-month revenue, but Amazon Web Services (AWS) generates most of the company's $71 billion of trailing operating profit..AWS is seeing strong demand for its artificial intelligence (AI) services for enterprises, but Amazon is also leveraging this technology for its e-commerce business..For example, the company uses AI to forecast demand for products and allocate its inventory where it is needed most. This ultimately leads to faster delivery speeds, satisfied customers, and greater cost efficiencies that benefit profit margin..Amazon's operating income increased 20% year over year in the first quarter. The strong growth it is seeing in other profitable businesses like advertising and third-party fulfillment services is also having an impact on Amazon's bottom line and could justify a higher share price..Berkshire still held 10 million shares of Amazon in the first quarter. The stock's price-to-earnings multiple of 35 is the lowest in over 10 years, making it a compelling buy right now..Buffett originally invested in Apple stock in 2016, and it's been one of Berkshire's most successful investments in its history. Even after Berkshire reduced its stake last year, Apple remains its largest investment.",https://finance.yahoo.com/news/best-warren-buffett-stocks-buy-074500527.html," The news regarding Warren Buffett's recommended stocks involves several risks:  1. **Selection Bias**: The advice may focus on high-growth sectors without considering all possible investment options or strategies that cater to different risk tolerances.  2. **Time Horizon Mismatch**: Buffet's long-term focus might not align with someone seeking quicker returns or needing liquidity sooner than the recommended timeframe.  3. **Market Timing Risks**: Recommendations could be based on current market conditions, which may not hold as markets shift or face unexpected downturns.  4. **Concentration Risk**: Recommendations in tech sectors can lead to overexposure if those investments underperform unexpectedly.  These risks highlight the need for careful consideration when applying such investment advice to specific amounts and time frames."
2025-06-19 12:04:00,2 Reasons to Like AAPL (and 1 Not So Much),"What a brutal six months it’s been for Apple. The stock has dropped 21.5% and now trades at $196.06, rattling many shareholders. This might have investors contemplating their next move.","What a brutal six months it’s been for Apple. The stock has dropped 21.5% and now trades at $196.06, rattling many shareholders. This might have investors contemplating their next move..Following the drawdown, is now the time to buy AAPL? Find out in our full research report, it’s free..Creator of the iPhone and App Store, Apple (NASDAQ:AAPL) is a legendary developer of consumer electronics and software..Operating margin is an important measure of profitability for Apple. It’s the portion of revenue left after accounting for all operating expenses – everything from the cost of sales we talked about earlier to salaries, product development, and administrative expenses..Apple has been a well-oiled machine over the last five years. It demonstrated elite profitability for a consumer discretionary business, boasting an average operating of 30.1%. This was especially robust given its large hardware revenue component..A company’s ROIC, or return on invested capital, shows how much operating profit it makes compared to the money it has raised (debt and equity)..We like to invest in businesses with high returns, but the trend in a company’s ROIC is what often surprises the market and moves the stock price. Fortunately, Apple’s ROIC has increased significantly over the last few years. This is a great sign when paired with its already strong returns. It could suggest its competitive advantage or profitable growth opportunities are expanding..Long-term growth reigns supreme in fundamentals, but for big tech companies, a stretched historical view may miss emerging trends in AI. Apple’s recent performance shows its demand has slowed as its annualized revenue growth of 2% over the last two years was below its five-year trend..Apple has huge potential even though it has some open questions. With the recent decline, the stock trades at 26.2× forward price-to-earnings (or $196.06 per share). Is now a good time to buy? See for yourself in our comprehensive research report, it’s free..Donald Trump’s victory in the 2024 U.S. Presidential Election sent major indices to all-time highs, but stocks have retraced as investors debate the health of the economy and the potential impact of tariffs..While this leaves much uncertainty around 2025, a few companies are poised for long-term gains regardless of the political or macroeconomic climate, like our Top 6 Stocks for this week. This is a curated list of our High Quality stocks that have generated a market-beating return of 183% over the last five years (as of March 31st 2025)..Stocks that made our list in 2020 include now familiar names such as Nvidia (+1,545% between March 2020 and March 2025) as well as under-the-radar businesses like the once-small-cap company Exlservice (+354% five-year return). Find your next big winner with StockStory today.",https://finance.yahoo.com/news/2-reasons-aapl-1-not-040438070.html, The risk category identified for the given news is Market Volatility (MV). The analysis classifies this news as having medium-term negative risks due to the decline in Apple's stock value.
