Datetime,headline,description,article,link,analysis
2025-06-14 03:21:00,"A $60 billion Visa, Mastercard slump seen as buying opportunity","(Bloomberg) -- A report that large multinational merchants are exploring ways to bypass traditional credit-card fees presents investors with an opportunity to buy shares of Mastercard Inc. and Visa Inc., according to Wall Street analysts. Most Read from BloombergShuttered NY College Has Alumni Fighting Over Its FutureTrump’s Military Parade Has Washington Bracing for Tanks and WeaponryNYC Renters Brace for Price Hikes After Broker-Fee BanDo World’s Fairs Still Matter?As Part of a $45 Billion Pus","(Bloomberg) — A report that large multinational merchants are exploring ways to bypass traditional credit-card fees presents investors with an opportunity to buy shares of Mastercard Inc. and Visa Inc., according to Wall Street analysts..Most Read from Bloomberg.Shuttered NY College Has Alumni Fighting Over Its Future.Trump’s Military Parade Has Washington Bracing for Tanks and Weaponry.NYC Renters Brace for Price Hikes After Broker-Fee Ban.Do World’s Fairs Still Matter?.As Part of a $45 Billion Push, ICE Prepares for a Vast Expansion of Detention Space.Shares of Mastercard shed as much as 6.2% Friday, while Visa lost more than 7.1% — the worst one-day drop in about two months for both stocks. Shares of other payment companies such as American Express Co., PayPal Holdings Inc. and Capital One Financial Corp. also slipped in intraday trading..The sector is being weighed down by a Wall Street Journal report citing unidentified people that Walmart Inc. and Amazon.com Inc. are among companies that have recently discussed issuing their own stablecoins in the US. In addition to large merchants, other multinational giants like airline operators and Expedia Group, Inc. have also considered issuing their own crypto tokens to bypass credit card issuers like Visa and Mastercard. Stablecoins are usually pegged to a currency like the US dollar so the tokens can be used for payments..Though the news erased more than $60 billion in market value from Visa and Mastercard combined, analysts said now is a good time to snap up the stocks at a discount..“We encourage investors to accumulate shares of Visa and Mastercard on weakness,” Andrew Jeffrey of William Blair wrote in a note, reiterating outperform ratings on both companies..Jeffrey said stablecoins are still not very suitable for business-to-consumer commerce, “even as merchants view them as a potential means of lowering card acceptance costs.”.Consumers are accustomed to using credit and debit cards, habits that won’t soon change, he said, adding that a lack of stablecoin standards can also limit its use. Bloomberg Intelligence’s Diksha Gera said that Friday’s share declines reflect fears that stablecoins could erode volume share and margin, but it’s a premature worry..“Visa and Mastercard have proactively integrated stablecoin capabilities, while lingering trust and regulatory hurdles, along with a prolonged adoption curve by consumers, might impede widespread adoption,” Gera wrote in a note..BMO Capital Markets analyst Rufus Hone agrees that broad-based stablecoin adoption within consumer payments is an unlikely outcome, but said even if the tokens are adopted, Visa and Mastercard are poised to benefit.",https://finance.yahoo.com/news/60-billion-visa-mastercard-slump-184854735.html,Operational Risk Market Risk Regulatory Risk 
2025-06-14 01:27:00,PayPal Holdings (NasdaqGS:PYPL) Expands Insurance Payment Solutions With Input 1 Partnership,"PayPal Holdings (NasdaqGS:PYPL) recently announced a collaboration with Input 1 to integrate its Digital Wallet for insurance premium payments, enhancing user payment convenience and security. During the last quarter, the company's stock price increased by 9%. This rise was likely influenced by several strategic partnerships, including Selfbook for hotel bookings and a Mastercard collaboration, enhancing PayPal's service integration and brand reach. Despite market volatility due to...","PayPal Holdings recently announced a collaboration with Input 1 to integrate its Digital Wallet for insurance premium payments, enhancing user payment convenience and security. During the last quarter, the company's stock price increased by 9%. This rise was likely influenced by several strategic partnerships, including Selfbook for hotel bookings and a Mastercard collaboration, enhancing PayPal's service integration and brand reach. Despite market volatility due to geopolitical tensions and fluctuating oil prices impacting broader indices, these developments in PayPal's business activities supported the company's positive stock performance alongside market trends..Buy, Hold or Sell PayPal Holdings? View our complete analysis and fair value estimate and you decide..The latest GPUs need a type of rare earth metal called Neodymium and there are only 24 companies in the world exploring or producing it. Find the list for free..The recent developments at PayPal Holdings, including the collaboration with Input 1, could further facilitate the company's progression towards becoming a comprehensive commerce platform. As PayPal integrates its Digital Wallet for insurance premium payments, user convenience and security are enhanced, potentially driving transaction volumes and strengthening merchant relationships. This move complements PayPal’s ongoing transformation initiatives, which focus on expanding its branded experiences, Venmo benefits, and other value-added services, potentially improving both revenue and earnings in upcoming quarters..Over the last year, which ended on 13th June 2025, PayPal’s total return, combining share price and dividends, reached 21.56%. This performance contrasts with a 1-year underperformance relative to the US Diversified Financial industry, which returned 24.5%. Despite the stock overshadowing the broader US market's one-year return, this discrepancy highlights a complex competitive landscape..The boost in PayPal’s stock price in the recent quarter, driven by collaborations with Selfbook and Mastercard, aligns with analysts forecasting revenue growth at a compound annual rate of 5.7% over the next three years. Analysts foresee earnings growth to US$5.5 billion by 2028, slightly above the current revenue of 31.89 billion and earnings of 4.55 billion. However, these projections are sensitive to macroeconomic challenges and regulatory changes that could impact PayPal’s financial trajectory..The company's current share price of US$68.05, which represents a discount of around 9% to the consensus price target of US$81.74, suggests potential upside, provided that PayPal continues to leverage its commerce platform to enhance earnings and revenue growth effectively. This target reflects expectations of a price-to-earnings ratio alignment with the industry average, offering a potentially compelling case for investors if forecast assumptions materialize as expected.",https://finance.yahoo.com/news/paypal-holdings-nasdaqgs-pypl-expands-172756076.html,No risk.
2025-06-14 00:38:00,Visa's Fintech Expansion: A New Era of Scalable Digital Payments?,V expands fintech ties and platforms as Q2 growth in digital payments signals a shift toward scalable innovation.,"Visa Inc. V focuses on sharpening its edge in the digital payments space through robust and growing fintech partnerships, acquisitions and platform building. It is redefining its role from a card network to a vital technology partner in the ever-changing payments landscape. The company saw impressive growth in payment volume during the second quarter of fiscal 2025, resulting from its partnerships with fintech companies and the increase in consumer spending on its app-based platforms..In fiscal 2023, Visa’s payment volume rose 9% year over year on a constant-dollar basis, which grew 8% year over year in fiscal 2024, followed by an 8% increase in the second quarter of fiscal 2025. In the same quarter, processed transactions grew 9% year over year. Our model suggests a 9.9% year-over-year increase in processed transactions in fiscal 2025..Visa extended its partnership with TabaPay, which is serving over 6,500 fintechs and businesses. With Visa Direct, the company introduced push-to-account and wallet features alongside the existing push-to-card option. It also launched a new program, Visa Commercial Integrated Partners, designed to improve connectivity between fintechs and Visa Commercial products..Visa’s proactive strategies reflect its active move to shape the new era of payments. As the demand for digital payment rises globally, the company’s position as a flexible infrastructure partner might be its valuable long-term advantage..Some of V’s competitors in the fintech payments space are Mastercard Incorporated MA and PayPal Holdings, Inc. PYPL..Mastercard reported a 15% Y/Y increase in cross-border volumes in the first quarter of 2025. In the same quarter, its payment network net revenues grew 13% year over year. Mastercard projects adjusted net revenues to witness low-teens growth in 2025..PayPal Holdings’ total payment volume increased 3% year over year in the first quarter of 2025. The company’s payment transactions decreased 7% year over year in the same quarter. PayPal Holdings anticipates the transaction margin to be in the range of $15.2-$15.4 billion in 2025..Shares of Visa have jumped 12.3% in the year-to-date period, outperforming the 8.5% growth of the industry..Image Source: Zacks Investment Research.From a valuation standpoint, V trades at a forward price-to-earnings ratio of 30.1, above the industry average of 23.7. V carries a Value Score of D..Image Source: Zacks Investment Research.The Zacks Consensus Estimate for Visa’s fiscal 2025 earnings implies a 12.9% jump from the year-ago period. It witnessed 11 upward estimate revisions in the past 60 days against one downward movement.",https://finance.yahoo.com/news/visas-fintech-expansion-era-scalable-163800055.html,No risk.
2025-06-14 00:25:00,Moderately bullish activity in PayPal with shares up 0.48%,"Moderately bullish activity in PayPal (PYPL), with shares up 36c, or 0.48%, near $74.97. Options volume relatively light with 14k contracts traded and calls leading puts for a put/call ratio of 0.44, compared to a typical level near 0.55. Implied volatility (IV30) is higher by 0.1 points near 28.01,in the lowest 10% of observations over the past year, suggesting an expected daily move of $1.32. Put-call skew flattened, suggesting a modestly bullish tone. Published first on TheFly – the ultimate","Moderately bullish activity in PayPal (PYPL), with shares up 36c, or 0.48%, near $74.97. Options volume relatively light with 14k contracts traded and calls leading puts for a put/call ratio of 0.44, compared to a typical level near 0.55. Implied volatility (IV30) is higher by 0.1 points near 28.01,in the lowest 10% of observations over the past year, suggesting an expected daily move of $1.32. Put-call skew flattened, suggesting a modestly bullish tone..Easily unpack a company's performance  with TipRanks' new KPI Data for smart investment decisions.Receive undervalued, market resilient stocks right to your inbox  with TipRanks' Smart Value Newsletter.Published first on TheFly – the ultimate source for real-time, market-moving breaking financial news. Try Now>>.See today’s best-performing stocks on TipRanks >>.Read More on PYPL:.Disclaimer & DisclosureReport an Issue.Chime Stock (CHYM) Surges 52% in Market Debut.PayPal plans to make its stablecoin available on the Stellar network.PayPal Stockholders Approve Key Proposals at Annual Meeting.PayPal named commerce partner by Selfbook.Nvidia, Microsoft, AT&T, PayPal, Walmart: Major Stock Moves!",https://finance.yahoo.com/news/moderately-bullish-activity-paypal-shares-162507572.html,No risk.
2025-06-13 20:05:00,"Why Salesforce, PayPal, and Team Car Care leaders call AI agents a game changer for finance","""With the right framework, the potential applications are limitless,"" says PayPal's Jamie Miller.","Good morning. We’re only in the early stages of exploring the capabilities and applications of AI agents in finance..That was a key takeaway from Fortune’s Emerging CFO event on Thursday, held in partnership with Workday, a sponsor of CFO Daily. My colleague Geoff Colvin and I spoke with Silvio Savarese, EVP and chief scientist at Salesforce AI Research; Jamie Miller, chief financial and operating officer at PayPal; and Matt Castonguay, CFO at Team Car Care, about how their companies are leveraging this technology..“AI agents can act as workflow and workforce multipliers for humans—like having a fleet of agents at your disposal, 24/7,” Savarese said. He described four key components of an agent: memory (for retaining and using information), a brain (for reasoning and planning), actuators (for executing actions via APIs), and sensors or interfaces (for communicating with the outside world)..In finance, Savarese explained, agents can automate and personalize customer interactions in retail banking, streamline processes like mortgage lending, and improve customer satisfaction with faster approvals. He added that agents will soon be able to communicate with each other, requiring new protocols for secure interactions. As compliance frameworks for agentic AI are still evolving, Savarese advised finance leaders to work with legal and risk teams to develop internal policies aligned with upcoming AI accountability standards..At PayPal, Miller said the company targets use cases involving high-volume manual work, such as invoice processing and accruals. Agents can harmonize data from multiple formats and automate tasks like travel and expense compliance by auditing receipts and making recommendations. “As CFOs, we’re responsible for financial statements and compliance, so it’s critical to have the right checks, balances, and oversight,” Miller said. “With the right framework, the potential applications are limitless.”.Castonguay shared that Team Car Care, operator and franchisee of the Jiffy Lube brand, is focused on automating high-volume manual tasks such as accounting reconciliations and store support. The company is deploying an agent to help reconcile inventory transactions, a data-intensive process. Processing that much data has been a challenge, he said. “But it’s promising, and we expect to see ROI soon,” he added..This work requires data-focused accountants who understand both the process and how the agent operates. And it requires all the team members to bring ideas to the table. “Whether it’s in Salesforce, whether it’s in Workday, whether it’s in a native third party tool—how can we leverage the use cases and the technology?” Castonguay said.",https://finance.yahoo.com/news/why-salesforce-paypal-team-car-120545514.html,No risk.
2025-06-12 23:46:00,Affirm's Active Merchants Rise: A Strategic Advantage in BNPL Space?,AFRM's merchant count hits 358K with strong GMV growth and global expansion fueling its BNPL momentum.,"Affirm Holdings, Inc. AFRM is primarily focusing on growth and merchant expansion. It is strengthening its position in the competitive market of Buy Now Pay Later (BNPL) through merchant adoptions on its platform. The company has extended its footprint into the U.K. market, indicating its major expansion outside North America..AFRM has reported more than 254,000 active merchants in fiscal 2023, which increased about 19.3% year over year in fiscal 2024, followed by 23% year-over-year growth in third-quarter fiscal 2025. At the end of the third quarter of fiscal 2025, it reached around 358,000 active merchants..With the increasing participation of merchants, customers are provided with more checkout opportunities, which significantly boosts the gross merchandise volume (GMV). In the fiscal third quarter of 2025, Affirm’s GMV jumped 36% year over year, reaching $8.6 billion. The company projects GMV to be in the range of $35.7-$36 billion in fiscal 2025..Affirm is focusing on providing transparent and reliable checkouts without any hidden charges. In the fiscal third quarter of 2025, its merchant network revenues rose 34.3% year over year. The company's strategic partnerships with major players are helping in driving growth. Affirm aims to boost its product lineup by introducing more flexible payment options, enhancing point-of-sale integrations and expanding its offline retail capabilities. It also focuses on innovative credit modeling that supports sustainable and long-term growth..Some of AFRM’s competitors in the payment solutions space are PayPal Holdings, Inc. PYPL and Sezzle Inc. SEZL..PayPal reported 436 million active accounts in the first quarter of 2025, which rose 2% year over year. Its net revenues increased 1% year over year to $7.8 billion in first-quarter 2025. PayPal’s total payment volume increased 3% year over year in the first quarter of 2025..Sezzle reported 2.7 million active consumers in the first quarter of 2025, which grew 5.4% year over year. Sezzle’s total revenues grew 123.3% year over year to $104.9 million in the same quarter. Its gross merchandise volume increased 64.1% year over year..Over the past year, AFRM’s shares have surged 90% compared with the industry’s growth of 37.4%..Image Source: Zacks Investment Research.From a valuation standpoint, AFRM trades at a forward price-to-sales ratio of 5.25, below the industry average of 5.68. The company carries a Value Score of F..Image Source: Zacks Investment Research",https://finance.yahoo.com/news/affirms-active-merchants-rise-strategic-154600372.html,No risk.
2025-06-12 21:05:00,PayPal plans to make its stablecoin available on the Stellar network,"PayPal (PYPL) announced plans to make the PayPal USD stablecoin available on the Stellar network pending regulatory approval by the New York State Department of Financial Services, or NYDFS. Stellar is a blockchain designed for fast, low-cost payments and real-world utility. By potentially expanding to Stellar, PYUSD leverages the network’s speed, low transaction costs, and ease of integration to enhance its utility for real-world payments, commerce, and micro-financing, offering an additional o","PayPal (PYPL) announced plans to make the PayPal USD stablecoin available on the Stellar network pending regulatory approval by the New York State Department of Financial Services, or NYDFS. Stellar is a blockchain designed for fast, low-cost payments and real-world utility. By potentially expanding to Stellar, PYUSD leverages the network’s speed, low transaction costs, and ease of integration to enhance its utility for real-world payments, commerce, and micro-financing, offering an additional option to Ethereum and Solana. PYUSD on Stellar can be used for fast, affordable cross-border payments and expanded access to essential financial services while bridging the digital and physical world with a vast array of on and off ramps. Users may also benefit from improved daily payment options and financing solutions such as working capital and business loans – use cases already thriving on the Stellar network – ultimately enabling a more seamless flow of value across global markets..Easily unpack a company's performance  with TipRanks' new KPI Data for smart investment decisions.Receive undervalued, market resilient stocks right to your inbox  with TipRanks' Smart Value Newsletter.Published first on TheFly – the ultimate source for real-time, market-moving breaking financial news. Try Now>>.See today’s best-performing stocks on TipRanks >>.Read More on PYPL:.Disclaimer & DisclosureReport an Issue.PayPal Stockholders Approve Key Proposals at Annual Meeting.PayPal named commerce partner by Selfbook.Nvidia, Microsoft, AT&T, PayPal, Walmart: Major Stock Moves!.Buy/Sell: Wall Street’s top 10 stock calls this week.Perplexity AI Reports Explosive Growth as Users Look for Browser Alternatives",https://finance.yahoo.com/news/paypal-plans-stablecoin-available-stellar-130546330.html,Regulatory Risk Technology Risk Operational Risk Reputation Risk 
2025-06-12 19:52:00,PayPal seeks to launch USD stablecoin on Stellar,"The integration is expected to enhance PYUSD's utility for various financial operations, including micro-financing.","PayPal has revealed plans to make its USD stablecoin, PYUSD, available on the Stellar network, pending regulatory approval from the New York State Department of Financial Services..The deployment is intended to capitalise on the network's attributes, including “fast, low-cost payments” to facilitate payments and financial services, the payments firm said in a statement..The Stellar network is known for its “speed, low transaction costs”, which could be leveraged by PYUSD to provide an alternative to networks such as Ethereum and Solana..The integration is expected to enhance PYUSD's utility for various financial operations, including cross-border payments and micro-financing..PYUSD users would gain access to Stellar's network of entry and exit points, aiming to improve the usability of the stablecoin for everyday financial transactions..This includes services from payments to remittances and merchant services..Additionally, PYUSD on Stellar could offer new liquidity and financing opportunities through Payment Financing or 'PayFi'..This allows for instant settlement on the Stellar network, which businesses could use for operational needs such as paying suppliers or managing inventory..Blockchain, Cryptocurrency, and Digital Currency Group vice president May Zabaneh said: “As we see cross border payments being a key area where digital currencies can provide real world value, working with Stellar will help advance the use of this technology and provide benefits for all users."".Stellar Development Foundation CEO Denelle Dixon stated: “By bringing PYUSD to 170+ countries, we're transforming stablecoins into practical financial tools that millions of everyday users and merchants can actually use. Together, we are bringing stable digital currency to small businesses and individuals in emerging markets all over the globe."".This announcement follows a recent partnership between Mastercard and PayPal, which aims to expand payment choices for users at checkout..""PayPal seeks to launch USD stablecoin on Stellar "" was originally created and published by Electronic Payments International, a GlobalData owned brand... .The information on this site has been included in good faith for general informational purposes only. It is not intended to amount to advice on which you should rely, and we give no representation, warranty or guarantee, whether express or implied as to its accuracy or completeness. You must obtain professional or specialist advice before taking, or refraining from, any action on the basis of the content on our site.",https://finance.yahoo.com/news/paypal-seeks-launch-usd-stablecoin-115203329.html,Operational Risk Regulatory Risk Market Risk Technological Risk Reputational Risk 
2025-06-11 21:00:00,"PayPal Brings Its Stablecoin to Stellar for Cross-Border Remittances, Payments Financing","PayPal USD (PYUSD) plans to use Stellar for new payments and remittance use cases, as well as bringing PayFi options to millions of users and merchants.","PayPal (PYPL) is bringing its PYUSD stablecoin to the Stellar blockchain network to strengthen the dollar-pegged token's position in cross-border remittances and payment financing, the companies said on Wednesday..PYUSD, which already operates on Ethereum and Solana, will expand to Stellar to explore new areas like payment financing, or ""PayFi"". This allows small and medium-sized businesses that face delayed receivables or pre-funding requirements to access new sources of real-time working capital, disbursed in PYUSD, according to a press release..That capital can be used to pay suppliers, manage inventory or address other operational needs with instant settlement on Stellar, the companies said..Stablecoins, digital tokens whose value is pegged to a real-world asset, rose to popularity as a way to trade in and out of cryptocurrencies without having to convert to fiat cash. More recently, much of the action has been on the rapid growth of cross border remittances and other innovations within the payments arena..""For years, stablecoins have been deemed crypto’s ‘killer app’ by combining the power of the blockchain with the stability of fiat currency. As we see cross border payments being a key area where digital currencies can provide real world value, working with Stellar will help advance the use of this technology and provide benefits for all users,"" said May Zabaneh, PayPal's vice president for blockchain, cryptocurrency and digital currencies..The partnership announcement has been approved by the New York Department of Financial Services (NYDFS), which requires a final review of the product integration before going live, Stellar said via email.",https://finance.yahoo.com/news/paypal-brings-stablecoin-stellar-cross-130000446.html,Operational Risk Market Risk Technology Risk Regulatory Risk Reputation Risk 
