Datetime,headline,description,article,link,analysis
2025-05-05 18:30:00,Better Growth Stock: PayPal vs. SoFi Technologies,"PayPal and SoFi Technologies each reported better-than-expected first-quarter earnings.  PayPal's efforts to improve profitability appear to be working, while SoFi is capitalizing on an expanding lineup of offerings.  One of these fintech leaders offers a stronger growth outlook, which could be the key for its stock to outperform.","PayPal and SoFi Technologies each reported better-than-expected first-quarter earnings..PayPal's efforts to improve profitability appear to be working, while SoFi is capitalizing on an expanding lineup of offerings..One of these fintech leaders offers a stronger growth outlook, which could be the key for its stock to outperform..Companies using technology to disrupt the traditional financial services sector stand to capitalize on a significant growth opportunity. PayPal (NASDAQ: PYPL) and SoFi Technologies (NASDAQ: SOFI) are recognized as fintech leaders that have found success in carving out distinct niches within the evolving landscape..Despite their volatile stock prices during the past year, both companies' strong product innovation and ongoing expansion efforts position them to reward shareholders over the long run..Where to invest $1,000 right now? Our analyst team just revealed what they believe are the 10 best stocks to buy right now. Continue ».Let's discuss which of these fintech growth stocks is the better buy for your portfolio right now..With a history spanning more than two decades, PayPal pioneered online payment processing as an early disruptor to legacy banking systems. Today, the company facilitates transactions for 436 million active customers in more than 200 countries. PayPal has evolved by focusing on differentiated and value-added solutions to drive profitability rather than emphasizing user growth and low-margin activities. The strategy appears to be working..In the recently reported first quarter, even as the number of total payment transactions declined by 7% year over year, the company's key performance metric of total payment volume (TPV) climbed by 3% year over year, generating a 7% increase in transaction margin..Branded checkout, representing payment experiences where PayPal's brand or the Venmo platform are central to the transaction, has been a key part of the TPV growth. PayPal is also seeing traction in its market with its merchant-oriented payment service provider (PSP) offerings. Even more impressive was the 23% increase in adjusted earnings per share (EPS) compared to the prior-year quarter..Management expects the trends to continue, targeting full-year transaction margin growth between 4% and 5%, alongside a 6% to 10% increase in adjusted EPS over 2024. Where PayPal shines as a growth stock, and part of its allure as an investment opportunity next to SoFi Technologies, is its attractive valuation. Shares of PayPal trade at a forward price-to-earnings (P/E) ratio of just 13 based on analysts' average estimated 2025 EPS. That's well below SoFi's forward P/E of 44.",https://finance.yahoo.com/news/better-growth-stock-paypal-vs-103000185.html,No risk.
2025-05-05 06:15:00,Was Jim Cramer Right About PayPal (PYPL)?,"We recently published a list of Did Jim Cramer Hit or Miss On These 13 Stock Predictions? In this article, we are going to take a look at where PayPal Holdings, Inc. (NASDAQ:PYPL) stands against other stocks that Jim Cramer discussed during the episode of Mad Money on May 1st, 2024. During the Mad Money episode […]","We recently published a list of Did Jim Cramer Hit or Miss On These 13 Stock Predictions? In this article, we are going to take a look at where PayPal Holdings, Inc. (NASDAQ:PYPL) stands against other stocks that Jim Cramer discussed during the episode of Mad Money on May 1st, 2024..During the Mad Money episode which aired on Tuesday, Jim Cramer discussed how stock ownership is viewed in the United States, saying:.“Alright, look, lately, we can’t go a day without hearing some widespread misperceptions about stock ownership. I gotta tell you, I think it’s infuriating. Here we are celebrating the 20th anniversary of Mad Money, dedicated to the proposition that you can potentially make lots of money by picking individual stocks, yet I keep hearing that most Americans don’t care about the stock market, and this direction means nothing.”.READ ALSO:  How Did Jim Cramer’s 12 Bold Predictions Play Out? and Did Jim Cramer Nail All These 9 Stock Predictions?.Jim Cramer challenged the idea that the stock market only serves the wealthy, calling it a flawed and dismissive perspective that overlooks the financial involvement of millions of ordinary Americans, saying:.“It’s the whole reason anyone watches the darn show, and it generally matters, not just to the rich, but to tens of millions of regular people, home gamers, and never let any politician tell you otherwise. […] More than 60% of Americans have some exposure to the market, either directly or indirectly. 70 million people have active 401Ks. Millions more have retired with them. 60 million people have IRAs. Only 156 million people voted in November. I mean, we’re talking half the electorate here.”.Cramer argued that stockholders make up a major segment of the population and should not be ignored. He stated, “It’s not just arrogant, rich people who own stocks.” He also criticized affluent individuals who caution others against investing in stocks while continuing to benefit from their tax advantages. As he put it:.“Now look, stocks are ridiculously tax advantaged, more than just rich people want that. In a world where probably no more than 10% of this country can retire on their paycheck savings, stocks represent a different kind of social security, a one-sided pack where people try to save and the government dismisses them.”.For this article, we compiled a list of 13 stocks that were discussed by Jim Cramer during the episode of Mad Money on May 1st, 2024. We then calculated their performance from May 1st, 2024, market close to April 30th, 2025, market close. We have also included the hedge fund sentiment for the stocks, which we sourced from Insider Monkey’s Q4 2024 database of over 900 hedge funds. The stocks are listed in the order that Cramer mentioned them.",https://finance.yahoo.com/news/jim-cramer-paypal-pypl-221506165.html,No risk.
2025-05-04 18:00:00,Here's How the Coinbase-PayPal Stablecoin Deal Could Rock Crypto,Stablecoin growth translates to increased mainstream crypto adoption.,"Coinbase is teaming up with PayPal to promote its PayPal USD stablecoin..Mixing Coinbase's crypto credentials with PayPal's huge payment network could mean more crypto adoption..PayPal USD lags behind other stablecoins, but it has big plans..Coinbase (NASDAQ: COIN) and PayPal (NASDAQ: PYPL) have teamed up to make the payment giant's stablecoin, PayPal USD (CRYPTO: PYUSD), easier to buy and use. Coinbase is one of the leading U.S. crypto exchanges, and PayPal is a major player in e-commerce and online payments..Stablecoins are cryptocurrencies that are pegged to real-world assets such as the U.S. dollar. As such, they offer a blockchain-based payment method that doesn't suffer from crypto's usual volatility. There's fierce competition for market share among the various stablecoins, and PayPal's Coinbase deal could give it a serious leg up..Where to invest $1,000 right now? Our analyst team just revealed what they believe are the 10 best stocks to buy right now. Continue ».Let's look at why the deal matters and how increased stablecoin usage is good for the wider crypto ecosystem..On April 24, Coinbase and PayPal said they had deepened their partnership to increase the adoption of the PYUSD stablecoin. PayPal wants to integrate PYUSD into more of its products to make payments cheaper and faster for merchants..The deal means:.You can now buy PayPal USD fee-free on Coinbase..You can convert PayPal USD directly into U.S. dollars..For crypto investors, one important part of the deal is that the two companies plan to collaborate on ways to use PYUSD in decentralized finance (DeFi). DeFi allows people to manage money without relying on intermediaries like banks. An example would be earning interest through peer-to-peer lending..Increased adoption of DeFi is somewhat of a work in progress. It's hampered by various issues, from limited utility to security and regulatory concerns. It could be a real-world use case for cryptocurrency, but it has a long way to go before people trust it with their cash..PayPal introduced its dollar-pegged stablecoin in 2023, but it has yet to take significant market share from current leaders, Circle's USDC and Tether. This deal increases PayPal's potential to disrupt the status quo and become a serious player in the stablecoin race..Stablecoins are a significant force in the crypto world. According to CEX.IO, stablecoin transfer volume reached $27.6 trillion in 2024 -- more than the combined volume of Visa and Mastercard. Stablecoins bring many of the advantages of blockchain technology, such as speedy, low-cost transactions, without the volatility of other cryptocurrencies.",https://finance.yahoo.com/news/heres-coinbase-paypal-stablecoin-deal-100000687.html,No risk.
2025-05-03 22:16:00,SEC Closes PayPal PYUSD Probe As Rollback Of Gensler-Era Crypto Enforcement Barrage Continues,PayPal has said the SEC has dropped its investigation of PYUSD. The decision offers another insight into the current SEC’s stance on stablecoins. PayPal is looking to make strides in the cryptocurrency industry with PYUSD as the focus. During Gary ...,"Benzinga and Yahoo Finance LLC may earn commission or revenue on some items through the links below..PayPal has said the SEC has dropped its investigation of PYUSD..The decision offers another insight into the current SEC’s stance on stablecoins..PayPal is looking to make strides in the cryptocurrency industry with PYUSD as the focus..During Gary Gensler‘s tenure as chair of the Securities and Exchange Commission, the agency launched several cryptocurrency-related enforcement actions and investigations, arguing that most cryptocurrencies were unregistered securities..However, in the months following Gensler’s departure, the SEC has paused and dismissed cryptocurrency-related enforcement actions and investigations as part of a broader pro-crypto shift under President Donald Trump..In the latest instance, PayPal (NASDAQ:PYPL) said that the SEC has ended a probe of its dollar-backed stablecoin product, PayPal USD or PYUSD..Don't Miss:.Trade crypto futures on Plus500 with up to $200 in bonuses — no wallets, just price speculation and free paper trading to practice different strategies..Grow your IRA or 401(k) with Crypto – unlock  the power of alternative investments including a Crypto IRA within your retirement account..In a Tuesday regulatory filing, PayPal said the SEC closed its investigation of PYUSD “without enforcement action.”.PayPal first received notice of the probe in November 2023. At the time, the SEC sent a subpoena requesting “the production of documents” tied to PYUSD, the firm said, without specifying what documents the agency requested..The decision to drop the PYUSD probe offers another indication of the current SEC’s stance on stablecoins..In an April 4 statement, SEC Division of Corporation Finance staff issued guidance stating that it did not view fully backed dollar-pegged stablecoins marketed for payments and not for interest or yield as security offerings..At the same time, the move is a significantly positive development for PayPal as the firm shows a renewed desire to make inroads into the cryptocurrency space through PYUSD..Trending: New to crypto? Get up to $400 in rewards for successfully completing short educational courses and making your first qualifying trade on Coinbase..“We’re moving quickly to bring the benefits of crypto and stablecoins to our customers and the industry,” PayPal CEO Alex Chriss said during the firm’s Q1 earnings call on Tuesday..Indeed, last week, the firm unveiled a loyalty offering for U.S. users holding PYUSD in their PayPal and Venmo wallets, offering 3.7% annual rewards.",https://finance.yahoo.com/news/sec-closes-paypal-pyusd-probe-141654440.html,No risk.
2025-05-03 21:00:00,PayPal Holdings (NASDAQ:PYPL) investors are sitting on a loss of 54% if they invested five years ago,We think intelligent long term investing is the way to go. But along the way some stocks are going to perform badly...,"We think intelligent long term investing is the way to go. But along the way some stocks are going to perform badly. For example the PayPal Holdings, Inc. (NASDAQ:PYPL) share price dropped 54% over five years. That is extremely sub-optimal, to say the least. Furthermore, it's down 24% in about a quarter. That's not much fun for holders. This could be related to the recent financial results - you can catch up on the most recent data by reading our company report..Since shareholders are down over the longer term, lets look at the underlying fundamentals over the that time and see if they've been consistent with returns..AI is about to change healthcare. These 20 stocks are working on everything from early diagnostics to drug discovery. The best part - they are all under $10bn in marketcap - there is still time to get in early..To quote Buffett, 'Ships will sail around the world but the Flat Earth Society will flourish. There will continue to be wide discrepancies between price and value in the marketplace...' One way to examine how market sentiment has changed over time is to look at the interaction between a company's share price and its earnings per share (EPS)..While the share price declined over five years, PayPal Holdings actually managed to increase EPS by an average of 24% per year. Given the share price reaction, one might suspect that EPS is not a good guide to the business performance during the period (perhaps due to a one-off loss or gain). Or possibly, the market was previously very optimistic, so the stock has disappointed, despite improving EPS..Because of the sharp contrast between the EPS growth rate and the share price growth, we're inclined to look to other metrics to understand the changing market sentiment around the stock..In contrast to the share price, revenue has actually increased by 10% a year in the five year period. So it seems one might have to take closer look at the fundamentals to understand why the share price languishes. After all, there may be an opportunity..You can see below how earnings and revenue have changed over time (discover the exact values by clicking on the image)..It's probably worth noting that the CEO is paid less than the median at similar sized companies. But while CEO remuneration is always worth checking, the really important question is whether the company can grow earnings going forward. This free report showing analyst forecasts should help you form a view on PayPal Holdings.PayPal Holdings shareholders are up 2.3% for the year. Unfortunately this falls short of the market return. On the bright side, that's still a gain, and it is certainly better than the yearly loss of about 9% endured over half a decade. It could well be that the business is stabilizing. Most investors take the time to check the data on insider transactions. You can  click here to see if insiders have been buying or selling.",https://finance.yahoo.com/news/paypal-holdings-nasdaq-pypl-investors-130017107.html,Investment Risk
2025-05-03 16:23:00,Does PayPal Stock Look Poised for a Turnaround?,"PayPal is looking to transform itself into a commerce platform.  The company showed solid signs of a turnaround in Q1.  PayPal (NASDAQ: PYPL) has had a tough start to 2025, with its shares down more than 20%.","PayPal is looking to transform itself into a commerce platform..The company showed solid signs of a turnaround in Q1..The stock is cheap, making it an attractive investment option..PayPal (NASDAQ: PYPL) has had a tough start to 2025, with its shares down more than 20%. However, the company recently turned in solid Q1 results and issued upbeat guidance while laying out its growth strategy for this year..With its stock still beaten down, let's dig into its more recent report to see if a turnaround is near..Where to invest $1,000 right now? Our analyst team just revealed what they believe are the 10 best stocks to buy right now. Continue ».Above all else, PayPal CEO Alex Chriss is looking to transform PayPal from a payments company to a commerce platform that just doesn't facilitate transactions but helps merchants attract and retain customers. This includes helping customers discover new products based on a personalized shopping experience, suggesting the best payment options, and post-transaction engagement..It has a number of product initiatives on this front, including a smart wallet that can automatically apply available discounts, cash back, or loyalty programs. Its Fastlane solution, meanwhile, allows customers to check out with just a single tap without having to set up individual accounts at different merchants. It also has a commerce API that gives merchants access to PayPal's consumer profiles so that merchants can personalize product recommendations and offers. All these solutions are aimed at improving conversion rates for merchants to help them improve their sales..One of Chriss' main priorities since taking over has been to emphasize profitability rather than low-margin revenue growth. This could be seen in the company's Q1 results. Revenue rose just 1% to $7.79 billion, but adjusted earnings per share (EPS) climbed 23% to $1.33. Analysts were looking for adjusted EPS of $1.16 on revenue of $7.85 billion, as compiled by LSEG..Transaction margin dollars, which are similar to gross profits, climbed 7% to $3.72 billion. This has been one of the most closely watched metrics for the company as it moves away from just trying to grow revenue to trying to grow profitably..Total payment volume (TPV), which is the payment volume that runs through its system, rose 4% to $417.2 billion. PayPal branded checkout TPV continues to show solid, steady growth, rising 4% on a constant currency basis, or 6% when adjusted for Leap Day..Payment transactions fell by 7% to 6 billion, while payment transactions per active account slid 1% to 59.4 on a trailing-12-month basis. Part of the reason behind this decline is that the company has raised prices on its unbranded BrainTree segment in order to ""price to value,"" which has lowered the segment's number of transactions. BrainTree tends to serve high-volume, large platforms, so any customer loss hits total transaction volumes.",https://finance.yahoo.com/news/does-paypal-stock-look-poised-082300025.html,Market Risk
2025-05-02 21:40:00,Why This 1 Value Stock Could Be a Great Addition to Your Portfolio,"Wondering how to pick strong, market-beating stocks for your investment portfolio? Look no further than the Zacks Style Scores.","It doesn't matter your age or experience: taking full advantage of the stock market and investing with confidence are common goals for all investors..While you may have an investing style you rely on, finding great stocks is made easier with the Zacks Style Scores. These are complementary indicators that rate stocks based on value, growth, and/or momentum characteristics..Different than growth or momentum investors, value-focused investors are all about finding good stocks at good prices, and discovering which companies are trading under what their true value is before the broader market catches on. The Value Style Score utilizes ratios like P/E, PEG, Price/Sales, and Price/Cash Flow to help pick out the most attractive and discounted stocks..PayPal has emerged as one of the largest online payment solutions providers on the back of its strong product portfolio and two-sided platform that enables it to offer smooth and secure transaction facility to both customers and merchants..PYPL boasts a Value Style Score of B and VGM Score of A, and holds a Zacks Rank #3 (Hold) rating. Shares of Paypal are trading at a forward earnings multiple of 12.9X, as well as a PEG Ratio of 1.1, a Price/Cash Flow ratio of 11.7X, and a Price/Sales ratio of 2X..A company's earnings performance is important for value investors as well. For fiscal 2025, nine analysts revised their earnings estimate higher in the last 60 days for PYPL, while the Zacks Consensus Estimate has increased $0.03 to $5.05 per share. PYPL also holds an average earnings surprise of 14%..With strong valuation and earnings metrics, a good Zacks Rank, and top-tier Value and VGM Style Scores, investors should strongly think about adding PYPL to their portfolios..Want the latest recommendations from Zacks Investment Research? Today, you can download 7 Best Stocks for the Next 30 Days. Click to get this free report.PayPal Holdings, Inc. (PYPL) : Free Stock Analysis Report.This article originally published on Zacks Investment Research (zacks.com)..Zacks Investment Research",https://finance.yahoo.com/news/why-1-value-stock-could-134008544.html,No risk
2025-05-02 18:15:00,"Down 24% in 2025, Should You Buy This Cheap Stock and Hold for the Long Term?","Since the new CEO took over, the digital payments powerhouse has made progress driving profitable growth.  Despite having a strong brand and benefiting from a network effect, competition in the industry is fierce.  While the barrage of information can be overwhelming, the fresh financial updates that executive teams provide can give investors a much-needed glimpse into how certain businesses are performing.","Since the new CEO took over, the digital payments powerhouse has made progress driving profitable growth..Despite having a strong brand and benefiting from a network effect, competition in the industry is fierce..Still, shares trade at a dirt cheap valuation, which gives investors tremendous upside potential..Earnings season is in full swing. While the barrage of information can be overwhelming, the fresh financial updates that executive teams provide can give investors a much-needed glimpse into how certain businesses are performing. If you're eyeing a company, it's worth paying close attention. .Consider one leading payments enterprise, which just reported financial results for the first quarter of 2025. The numbers were mixed, with revenue that disappointed Wall Street and earnings per share (EPS) that beat expectations. Nonetheless, shares are down a troubling 24% in 2025 (as of April 29)..Where to invest $1,000 right now? Our analyst team just revealed what they believe are the 10 best stocks to buy right now. Continue ».Should invest buy this cheap stock right now and hold it for the long term?.During the three-month period that ended March 31, PayPal (NASDAQ: PYPL) posted $7.8 billion in revenue, up just 1% year over year. This gain, while small, was supported by 1.5 million net new accounts, bringing the total to 436 million. And it's worth highlighting PayPal's monster total payment volume (TPV) of $417 billion, which was 3% higher than Q1 2024..PayPal has multiple segments. However, Venmo is the current star of the show. The peer-to-peer app registered 20% revenue growth, with TPV increasing 10% to $76 billion..While the top-line growth wasn't anything to get excited about, the business is making great strides further down the income statement as profitability is improving dramatically. ""PayPal had a great start to the year, and our strategy is working,"" CEO Alex Chriss said. ""This is our fifth consecutive quarter of profitable growth with progress across branded checkout, PSP, omnichannel, and Venmo."" .Diluted EPS surged 56% from the first quarter of 2024. PayPal's operating expenses declined 4% year over year, demonstrating cost discipline. Guidance calls for EPS growth of 20% to 24% for the full year..PayPal has been pioneering digital payments and online commerce solutions for over two decades. This makes it a leader in the industry and has led to durable competitive advantages. PayPal's brand is held in high regard, known for trust, security, convenience, and innovation in the eyes of both merchants and consumers looking to move money around. When dealing with finances, this matters.",https://finance.yahoo.com/news/down-24-2025-buy-cheap-101500540.html,Market Risk Competition Risk Operational Risk
