Datetime,headline,description,article,link,analysis
2025-06-17 23:23:00,Nebius Group (NBIS) and Saturn Cloud Partner to Deliver Turnkey AI/ML Infrastructure Solution Built on NVIDIA Hopper GPUs,"Nebius Group N.V. (NASDAQ:NBIS) is one of the 10 Hot Large Cap Stocks to Buy Now. On June 11, Nebius Group N.V. (NASDAQ:NBIS) announced a partnership with Saturn Cloud to deliver a turnkey AI/ML infrastructure solution that is built on NVIDIA Hopper GPUs, with support for the NVIDIA AI Enterprise software stack. Saturn Cloud is […]","Nebius Group N.V. (NASDAQ:NBIS) is one of the 10 Hot Large Cap Stocks to Buy Now. On June 11, Nebius Group N.V. (NASDAQ:NBIS) announced a partnership with Saturn Cloud to deliver a turnkey AI/ML infrastructure solution that is built on NVIDIA Hopper GPUs, with support for the NVIDIA AI Enterprise software stack. Saturn Cloud is the MLOps platform for AI/ML engineers..The collaboration would enable AI engineers to access an enterprise-grade AI/ML infrastructure-in-a-box with on-demand access to an enterprise-ready MLOps platform and NVIDIA Hopper GPUs..A computer screen showcasing Artificial Intelligence and Machine Learning algorithms at work..The solution would combine Saturn Cloud’s engineer-loved MLOps platform with the flexibility and power of Nebius’s AI cloud, allowing anyone to instantly sign up and run jobs and deployments, use Jupyter notebooks or other IDEs, and manage cloud resources on NVIDIA Hopper GPUs through Nebius Group’s  (NASDAQ:NBIS) infrastructure..The solution is a compelling option for all use case types because of its notably lower cost compared to traditional cloud service providers. Nebius Group N.V. (NASDAQ:NBIS) takes the ninth spot on our list of the top hot large-cap stocks to invest in..Nebius Group N.V. (NASDAQ:NBIS) is a technology company that provides services and infrastructure to AI builders across the globe. The company’s offerings include Nebius AI, which is an AI-centric cloud platform that offers full-stack infrastructure. This includes cloud services, developer tools, and large-scale GPU clusters, cloud services, and developer tools..While we acknowledge the potential of NBIS as an investment, we believe certain AI stocks offer greater upside potential and carry less downside risk. If you’re looking for an extremely undervalued AI stock that also stands to benefit significantly from Trump-era tariffs and the onshoring trend, see our free report on the best short-term AI stock..READ NEXT: The Best and Worst Dow Stocks for the Next 12 Months and 10 Unstoppable Stocks That Could Double Your Money..Disclosure: None.",https://finance.yahoo.com/news/nebius-group-nbis-saturn-cloud-152311825.html," The news about Nebius Group and Saturn Cloud's partnership involves multiple types of risk:  1. **Regulatory Risk**: Concerns compliance with varying regulations in different regions as AI technologies evolve without established global standards.  2. **Market Risk**: Potential competition from new or existing players offering similar solutions, risking market share if adoption is slower than expected.  3. **Operational Risk**: Challenges in implementing complex AI/ML infrastructure, including technical issues and integration problems affecting deployment timelines and costs.  4. **Economic Risk**: Susceptibility to broader economic fluctuations that may impact consumer spending on technology or lead to outperformance due to increased demand.  5. **Reputation Risk**: Potential reputational damage from issues such as data breaches, misuse of technology, or negative user feedback.  6. **Competitive Risk**: Competitors may respond by imitating the partnership's model or offering alternative solutions that could render the partnership less valuable.  Overall, while the collaboration presents opportunities for growth and innovation, these risks highlight the need for careful management to mitigate potential negative impacts on the company."
2025-06-17 23:17:00,Cathie Wood Goes Bargain Hunting: 3 Stocks She Just Bought,"The iconic growth investor buys a Mag 7 and a pair of ""door"" stocks.","Ark Invest bought shares of Nvidia, DoorDash, and Nextdoor on Monday..Nvidia stock has rebounded 67% since bottoming out two months ago, but it's probably still cheaper than you think relative to its growth rate..DoorDash and Nextdoor serve locals in different ways, and Cathie Wood sees upside in both companies on the opposite ends of momentum..10 stocks we like better than Nvidia ›.This is the ideal market environment for Cathie Wood. Stocks are rallying, and the founder, CEO, and chief investment officer of the Ark Invest family of exchange-traded funds (ETFs) is at her best when high-beta stocks are moving higher. She kicked off the week by purchasing four different stocks. I want to talk about three of them..Wood added to existing stakes in Nvidia (NASDAQ: NVDA), DoorDash (NASDAQ: DASH), and Nextdoor Holdings (NYSE: KIND) on Monday. Let's take a closer look at Wood's latest purchases..Every starting line tells a different story when it comes to the developer of graphics processing units and artificial intelligence (AI) chips. Thankfully for investors, nearly all of them end in success. Nvidia is a 15-bagger over the past five years, an 8-bagger over three years, and the shares have soared 67% since bottoming out two months ago..Zoom out a bit from the last starting line and the returns start to look more mortal. Nvidia is up a pedestrian 10% over the past year with a mere 8% year-to-date advance. It's probably still a relative victory for the ""Magnificent Seven"" stock that's also the country's second most valuable publicly traded company by market cap..Nvidia and other stocks riding high on the demand for AI chips and data center buildouts have had a couple of hits this year. The first blow came in January when Chinese AI tech start-up DeepSeek announced that it was generating quality generative AI with dated Nvidia chips for a lot less than Western rivals. That was followed by the trade war that restricted the sale of chips into China, resulting in billions in charges -- and rising -- for Nvidia..This doesn't mean that Nvidia stock has been rising while its fundamentals are shifting to reverse. Revenue soared 69% to $44.1 billion in last month's quarterly update, better than the 65% jump that investors were expecting for the fiscal first quarter. A 73% surge in data center revenue -- now accounting for more than 88% of the period's top line -- led the way. Adjusted earnings increased 57% to $0.96 per share, also exceeding market forecasts..Its outlook for the current quarter includes an $8 billion revenue hit on the recent export control limitations between the U.S. and China. However, analysts still would go on to jack up their profit targets for this fiscal year as well as fiscal 2027. Despite the stock's run over the last two months, Nvidia is trading for 34 times this year's projected earnings and 25 times next year's mark. This is a discount to its growth rate, even if the pace will inevitably slow in the coming quarters. Investors fortunate enough to grab some shares at the April low got in at what is now just 15 times next fiscal year's profit target.",https://finance.yahoo.com/news/cathie-wood-goes-bargain-hunting-151700603.html," Cathie Wood's recent investments in a ""Mag 7"" stock and two ""door"" stocks involve several key risks:  1. **Concentration Risk**: By investing heavily in three high-growth stocks, there is a higher likelihood of underperformance if any of these companies face unexpected challenges.  2. **Sector Vulnerabilities**: The stocks may be from sectors prone to economic fluctuations, such as tech, which can be sensitive to interest rate changes and market downturns.  3. **Operational Risks**: High-growth companies might not scale efficiently without proper safeguards, potentially leading to inefficiencies or quality issues.  4. **Regulatory Changes**: New regulations could impact these companies' operations, affecting profitability and stock valuations.  5. **Interest Rate Sensitivity**: Tech stocks may be sensitive to rising interest rates due to debt financing costs, which could affect their performance.  6. **Liquidity Issues**: If the secondary market lacks buyers, selling positions quickly might lead to significant losses.  7. **Regulatory and Market Volatility**: Changes in tax laws or environmental regulations, along with broader market volatility, pose additional risks.  8. **Potential for泡沫(photodissociation)**: High-growth stocks are often overvalued based on future earnings potential, which could lead to a market crash if their performance doesn't meet expectations.  In summary, while Cathie Wood's investments offer high growth potential, they come with significant risks that could impact returns or cause losses."
2025-06-17 23:11:00,Apple supplier Jabil plans $500M venture for AI infrastructure,Jabil plans to invest $500 million to expand its manufacturing and services infrastructure across the Southeastern U.S. The post Apple supplier Jabil plans $500M venture for AI infrastructure appeared first on FreightWaves.,"Electronics component maker Jabil is betting on surging infrastructure demand for AI data centers throughout the U.S..Jabil (NYSE: JBL) said on Tuesday that it’s investing $500 million over the next several years to expand its cloud and artificial intelligence data center infrastructure for its customers..The investment includes large-scale production facilities, capital investments and workforce development. Jabil plans to build the facility in the Southeast U.S. and be operational by mid-2026..“This initiative is a key element of our long-term strategy to diversify our commercial portfolio and strengthen Jabil’s presence in the U.S.,” CEO Mike Dastoor said in a news release. “While the geopolitical landscape remains dynamic, our position as a U.S.-based company with a significant domestic footprint enables us to help the world’s leading brands navigate challenges.”.Based in St. Petersburg, Florida,  Jabil is a global manufacturing and supply chain solutions company..Jabil’s customers include major brands in logistics, packaging, mobility, automotive, wearables, aerospace, enterprise, digital home, point-of-sale, printing and energy. Some of the company’s largest clients include Apple, UPS and Amazon..Jabil has 30 facilities across the U.S. and more than 100 worldwide, with investments in automation, robotics and process optimization..The company’s $500 million investment follows recent announcements by tech companies Apple, Nvidia and Foxconn, to create manufacturing facilities in the U.S..In February, Apple (Nasdaq: AAPL) announced it will invest more than $500 billion in the U.S. over the next four years, including a major facility in Houston..Nvidia (Nasdaq: NVDA) said in April that they plan to invest $500 billion over the next four years to build AI super computers in the U.S., through partnerships with TSMC, Foxconn, Wistron, Amkor and SPIL..Nvidia’s investments and partnerships will include a semiconductor chips facility in Arizona and AI supercomputer plant in Houston..Taiwan-based tech company Foxconn recently said it’s investing $450 million in a 100-acre property in Houston to build an AI server manufacturing facility..The post Apple supplier Jabil plans $500M venture for AI infrastructure appeared first on FreightWaves.",https://finance.yahoo.com/news/apple-supplier-jabil-plans-500m-151101697.html," The news about Jabil's $500 million AI infrastructure expansion involves several types of risks:  1. **Market Risks**: Economic downturns in the southeastern U.S., which might affect the region's ability to support such investments.  2. **Regulatory Risks**: Potential legal challenges from data privacy, cybersecurity, or labor laws that could arise during project implementation.  3. **Supply Chain Risks**: The risk of decreased reputation and market position if Jabil fails to deliver on expected performance, especially with existing Apple client ties.  4. **Competition Risks**: Increased competition in the southeastern U.S. from other companies offering similar AI solutions.  5. **Funding Risks**: Challenges in securing capital for a large investment due to potential rising interest rates or difficulty in attracting investors.  6. **Operational Risks**: Technical challenges and delays during AI integration into manufacturing, which could disrupt operations.  Overall, while Jabil's strategic move is significant, it carries multiple risks that need careful management to ensure success."
2025-06-17 23:00:00,Dan Ives AI ETF Tops $100M in AUM in Just 5 Days of Launch,"IVES hits $100M AUM just five days post-launch, signaling strong investor demand for diversified AI exposure.","Wedbush Securities’ first ETF, Dan Ives Wedbush AI Revolution ETF IVES, made a stunning debut, surpassing $100 million in assets under management (AUM) within its first five trading days. Launched on June 4, IVES is an actively managed ETF focused purely on artificial intelligence companies. The rapid inflows highlight increased demand for AI exposure..IVES seeks to capitalize on the rapid growth of artificial intelligence by investing in companies poised to lead the AI transformation. This fund offers investors exposure to a diversified portfolio of firms at the cutting edge of AI technology. The Dan IVES Wedbush AI Revolution ETF tracks the Solactive Wedbush Artificial Intelligence Index.The ETF is well diversified across 30 stocks, with each firm making up for no more than a 5.7% share. Microsoft MSFT, NVIDIA NVDA and Broadcom AVGO are the top three holdings in the fund’s basket. Further, IVES offers diversified exposure across key AI segments — semiconductors, hyperscalers, cybersecurity, cloud, robotics, and consumer platforms — reflecting a multi-trillion dollar AI investment boom (read: ETFs Poised to Win in the MSFT vs. NVDA Market Cap Battle).The new ETF has an expense ratio of 0.75%, higher than large-cap tech ETFs like QQQ (0.20%) but reasonable for a thematic strategy..Wedbush’s entry into the ETF market comes at an opportune moment when AI enthusiasm has renewed among investors after a slowdown early in the year. AI-related stocks, especially NVIDIA, Microsoft and Tesla (TSLA), have been on a strong rally in recent weeks, with some up about 20% in the past month..Unlike most thematic ETFs that rely heavily on passive screens or rules-based criteria, IVES is built on the active insights of veteran tech analyst Dan Ives, Wedbush’s Managing Director and Head of Technology Research. The ETF’s portfolio is based on Ives' proprietary “AI 30” list — a curated basket of companies he believes are best positioned to lead and benefit from the artificial intelligence revolution (read: Investing in the AI Revolution with Dan Ives)..Many AI ETFs focus primarily on one segment of the AI value chain — often just big-cap platform companies like NVIDIA or Alphabet. IVES, however, adopts a comprehensive strategy that captures the entire AI ecosystem..IVES deliberately limits concentration risk. The fund caps individual holdings at relatively balanced weights, with each holding around 5% to 6%. This strategy ensures that returns are not overly reliant on just a handful of stocks. It gives smaller, high-growth companies meaningful representation while still maintaining exposure to established leaders. The result is a more diversified and potentially resilient portfolio, especially important in the volatile world of tech investing.",https://finance.yahoo.com/news/dan-ives-ai-etf-tops-150000279.html," The news of Dan Ives' AI ETF reaching $100 million in AUM within five days highlights a significant investor interest but also introduces several underlying risks. These include potential volatility due to increased institutional investment, regulatory scrutiny for AI-related investments, dependency on emerging technology which could face evolving challenges, and the possibility of market correction if future performance doesn't sustain. Additionally, there's a risk of increased costs associated with managing higher AUM. Overall, while the initial positive trend suggests strong demand, these factors contribute to potential risks that need monitoring.  **Risk Type:** Moderate Risk"
2025-06-17 22:52:00,"If You Invested $10K in These 3 Dividend Stocks 10 Years Ago, You’d Be a Millionaire",Dividend stocks offer the unique advantage of simultaneously generating capital appreciation and passive income. Investors who own them enjoy the flexibility of harvesting their periodic distributions...,"Dividend stocks offer the unique advantage of simultaneously generating capital appreciation and passive income. Investors who own them enjoy the flexibility of harvesting their periodic distributions or reinvesting them to accelerate compounding..Read Next: How To Get a 10% Return on Investment (ROI): 10 Proven Ways.For You: How Much Money Is Needed To Be Considered Middle Class in Every State?.The best dividend stocks can turn even a comparatively modest investment into a small fortune relatively quickly. If you had invested $10,000 in these dividend stocks 10 years ago, you’d be a millionaire today..Nvidia has been Wall Street’s number one growth stock darling of the last decade, but companies focused on growth reinvest their profits instead of distributing them as shareholder dividends, right? Most, but not all..Per Nasdaq, Nvidia began paying modest dividends in mid-2013, so investors who jumped on board in mid-2015 would have been reaping or reinvesting them for the last decade, a period of extraordinary growth for the company. Here’s how your $10,000 would have grown over the last 10 years had you harvested your dividends as income..Check Out: I’m a Self-Made Millionaire: 5 Stocks You Shouldn’t Sell.June 11, 2015 share price: 53 cents, according to Macrotrends.June 11, 2025 share price: $142.83, according to Macrotrends.Returns: 26,849.06%.10-year ROI excluding dividends: $2,684,906.Reinvesting dividends can magnify gains exponentially. However, calculating long-term gains with a DRIP (dividend reinvestment plan) is more complex and inexact because dividend yields fluctuate over time, which affects the number of shares that can be purchased with each reinvestment, as does the stock’s always-changing purchase price at the time of the reinvestment. Also, growing companies often issue stock splits, which change the number and value of a given investor’s shares. Therefore, the calculation must rely on averages and close estimates..Initial purchase: 18,868 shares.Stock splits since 2015: 4:1 in 2021 (75,472 shares) and 10:1 in 2024 (754,717 shares), per CompaniesMarketCap.Approximate average dividend yield over 10 years: 0.25%, according to Macrotrends.Approximate number of shares after 10 years: 852,557.Approximate ROI with dividend reinvestment at June 11 trading price: $121,770,716.Here’s how your $10,000 would have grown if you invested it in the land-holding company Texas Pacific in 2015. This calculation is even more complex than NVDA because TPL issued several flat-rate “special” dividends over the last 10 years on top of the standard yield, according to Seeking Alpha.",https://finance.yahoo.com/news/invested-10k-3-dividend-stocks-145237135.html," The article presents an optimistic scenario where $10K invested in three dividend stocks 10 years ago has grown to a million dollars. However, upon thorough analysis, several risks are identified:  1. **Market Volatility**: Dividend stocks can experience fluctuations due to company-specific issues or market conditions.  2. **Inflation Impact**: The article assumes that dividends keep pace with inflation, which may not always hold true, affecting purchasing power.  3. **Interest Rate Changes**: Fluctuations in interest rates can impact the value of dividends received over time.  4. **Tax Implications**: Dividends are taxable and could be subject to different tax rates depending on their classification, potentially reducing returns.  5. **Liquidity Concerns**: Selling stocks quickly might not yield optimal results due to market conditions affecting prices.  6. **Company-Specific Risks**: Companies may face issues like high debt or poor performance that aren't mentioned in the article.  Given these factors, despite the attractive narrative of significant growth, the investments carry substantial risks. Therefore, this scenario is classified as a **high-risk situation** due to the potential for losses and other unforeseen challenges."
2025-06-17 22:44:00,Talking About CoreWeave: An Nvidia-Backed AI Play,Would you be interested in a stock that's quadrupled in less than three months?,"In this podcast, Motley Fool host Anand Chokkavelu and contributors Lou Whiteman and Rick Munarriz discuss:.Chewy earnings.CoreWeave on the hype meter.Sezzle vs. Shopify.To catch full episodes of all The Motley Fool's free podcasts, check out our podcast center. When you're ready to invest, check out this top 10 list of stocks to buy..A full transcript is below..Before you buy stock in CoreWeave, consider this:.The Motley Fool Stock Advisor analyst team just identified what they believe are the 10 best stocks for investors to buy now… and CoreWeave wasn’t one of them. The 10 stocks that made the cut could produce monster returns in the coming years..Consider when Netflix made this list on December 17, 2004... if you invested $1,000 at the time of our recommendation, you’d have $660,821!* Or when Nvidia made this list on April 15, 2005... if you invested $1,000 at the time of our recommendation, you’d have $886,880!*.Now, it’s worth noting Stock Advisor’s total average return is 791% — a market-crushing outperformance compared to 174% for the S&P 500. Don’t miss out on the latest top 10 list, available when you join Stock Advisor..See the 10 stocks ».*Stock Advisor returns as of June 9, 2025.This podcast was recorded on June 11, 2025..Anand Chokkavelu: Are we talking about the hottest stock in the market? Motley Fool Money starts now. I'm Anand Chokkavelu, and I'm joined by two of my favorite fools, Lou Whiteman and Rick Munarriz. Today, we're talking about a Shopify lawsuit lodged by another Fool's favorite. We'll bring out the hype meter on an NVIDIA-related stock, and we'll pick today's most interesting earnings. Before we dive into the rest of today's show, here are a few headlines on our radar. Inflation is still in check. The latest CPI reading has inflation at 2.4% with help from items like lower gas prices. In inflation adjacent news, the details are always morphing, but the China and US trade talks are trending with a green arrow, we'll say. Open AI is adding Google Cloud to help power ChatGPT, a shift from exclusively using Microsoft Azure and a win for Google's Cloud business. Upgrade ChatGPT from an enemy to a frenemy. The ChatGPT still threatens Google's search business. This week, Starbucks is hosting its annual leadership conference in Vegas as it keeps its back to Starbucks' aim of getting me my tall decaf Americano in four minutes or less. On earnings, we had a few notable ones from the Fool Universe. GitLab, Stitch Fix, and Chewy are all down sizably today. Lou, I'll give you the choice, which is the most interesting.",https://finance.yahoo.com/news/talking-coreweave-nvidia-backed-ai-144400764.html," CoreWeave's stock carries notable risks stemming from its dependency on Nvidia, a major tech player. The rapid growth over three months might be short-term and unsustainable. Additionally, the sector's volatility in AI could impact performance, competition may intensify, and broader market trends could affect the company's trajectory. Thus, while the positive partnership is encouraging, these factors introduce significant risk that could lead to stock fluctuations."
