Datetime,headline,description,article,link,analysis
2025-06-20 18:30:00,"Here's How Much a $30,000 Investment in the Nasdaq 100 Today Could Be Worth in 30 Years",Investors can gain exposure to top growth stocks like  Amazon and Nvidia by investing in the Invesco QQQ Trust.  The exchange-traded fund has averaged a compound annual return of more than 18% over the past decade.  Growth stocks can generate returns far superior to those of value stocks or dividend stocks in the long run.,"Investors can gain exposure to top growth stocks like Amazon and Nvidia by investing in the Invesco QQQ Trust..The exchange-traded fund has averaged a compound annual return of more than 18% over the past decade..Investing $30,000 into the fund today could potentially result in your portfolio being worth over $1 million in the future..10 stocks we like better than Invesco QQQ Trust ›.Growth stocks can generate returns far superior to those of value stocks or dividend stocks in the long run. These are the types of companies that investors are drawn to because if they're growing, they are expanding their operations and likely innovating and potentially diversifying along the way. .Names like Amazon and Nvidia are two exceptional examples. Over the past 20 years, the former has produced returns of 12,000% while the latter is up more than 60,000%. Investing $30,000 into either one of the stocks back then would have made you millions of dollars. .Picking the next big growth stock is easier said than done. But the good news is that you don't have to pick the next Amazon or Nvidia to achieve great results. The Invesco QQQ Trust (NASDAQ: QQQ) is an exchange-traded fund (ETF) that will give you exposure to the top 100 nonfinancial stocks in the Nasdaq exchange, also known as the Nasdaq 100. Amazon, Nvidia, and many other top tech names are included in that list. .Here's how a $30,000 investment in the fund might grow over the long haul..The best growth stocks in the world are often found on the Nasdaq. And by targeting the top 100 nonfinancial companies, you won't have to worry about keeping an eye on which growth stocks to buy. The Invesco fund will adjust its holdings over time, removing poor-performing stocks and replacing them with rising stars..Some of the top holdings in the ETF today include Costco Wholesale, Netflix, and Broadcom. While it is a tech-heavy fund (tech stocks account for 57% of its holdings), about 20% of the portfolio is also in consumer discretionary stocks, followed by smaller positions in other sectors. And more than 97% of the holdings are U.S. stocks, which can minimize your exposure to international markets..It's little surprise, with so much focus on growth, that the Invesco QQQ Trust widely outperformed the S&P 500 over the past decade. At 430%, it has averaged a compound annual growth rate of more than 18%..As impressive as the Invesco ETF's returns have been over the past decade, they've also been skewed in recent years by a flurry of tech spending, which may not persist in the very long term.",https://finance.yahoo.com/news/heres-much-30-000-investment-103000071.html," The analysis of the news article regarding a $30,000 investment in the Nasdaq 100 over 30 years reveals that the primary focus is on potential upside and historical performance. However, the article does not explicitly mention any specific risks such as market volatility, economic downturns, or company-specific issues that could affect returns negatively.  **Conclusion:** There is no explicit risk classification mentioned in the article. It primarily discusses growth potential without addressing possible negative outcomes or associated risks."
2025-06-20 19:03:00,"Masa Son Pitches $1 Trillion US AI Hub to TSMC, Trump Team",(Bloomberg) -- SoftBank Group Corp. founder Masayoshi Son is seeking to team up with Taiwan Semiconductor Manufacturing Co. to realize what could be his biggest bet yet — a trillion-dollar industrial complex in Arizona to build robots and artificial intelligence.Most Read from BloombergSecurity Concerns Hit Some of the World’s ‘Most Livable Cities’One Architect’s Quest to Save Mumbai’s Heritage From DisappearingJFK AirTrain Cuts Fares 50% This Summer to Lure Riders Off RoadsNYC Congestion Toll C,"(Bloomberg) -- SoftBank Group Corp. founder Masayoshi Son is seeking to team up with Taiwan Semiconductor Manufacturing Co. to realize what could be his biggest bet yet — a trillion-dollar industrial complex in Arizona to build robots and artificial intelligence..Most Read from Bloomberg.Security Concerns Hit Some of the World’s ‘Most Livable Cities’.One Architect’s Quest to Save Mumbai’s Heritage From Disappearing.JFK AirTrain Cuts Fares 50% This Summer to Lure Riders Off Roads.NYC Congestion Toll Cuts Manhattan Gridlock by 25%, RPA Reports.Taser-Maker Axon Triggers a NIMBY Backlash in its Hometown.Son envisions a version of the vast manufacturing hub of China’s Shenzhen that would bring back high-tech manufacturing to the US, according to people familiar with the billionaire’s thinking. The park may comprise production lines for AI-powered industrial robots, they said, asking not to be named as the plan remains private..SoftBank officials are keen to have the Taiwanese maker of Nvidia Corp.’s advanced AI chips play a prominent role in the project, although it’s not clear what part Son sees for TSMC, which already plans to invest $165 billion in the US and has started mass production at its first Arizona factory. Nor is it clear that TSMC would be interested. A person familiar with the chipmaker’s thinking said that SoftBank’s project has no bearing on TSMC’s plans in Phoenix..Codenamed “Project Crystal Land,” the Arizona complex represents the 67-year-old SoftBank chief’s most ambitious attempt in a career that’s spanned numerous bet-the-house bids, thousands-fold-returns and billions of dollars in losses. Son, who’s often expressed disappointment in his own legacy, has repeatedly said he means to do everything he can to hurry AI development..SoftBank officials have spoken with federal and state government officials to discuss possible tax breaks for companies building factories or otherwise investing in the industrial park, including talks with US Secretary of Commerce Howard Lutnick, the people said..The Japanese billionaire is also personally sounding out interest among an array of tech companies, they said. The project has been floated to executives at South Korea’s Samsung Electronics Co., they said..Shares of SoftBank rose 2.7% Friday. TSMC’s stock price rose 1.9%, while Samsung’s gained 0.5%..Representatives of SoftBank, TSMC and Samsung declined to comment. A Commerce Department spokesperson did not immediately respond to a request for comment..SoftBank’s attempts to get businesses investing in a US industrial park follow signs that its campaign alongside ChatGPT maker OpenAI to raise hundreds of billions of dollars for US data centers is moving slower than initially expected. Crystal Land would need to address crucial details, such as whether there’s demand and funding on par with its grandiose scale, to become reality.",https://finance.yahoo.com/news/softbank-pitches-1-trillion-us-053937697.html," The $1 trillion AI hub project led by Masayoshi Son involves several key risks:  1. **Financial Risk**: The substantial investment exposes SoftBank to potential financial loss if the project does not meet its expectations.  2. **Political Stability Risks**: Instability in Taiwan or policies under Trump could impact TSMC's operations and the project's progress.  3. **Regulatory Environment Risks**: Changes in regulations, particularly regarding data privacy and intellectual property, might affect the project's feasibility and costs.  4. **Supply Chain Risks**: Dependency on semiconductors from TSMC could be disrupted by production issues or shortages, impacting manufacturing timelines and costs.  5. **Geopolitical Tensions**: Conflicts involving Taiwan or China could introduce uncertainties in global supply chains and investments, affecting the project's stability.  6. **SoftBank Valuation Risk**: The company's valuation post this deal is uncertain; if the project fails, investors may face losses.  7. **Market Saturation Risks**: Increased competition from other tech companies in the AI sector could lead to market saturation and reduced profitability.  These risks collectively present significant challenges that could impact the success of Son's trillion-dollar AI hub initiative."
2025-06-20 18:02:00,"Exclusive-Nvidia, Foxconn in talks to deploy humanoid robots at Houston AI server making plant","TAIPEI (Reuters) -Taiwan's Foxconn and U.S. artificial intelligence chips maker Nvidia are in talks to deploy humanoid robots at a new Foxconn factory in Houston that will produce Nvidia AI servers, two sources familiar with the matter said.  This would be the first time that an Nvidia product will be made with the assistance of humanoid robots and would be Foxconn's first AI server factory to use them on a production line, the sources said.  A deployment, expected to be finalised in the coming months, would mark a milestone in the adoption of the human-like robots that promises to transform manufacturing processes.","By Wen-Yee Lee.TAIPEI (Reuters) -Taiwan's Foxconn and U.S. artificial intelligence chips maker Nvidia are in talks to deploy humanoid robots at a new Foxconn factory in Houston that will produce Nvidia AI servers, two sources familiar with the matter said..This would be the first time that an Nvidia product will be made with the assistance of humanoid robots and would be Foxconn's first AI server factory to use them on a production line, the sources said..A deployment, expected to be finalised in the coming months, would mark a milestone in the adoption of the human-like robots that promises to transform manufacturing processes..Foxconn is developing its own humanoid robots with Nvidia and has also trialed humanoids made by China's UBTech. The sources said it was not clear what type of humanoid robots are being planned for use in the Houston factory, what they will look like or how many will be deployed initially..They said the two companies are aiming to have the humanoid robots at work by the first quarter of next year when Foxconn's new Houston factory will begin production of Nvidia's GB300 AI servers..And while it was not clear what exactly the robots will be doing at the factory, Foxconn has been training them to pick and place objects, insert cables and do assembly work, according to a company presentation in May..Foxconn's Houston factory was ideally suited to deploy humanoid robots because it will be new and have more space than other existing AI server manufacturing sites, one of the sources said..Nvidia and Foxconn declined to comment..The sources did not wish to be identified as they are not authorised to speak to the media..Leo Guo, general manager of the robotics business unit at Foxconn Industrial Internet, a subsidiary of Foxconn that is in charge of the group’s AI server business, said last month at an industry event in Taipei that Foxconn plans to showcase at the company's annual technology event in November two versions of humanoid robots that it has developed..One of those will be with legs and the other will use a wheeled autonomous mobile robot (AMR) base, which would cost less than the version with legs, he said, without disclosing details..Nvidia announced in April that it planned to build AI supercomputer manufacturing factories in Texas, partnering with Foxconn in Houston and Wistron in Dallas. Both sites are expected to ramp up production within 12 to 15 months..For Nvidia, using humanoid robots in the manufacturing of its AI servers represents a further push into the technology as it already supplies humanoid makers with a platform they can use to build such robots.",https://finance.yahoo.com/news/exclusive-nvidia-foxconn-talks-deploy-100258193.html," The news article about Foxconn and Nvidia deploying humanoid robots at a new Houston factory presents several types of risks:  1. **Financial Risk**: The high initial investment required for implementing humanoid robots poses uncertainty for investors, who may not see immediate returns.  2. **Operational Risk**: Challenges such as robot reliability, maintenance, and worker training could lead to downtime, increased costs, or safety issues if not managed effectively.  3. **Regulatory Risk**: Navigating local regulations in Houston might result in delays, additional costs, or legal issues if compliance is not met.  4. **Reputational Risk**: Success could enhance their image as tech innovators, while failure might damage their reputation if problems are exposed.  5. **Compliance Risk**: Adhering to safety standards and company policies becomes more complex with new technology, risking non-compliance penalties.  These risks collectively highlight the potential challenges Foxconn and Nvidia face in integrating humanoid robots into manufacturing processes."
2025-06-20 18:00:00,"Could the ""Next Nvidia Stock"" Actually Be... Nvidia Stock?","There seems at least a solid probability that Nvidia stock still has not just good or even great but amazing growth potential left.  Year-over-year earnings growth solidly in the double-digit percentages and a reasonable stock valuation should be all that's needed to keep Nvidia investors very happy.  Many articles have been written over the last year or so about ""the next Nvidia (NASDAQ: NVDA) stock,"" which refers to a stock that has the potential to post incredibly strong gains over at least the medium term, just like the artificial intelligence (AI) chip leader has done.","There seems at least a solid probability that Nvidia stock still has not just good or even great but amazing growth potential left..Year-over-year earnings growth solidly in the double-digit percentages and a reasonable stock valuation should be all that's needed to keep Nvidia investors very happy..10 stocks we like better than Nvidia ›.Many articles have been written over the last year or so about ""the next Nvidia (NASDAQ: NVDA) stock,"" which refers to a stock that has the potential to post incredibly strong gains over at least the medium term, just like the artificial intelligence (AI) chip leader has done..With the risk of sounding like I've lost my mind, I think there's a good case to be made that ""the next Nvidia stock"" could actually be Nvidia stock. In other words, there seems at least a solid probability that Nvidia stock still has not just good or even great but amazing growth potential left. Think of it as ""Nvidia the superstar stock 2.0."".I say ""at the risk of sounding like I've lost my mind"" because I understand the law of large numbers strongly works against my thesis. This ""law"" basically means that the larger a company becomes, the more difficult it becomes to continue to grow revenue and earnings at a strong pace on a year-over-year percentage basis. And year-over-year earnings (and cash flow) growth is what largely powers stock prices higher..Nvidia is massive. It has a market cap of $3.55 trillion, as of June 18, making it the world's second most valuable publicly traded company, trailing Microsoft by just a sliver. Moreover, Nvidia management expects the company to generate revenue of $45 billion in its fiscal second quarter, which equates to an annual revenue run rate of $180 billion..To be clear -- I think it's highly unlikely that Nvidia will ever again be able to pump out a long consecutive string of year-over-year quarterly earnings growth in the very high double-digit to triple-digit percentages. But I don't think it has to do that in order to deliver stellar returns to investors for some time. Year-over-year earnings growth solidly in the double-digits plus a reasonable stock valuation should be all that's needed to keep investors very happy..What makes me have confidence in the ""reasonable valuation"" bit?.Currently, Nvidia stock's valuation is reasonable by just about every measure, but that has not always been true. (For reference, it's trading at 25.4 times Wall Street's projected forward earnings per share, or EPS, as of June 18. That's an attractive valuation for a company that analysts expect will grow EPS at an average annual rate of 30% over the next five years.)",https://finance.yahoo.com/news/could-next-nvidia-stock-actually-100000222.html," The article discusses the possibility of investors seeking ""the next Nvidia stock,"" which might involve speculative investments in companies with similar potential to Nvidia. This scenario carries a risk profile classified as:  **Speculative Risk**  This risk arises from the inherent uncertainty and high volatility associated with speculative investments, where the potential for significant gains exists but also a substantial chance of loss if the investment does not perform as expected."
2025-06-20 19:49:00,"Trending tickers: SoftBank, Pop Mart, Snowflake, Salesforce and Nvidia",The latest investor updates on stocks that are trending on Friday.,"Shares in SoftBank (9984.T) rose in pre-market trading following reports that founder Masayoshi Son is considering launching a $1tn (£741bn) industrial hub in Arizona focused on robotics and artificial intelligence..The ambitious project, dubbed “Project Crystal Land,” would mark one of the largest industrial undertakings in US history, aiming to transform Arizona into a cutting-edge tech manufacturing centre similar to China’s Shenzhen, according to Bloomberg..SoftBank is reportedly in early discussions with Taiwan Semiconductor Manufacturing Company (2330.TW, TSM) about a potential partnership, although the extent of TSMC’s involvement remains unclear. TSMC is already investing up to $165bn in US-based chip plants..Read more: FTSE 100 LIVE: Markets upbeat as UK and EU begin talks on Iran and Trump sets two week deadline.Son is also said to be approaching other major technology players, including Samsung Electronics (005930.KS), as part of a broader push to attract private-sector participation in the venture. Talks with both federal and state officials in the US have included discussions of potential tax incentives designed to draw investment to the region..A $1tn commitment would be double the size of the $500bn “Stargate” initiative — a separate megaproject backed by SoftBank, OpenAI, and Oracle (ORCL) aimed at expanding US data centre capacity to support the next wave of artificial intelligence development..Shares in Pop Mart (9992.HK) fell sharply in Hong Kong trading on Friday after a Chinese state media commentary called for tighter regulation of blind-box toys and trading cards, a move that rattled investors and raised concerns over the company’s lucrative Labubu doll business..The Beijing-based toymaker, which has a market capitalisation of roughly $40bn, saw its shares drop as much as 6% during the session, extending a 5.3% decline on Thursday. The sell-off came despite the fact that the commentary did not mention Pop Mart by name..The warning stoked fears of a regulatory crackdown on the blind-box model, a sales strategy in which consumers purchase toys without knowing which character they will receive. Pop Mart’s success has been built largely on this model, fuelling a frenzy among collectors and driving a nearly 170% rally in its shares so far this year..Stocks: Create your watchlist and portfolio.Much of that surge has been driven by the popularity of the company’s signature Labubu dolls — wide-eyed, toothy monster figurines that have become a cult hit among young Chinese consumers.",https://finance.yahoo.com/news/softbank-pop-mart-snowflake-salesforce-nvidia-trending-tickers-094115098.html," The risks associated with the mentioned tickers can be classified as follows:  1. **SoftBank**: Market risk due to its ownership in Salesforce potentially making it liable for any issues faced by the latter.  2. **Pop Mart (assuming Popcorn Mart)**: Geopolitical and macroeconomic risks, including exposure to inflation, interest rates, and global demand fluctuations.  3. **Snowflake**: Regulatory risks related to data sensitivity and potential government interference or changes in regulations.  4. **Salesforce**: Market risk due to its high market cap dependency on enterprise software sales, which can be volatile.  5. **Nvidia**: Supply chain and operational risks associated with semiconductor production challenges and cyclical consumer demand for graphics hardware.  These classifications reflect the various types of risks each company is exposed to based on their business models and operations."
2025-06-20 17:20:00,Could AMD Finally Challenge Nvidia With Its MI400 AI Chips?,"AMD launched its MI350X and MI355X AI accelerators, which compete with Nvidia's Blackwell products.  The MI400 series is coming next year and expected to deliver a tenfold increase in performance.  MI400 and AMD's Helios rack-scale solution can help the company grow its AI chip business, although Nvidia will likely remain the overwhelming market leader.","AMD launched its MI350X and MI355X AI accelerators, which compete with Nvidia's Blackwell products..The MI400 series is coming next year and expected to deliver a tenfold increase in performance..MI400 and AMD's Helios rack-scale solution can help the company grow its AI chip business, although Nvidia will likely remain the overwhelming market leader..10 stocks we like better than Advanced Micro Devices ›.Advanced Micro Devices (NASDAQ: AMD) has built a sizable AI accelerator business over the past few years, but it's a drop in the bucket compared with market leader Nvidia (NASDAQ: NVDA). While Nvidia's data center segment generated more than $39 billion in revenue during the most recent quarter alone, AMD managed just $5 billion in AI accelerator revenue in all of 2024..AMD's latest Instinct MI350X and MI355X graphics processing units (GPUs) are powerful, delivering four times the AI compute performance and 35 times the AI inferencing performance compared to the company's last-generation products. However, specifications and performance are in line with Nvidia's latest Blackwell-based GPUs. AMD's chips feature 288 GB of HBM3E memory and 8 terabytes per second (TB/s) of memory bandwidth, the same as Nvidia's GB300 Superchip. Raw compute performance across different types of operations is also similar to Nvidia's latest. While AMD's MI350X and MI355X are capable AI accelerators, they fail to leapfrog Nvidia..In 2026, AMD will release its next-generation MI400 series AI accelerators. The company claims that the flagship MI400X will be 10 times more powerful than the MI300X, an enormous leap in just a few years. The chips will feature up to 432 GB of HBM4 memory, 19.6 TB/s memory bandwidth, and significant increases in raw computing performance..Of course, Nvidia won't be sitting still. Nvidia's Vera Rubin chips are expected to ship in the second half of 2026, bringing significant performance gains over Blackwell. The initial Rubin AI accelerator will keep memory per GPU at 288 GB but up the bandwidth to 13 TB/s, while Rubin Ultra in the second half of 2027 pile on additional memory and bandwidth. Rubin is expected to more than triple compute performance over its predecessor..While companies' claims about the performance of future products should be taken with a grain of salt, AMD's MI400X looks like it will be a solid contender when it launches in 2026. It should beat Nvidia's current generation of products handily in terms of performance, although Nvidia's next-gen Rubin chips may ultimately win out. One advantage AMD will have is memory, with the MI400X set to offer more capacity and bandwidth than Rubin. For certain types of workloads, that will be appealing.",https://finance.yahoo.com/news/could-amd-finally-challenge-nvidia-092000398.html," The primary financial risk AMD faces with the introduction of the MI400 AI chips is the uncertainty surrounding its actual performance compared to expectations. While the anticipated tenfold increase in performance could significantly boost revenue and market share, potential risks include:  1. **Performance underperformance**: If the MI400 does not deliver as expected, it may fail to capture the anticipated market share and could negatively impact AMD's financials.  2. **Market competition**: DespiteMI400's strengths, Nvidia remains the dominant player in the AI chip market. This continued leadership might limit the impact of AMD's new chips on overall market growth.  3. **Customer adoption concerns**: The rapid pace of technology changes might result in delays in customer adoption for AMD's MI400 chips, potentially affecting sales and revenue streams.  In summary, while the MI400 presents an opportunity to challenge Nvidia and gain market share, the associated risks stem from the need to meet performance targets and successfully integrate these chips into existing customer bases."
