Datetime,headline,description,article,link,analysis
2025-06-21 06:02:00,"Stock market today: S&P 500, Nasdaq fall amid Fed rate uncertainty as Trump mulls Iran move","Traders are weighing the possibility of direct US military involvement in the Israel-Iran war, now in its second week.","US stocks closed the session mixed on Friday as investors navigated a flurry of developments across multiple fronts. A Fed governor floated the possibility of interest rate cuts by July, and President Trump put off a decision on whether he would authorize a US strike in Iran..The Dow Jones Industrial Average (^DJI) rose just above the flatline. The S&P 500 (^GSPC) slipped 0.2%, while the tech-heavy Nasdaq Composite (^IXIC) fell 0.5%. All three major averages were little changed for the shortened holiday trading week..Chip stocks took a hit on Friday after a Wall Street Journal report indicated the US wants to revoke waivers from top global semiconductor manufacturers used for accessing American technology in China. Nvidia (NVDA) fell around 1.1%..Meanwhile, Trump has introduced a self-imposed two-week time limit on deciding whether to enter the Middle East conflict, via a message relayed on Thursday by the White House press secretary. While the move added another layer of uncertainty to an already cautious market, it also opened a window for diplomacy to persuade Iran to negotiate — an idea its president rejected strongly on Friday..Eyes are now on European efforts to get Iran back to the table and avert further escalation in tensions. Foreign ministers from France, the UK, and Germany held talks in Geneva with their Iranian counterpart..Meanwhile, Fed governor Chris Waller on Friday floated the possibility of rate cuts in July, arguing recent inflation data has been tame even amid the introduction of Trump's tariffs. The central bank held interest rates steady this week, and Federal Reserve Chair Jerome Powell reiterated that policymakers are not rushing to ease, leading to a fresh attack from Trump..Waller's comments led to a slight uptick in bets on a July cut, though most traders are betting on the next cut coming in September, according to CME Group..Read more: The latest on Trump's tariffs.Stocks closed out the shortened trading week mixed as investors eyed a two-week waiting period for President Trump's decision on whether the US would directly get involved in the Israel-Iran conflict and Fed officials gave mixed signals on their next policy move..The Dow Jones Industrial Average (^DJI) rose just above the flat line..The S&P 500 (^GSPC) slipped about 0.2%, while the tech-heavy Nasdaq Composite (^IXIC) dropped 0.5%. The Dow and Nasdaq Comp saw their least volatile week of 2025..Trump said he would decide on Iran within the next two weeks. Meanwhile, in an interview, Fed governor Chris Waller on Friday floated the possibility of rate cuts in July. However, Richmond Fed president Thomas Barkin said there is no rush to cut yet. .Alphabet stock was on pace to end the week in the red as shares of the Google parent company sank more than 3% during Friday's session with tech broadly lower..The stock is down roughly 4% for the week..On Thursday, an adviser to Europe's highest court sided with EU regulators in Google's fight against a record 4.34 billion euro ($4.98 billion) fine..Turkey has also launched an anti-trust investigation into Google. A recent Reuters report noted the company has proposed more changes to its search results to better showcase rivals..Gold (GC=F) declined 0.3% on Friday after President Trump paused a decision over whether the US will become directly involved in the Israel-Iran conflict..The two-week timeframe to come to a decision on the matter has raised hopes of diplomacy..Gold is up nearly 30% this year amid increased demand for the precious metal from central banks and investors seeking out the safe haven as the US dollar (DX=F, DX-Y.NYB) index has weakened..The Dow Jones Industrial Average (^DJI) gave up session gains to fall below the flat line. The broad-based S&P 500 (^GSPC) and the tech-heavy Nasdaq Composite (^IXIC) were also down..All three major averages were on pace to end the week in red territory on Friday as Israel and Iran entered their second week of fighting..Chip stocks were under pressure on Friday after a Wall Street Journal report indicated the US aims to rescind waivers that allow top global semiconductor makers to access American technology at their Chinese plants..Yahoo Finance's David Hollerith reports:.Read more here. .Oil was on track to close out its third week of gains as investors awaited President Trump's decision on whether the US would directly intervene in the Israel-Iran conflict..West Texas Intermediate futures (CL=F) traded just below $75 per barrel, and Brent crude (BZ=F), the international benchmark, hovered near $76..WTI and Brent were up nearly 3% for the week after volatile sessions following the outbreak of the Israel-Iran conflict last Friday..Wall Street analysts have remained cautious on the recent rally..On Friday, Citi said its researchers ""see a lower risk of material energy flow disruptions from the conflict."".""Affecting the oil supply is not to the benefit of Iran or the US. In the event Iran’s 1.1 mbpd of oil exports are disrupted, the team estimates Brent prices could be $75–78/bbl — limited upside from current prices,"" wrote the analysts..Semiconductor stocks took a hit on Friday after a Wall Street Journal report indicated a top US official told top global semiconductor manufacturers he wants to rescind waivers used to access American technology in China..The move would once again inflame US-China trade tensions..Applied Materials (AMAT) and Lam Research (LRCX) both fell roughly 4%. Taiwan Semiconductor Manufacturing Company (TSM) and Broadcom (AVGO) also declined..Circle's (CRCL) massive rally shows no signs of cooling..The stablecoin issuer soared as much as 15% in early trading on Friday, extending its stunning post-IPO surge as Wall Street bets big on crypto’s next major disruptor..""Circle as a top-tier crypto 'disruptor' with a sizeable future opportunity,"" Seaport Research Partners analyst Jeff Cantwell wrote on Friday..""On the back of an improving regulatory climate, we expect adoption globally of stablecoins such as USDC,"" he added..Cantwell initiated the stock with a Buy rating and a price target of $235 a share from Seaport Research Partners..During mid-morning trading on Friday, Circle stock hovered near $228..The move follows a surge of about 30% on Wednesday following the Senate's passage of the GENIUS Act, legislation that provides a federal framework for stablecoins, which are digital tokens backed by assets, such as the US dollar..US stocks rose on Friday following dovish comments from Fed Governor Chris Waller. Investors also digested President Trump's two-week deadline for deciding whether the US will directly get involved in the Israel-Iran conflict..The Dow Jones Industrial Average (^DJI) rose 0.3% while the broad-based S&P 500 (^GSPC) gained roughly 0.4%. The tech-heavy Nasdaq Composite (^IXIC) rose 0.4%..Oil prices fell after the White House said Trump would make his decision within two weeks, leaving room for diplomacy. Still, crude futures were on pace for a third week of gains..Dovish comments also sent stocks higher after Fed governor Chris Waller on CNBC's Squawk Box suggested that the Federal Reserve could move to lower interest rates in July. Waller said that any inflation from tariffs may be short-lived..US stock futures edged higher ahead of the opening bell, with contracts on the Dow Jones Industrial Average futures (YM=F) and S&P 500 (ES=F) rising roughly 0.3%, and those on the tech-heavy Nasdaq 100 (NQ=F) adding 0.4%..The move higher followed dovish comments from Fed governor Chris Waller on CNBC's Squawk Box, suggesting that the Federal Reserve could move to lower interest rates in July. Waller argued that any inflation from tariffs may be short-lived..""Any tariff inflation ... I don't think is going to be that big, and we should just look through it in terms of setting policy,"" Waller said. ""The data the last few months has been showing that trend inflation is looking pretty good ... We could do this as early as July."".Read more here..Yahoo Finance's Brooke DiPalma reports:.Read more here..A recent memo from Amazon (AMZN) CEO Andy Jassy revived concerns about the scope of change to the labor market from artificial intelligence..While employers see growth and productivity, employees are worried about massive displacement in their jobs. And now, it's something the Federal Reserve is watching closely too:.Hamza Shaban writes in today's Morning Brief:.Read more here..Accenture (ACN) stock is down more than 4% after the global consultancy company reported new bookings decreased 6% to $19.7 billion in the quarter..Earnings topped estimates, with revenue coming in at $17.7 billion for the quarter, compared with analysts' average estimate of $17.30 billion, according to data compiled by LSEG..Reuters reports:.Read more here..CarMax (KMX) stock climbed 11% in premarket trading after the used car dealer's first quarter earnings and revenue beat Wall Street expectations..CarMax sold 379,727 cars in the first quarter, a 5.8% increase from the same period last year..The company also reported earnings per share of $1.38, and revenue rose 6.1% to $7.55 billion, topping estimates..CarMax CEO Bill Nash said that its omnichannel buying and selling experience ""is a key differentiator in a very large and fragmented market that positions us to continue to drive sales, gain market share, and deliver significant year-over-year earnings growth for years to come.”.Bloomberg reports:.Read more here..Here are some top stocks trending on Yahoo Finance in premarket trading:.Tesla (TSLA) stock rose over 1% before the bell following reports that the EV maker had signed a $557 million energy storage station deal. This deal was announced two days before Elon Musk's expected launch of its robotaxi..Semiconductor maker, Wolfspeed's (WOLF) stock fell 4% premarket after reports emerged on Thursday it would be taken over by creditors inculding Apollo Global Management. The chipmaker has been struggling recently and the new proposal would put them into bankruptcy..GMS (GMS) stock was up 23% after the Wall Street Journal (WSJ) reported that Home Depot (HD) the home-improvement giant, has made an offer to acquire GMS, a building-products distribution company, citing people familiar with the matter. The WSJ did not specify a price..Economic data: Leading index (May); Philadelphia Fed Business Outlook (June).Earnings: Accenture (ACN), CarMax (KMX), Darden Restaurants (DRI), Kroger (KR).Here are some of the biggest stories you may have missed yesterday, overnight and early this morning:.The Fed is also in 'wait and see' mode about AI taking jobs.The Trump phone probably won't be built in the US.Investors look past 'blah' Fed meeting.Tesla signs deal for first China battery storage station: Report.Trump to decide on Iran strike within two weeks.Dealmaking in 2025: AI to the rescue.Tariff talks with Canada, EU take focus as deadlines loom.A $20B clock is ticking for OpenAI as Microsoft talks sour.Trump blasts Powell again, calls for effectively 10 Fed rate cuts.China's rare earth magnet shipments halve in May due to export curbs.Why the US housing market is so stuck.Shares of Pop Mart (9992.HK, PMRTY) slid in Hong Kong after a call for stricter regulation of blind-box and trading cards in Chinese state media..That fueled concerns about prospects for the maker of furry Labubu elf dolls, whose explosive popularity has helped lift Beijing-based Pop Mart's market cap to around $40 billion — twice that of Hasbro (HAS) and Mattel (MAT) combined..Bloomberg reports:.Read more here..Oil prices look set to end this week with gains for the third consecutive week in a row. Extreme tensions in the Middle East have put consistent upwards pressure on the commodity, with the recent eruption into outright violence leaving investors looking at supply chains and production facilities with concern..Reuters reports: `.Read more here.",https://finance.yahoo.com/news/live/stock-market-today-sp-500-nasdaq-fall-amid-fed-rate-uncertainty-as-trump-mulls-iran-move-200035781.html," The news article reflects two primary types of risk:  1. **Economic Policy Risk**: This stems from uncertainty surrounding Federal Reserve (Fed) rate decisions, which can impact corporate earnings and investments.  2. **Geopolitical Risk**: The consideration by U.S. President Trump regarding direct military involvement in the ongoing conflict with Iran introduces significant geopolitical instability.  These factors together contribute to the observed decline in stock markets, as investors are reacting to both economic uncertainty and potential security concerns."
2025-06-21 19:51:00,"If I Could Buy Only 1 ""Magnificent 7"" Stock Over the Next Year, Alphabet Would Be It, but Here's the Key Reason","Alphabet stock is lagging behind other Magnificent 7 stocks, but is that a buying opportunity?","Alphabet shares have dipped 2% over the past year, while most ""Magnificent Seven"" stocks posted double-digit percentage gains..Market leaders like Nvidia and Microsoft may look flashier, but Alphabet could offer better value..A tasty combination of affordable shares and artificial intelligence (AI) expertise sets this stock apart from the rest..10 stocks we like better than Alphabet ›.The ""Magnificent Seven"" moniker was originally intended as a warning to long-term investors. Remember, the movie by the same name doesn't have the happiest of endings, and the tragedy made sense as a metaphor for potential market bubbles. Still, the Magnificent Seven group keeps setting the tone for the overall stock market, and most of these stocks are market darlings in 2025, with double-digit price gains over the last 52 weeks..But Google parent Alphabet (NASDAQ: GOOG) (NASDAQ: GOOGL) is lagging behind with a 2% price dip over the last year, and the stock looks downright undervalued in many ways. It's the only Magnificent Seven stock I have bought this year, for one simple reason: It's the best combination of affordable shares and unbeatable artificial intelligence (AI) expertise in this elite group..The other Magnificent Seven companies may have a leg up on Alphabet in the AI market so far. Nvidia's (NASDAQ: NVDA) profitable sales growth is unbeatable. Revenue-based market shares suggest that the cloud computing solutions from Amazon (NASDAQ: AMZN) and Microsoft (NASDAQ: MSFT) are running circles around Google Cloud..But those proven and promised results are firmly baked into the stock prices. Nvidia stock trades at 47 times earnings and 49 times free cash flows today. Microsoft and Amazon have P/E ratios in the mid-30s and cash flow multiples well above Nvidia's. At the same time, Alphabet stock looks affordable at 19 times earnings and 28 times free cash flows..The numbers never tell the whole story, and there's more to say about Alphabet's long-term growth opportunities. From AI services to quantum computing systems, the company was built to thrive amid ever-changing markets and unexpected economy jolts. But the modest stock valuation is a great starting point for further research..Before you buy stock in Alphabet, consider this:.The Motley Fool Stock Advisor analyst team just identified what they believe are the 10 best stocks for investors to buy now… and Alphabet wasn’t one of them. The 10 stocks that made the cut could produce monster returns in the coming years.",https://finance.yahoo.com/news/could-buy-only-1-magnificent-115100143.html," The investment decision of buying only one ""Magnificent 7"" stock, specifically Alphabet, involves several key risks:  1. **Market Risk**: The tech sector can be highly volatile, with broader market trends significantly affecting individual stocks.  2. **Concentration Risk**: Investing in just one company out of seven major tech firms exposes the portfolio to significant risk if that company underperforms.  3. **Competitive Landscape**: Alphabet might face intense competition from its peers and could struggle without strategic differentiation or innovation.  4. **Strategic Initiatives**: The need for Alphabet to implement effective strategies (e.g., AI, renewable energy) may be crucial to reversing its decline; failure here could lead to further declines.  5. **Valuation Concerns**: If the stock is undervalued due to perceived issues without corresponding fundamental changes, it might continue to fall.  6. **Diversification Risk**: Reliance on a single company within a large, diversified group like the ""Magnificent 7"" can result in unexpected losses if that specific company underperforms.  In conclusion, while Alphabet's lag could present an opportunity, potential risks include market volatility, competitive pressures, strategic challenges, and diversification issues. Investors should consider these factors carefully before making their decision."
2025-06-21 19:00:00,CrowdStrike Just Partnered Up With Nvidia. Should You Buy CRWD Stock Here?,A powerful alliance with Nvidia is redefining CrowdStrike’s AI capabilities. Can this push CRWD further into bullish territory?,"CrowdStrike (CRWD) continues to ride the wave of soaring enterprise demand for artificial intelligence (AI)-native cybersecurity solutions, fueled by platform consolidation and the swift embrace of its Falcon Flex model. As businesses race to modernize security operations amid a rapidly evolving AI threat landscape, the company finds itself perfectly positioned..On June 11, CrowdStrike’s shares surged 2% following the announcement that it would integrate its Falcon Cloud Security with Nvidia’s (NVDA) universal LLM NIM microservices and NeMo Safety. The collaboration delivers comprehensive protection for AI and over 100,000 large language models..Dear Tesla Stock Fans, Mark Your Calendars for June 30.Nvidia Is Quickly Approaching a New Record High. Is It Too Late to Buy NVDA Stock?.The ‘Golden Era’ for Tesla Starts June 22. Should You Buy TSLA Stock First?.Markets move fast. Keep up by reading our FREE midday Barchart Brief newsletter for exclusive charts, analysis, and headlines..With large language models moving into production, the risk of AI-related threats such as data poisoning, tampering, and sensitive data leaks is escalating. CrowdStrike’s Falcon platform pairs seamlessly with NVIDIA NIM, offering full lifecycle defense by monitoring runtime behavior and leveraging AI-driven detection and response..CRWD stock hit a new 52-week high on June 17 and is trading less than 2% beneath it as of this writing. Its Nvidia alliance could serve as the next catalyst for upward momentum..Based in Austin, Texas, CrowdStrike (CRWD) is a $120.9 billion cybersecurity leader, delivering cloud-native protection for endpoints, workloads, identities and data..In the past 52 weeks, CRWD stock has climbed 24.6%..On June 3, CrowdStrike reported its first-quarter earnings for fiscal 2026, delivering results that outpaced management’s expectations. Revenues climbed steadily to $1.1 billion, marking a 20% year-over-year jump and aligning neatly with the Street’s forecasts. This marked the third consecutive quarter where revenues surpassed the $1 billion threshold, a feat driven in large part by the Falcon Flex Subscription Model..As of the quarter’s end, annual recurring revenue (ARR) stood at $4.44 billion, reflecting a 22% year-over-year rise. The engine behind this surge was Falcon Flex again, which added $774 million in total account value this quarter alone, swelling the cumulative deal value of Falcon Flex accounts to $3.2 billion.",https://finance.yahoo.com/news/crowdstrike-just-partnered-nvidia-buy-110002219.html," The partnership between CrowdStrike and Nvidia presents a complex landscape of potential benefits and risks. While the collaboration has the potential to enhance CrowdStrike's AI-driven security solutions, it also introduces several risks:  1. **Regulatory Scrutiny**: Increased regulatory oversight, particularly concerning AI applications without consent, could impact their business model.  2. **Market Competition**: High competition in the cybersecurity sector may dilute returns if the partnership doesn't deliver as expected or faces delays.  3. **Dependency on Third-Party Ecosystems**: Over-reliance on Nvidia's hardware and software could pose vulnerabilities if changes occur in their business model or availability of critical components.  4. **Technical Risks**: Integration challenges, including resource-intensive development and potential implementation issues, may affect the technology's effectiveness.  5. **Ongoing Threat Landscape**: The need to continuously adapt to evolving cyber threats remains a constant challenge for CrowdStrike, affecting investor sentiment.  6. **Market Conditions**: Potential overvaluation or market noise could lead to irrational stock movements without considering all risks.  7. **Unexpected Side Effects**: Operational complexities from integrating AI might incur unexpected costs and inefficiencies.  In conclusion, while the partnership offers promising benefits, these risks suggest that investors should carefully assess the potential downsides before making decisions."
2025-06-21 19:00:00,"Nvidia Stock Prediction, From Someone Who Has Invested for Decades","The big winner of the first phase of the artificial intelligence (AI) revolution has clearly been Nvidia.  As competition heats up in the AI chips market, cloud services providers could benefit.  In the span of only a few years, Nvidia (NASDAQ: NVDA) has become one of the largest stocks in the world.","The big winner of the first phase of the artificial intelligence (AI) revolution has clearly been Nvidia..As competition heats up in the AI chips market, cloud services providers could benefit..10 stocks we like better than Nvidia ›.In the span of only a few years, Nvidia (NASDAQ: NVDA) has become one of the largest stocks in the world. Indeed, as of this writing, the company boasts a market cap of more than $3.5 trillion, only slightly trailing Microsoft as the world's largest company by market cap..The engine that propelled Nvidia's stock to these incredible heights has been its industry-leading graphics processing units (GPUs), which are favored by artificial intelligence (AI) developers for their power and speed. .However, as the AI revolution rolls on, other companies may supplant Nvidia. Aside from the inevitable battle for GPU market share, other companies may be better positioned to benefit from the next phases of the AI revolution. And there's one stock that my decades of investing experience tell me is the one to watch..There are two things that stand out about Nvidia's rise over the last three years: revenue and margin growth..First, the company's revenue has simply gone through the roof as the AI revolution took flight. In 2022, Nvidia generated about $27 billion in revenue. As of its most recent quarter (for the three months ending on Jan. 26), the company reported $130 billion in revenue. That's shockingly fast growth, and it's the reason most often cited for why Nvidia's share price has advanced by more than 800%..However, in addition to its incredible revenue growth, the company's margins widened. In 2022, the company's gross margin stood around 60%. Today, it's around 70%. That's excellent and far ahead of the company's traditional competitors like Advance Micro Devices and Intel..However, like all good things, this gross margin dominance will to come to an end at some point, as competition heats up. Not only will AMD and Intel improve their designs and take market share, but new competitors will enter the market. Deep-pocketed players like Alphabet, Amazon, Microsoft, Meta Platforms, and Apple are all at work on their own AI chip designs that might eventually eat away at Nvidia's margins..So, as this market for AI chips becomes more saturated, who will benefit? My investing instincts point to one of the big buyers of AI chips..Ultimately, basic economics principles say that the buyers of AI chips will benefit as the AI chip market becomes more competitive. That is, as the price of AI chips fall, the companies that buy the most chips will save money, resulting in higher profits.",https://finance.yahoo.com/news/nvidia-stock-prediction-someone-invested-110000215.html," The type of risk involved in this article about Nvidia's stock prediction is **market risk**. This classification is based on the fact that the article does not provide detailed analysis or specific factors influencing future performance, relying instead on broader market conditions and general market factors that could impact stock prices."
