Datetime,headline,description,article,link,analysis
2025-06-19 08:00:00,Nvidia and the AI boom helps Malaysia’s NationGate debut on the Fortune Southeast Asia 500 with a 720% revenue surge,"NationGate generated $1.6 billion in revenue last year, high enough to place it at No. 243 on the Fortune Southeast Asia 500.","The Fortune Southeast Asia 500’s fastest-growing company can thank the AI boom for its rapid rise. Generative AI has driven an investment surge into data centers, which provide the infrastructure for storing, processing, and distributing data, key to running AI applications..Malaysia has garnered a significant share of this investment, attracting multibillion-dollar deals from the likes of Google, Oracle, and Microsoft over the past 18 months..And some of that hype has boosted the fortunes of some of Malaysia’s companies, including NationGate, an electronics manufacturing services provider..The company generated 5.27 billion Malaysian ringgit ($1.6 billion) in revenue last year, high enough to place it at No. 243 on the Fortune Southeast Asia 500. Even more staggeringly, the company grew its revenues by more than 720%, making it the fastest-growing company in terms of revenue on this year’s list..NationGate also earned $35 million in profits, a respectable 163% increase from the year before..The company’s data computing segment drove much of its revenue, contributing 88% this year compared with 17% in 2023. NationGate also works with the automotive and telecommunications sectors..More than half of NationGate’s revenue comes from Malaysia; another third comes from Singapore. The two countries are arguably Southeast Asia’s data center hubs..One of NationGate’s key businesses is assembling AI products. And it has a key advantage in this space as Nvidia’s only original equipment manufacturing partner in Southeast Asia. That means NationGate is the only company in the region that assembles Nvidia’s highly sought-after graphics processing units (GPUs) into AI servers. Nvidia’s GPUs are by far the most used in high-performance AI applications..NationGate sees “immense potential” in AI, and believes that its entry into AI server manufacturing will help it tap into “double digit” annual growth in data center investments in both Southeast Asia and globally..But the AI boom brings risks, too..Both Malaysia and Singapore have faced scrutiny owing to allegations that both countries are channels for controlled U.S. chips to make their way to China. In particular, U.S. officials are reportedly examining whether DeepSeek, the Chinese AI startup, circumvented U.S. export control measures with the help of third parties in Singapore..In March, K Shanmugam, Singapore’s Law and Home Affairs Minister, said servers containing chips controlled under U.S. export controls appeared to have been sent to Malaysia. Following that allegation, Malaysian Trade Minister Tengku Zafrul Abdul Aziz said officials were investigating and vowed to take necessary action against local companies engaging in fraud.",https://finance.yahoo.com/news/nvidia-ai-boom-helps-malaysia-000000416.html," The analysis of the provided news article about Nvidia and Malaysia's NationGate reveals that there is no significant risk associated with the information presented. The key points considered were various types of risks such as market, regulatory, economic, competitive, reputational, and operational risks. However, the article does not indicate any specific threats or issues in these areas. Therefore, based on the given information, the risk level is deemed negligible.  **Answer:** No risk."
2025-06-19 06:00:00,Prediction: This Artificial Intelligence (AI) Stock Could Be the Biggest Winner of the Second Half of 2025,"While cloud and chip stocks remain hot, I see a beaten-down artificial intelligence (AI) stock positioned for a comeback over the next six months.","One ""Magnificent Seven"" stock that has underperformed its peers this year is Tesla..While Tesla's core car business is losing momentum, all eyes seem to be on the company's upcoming robotaxi launch..A bullish narrative surrounding robotaxi has fueled some recent excitement in Tesla stock as of late, and I think this is just the beginning a new months-long breakout..These 10 stocks could mint the next wave of millionaires ›.As of June 12, shares of electric vehicle (EV) manufacturer Tesla (NASDAQ: TSLA) have dropped by 21% on the year. On the surface, this doesn't exactly inspire confidence..However, over the last couple of weeks, Tesla stock has started to witness some new life -- save for a brief sell-off following a fleeting tiff between Elon Musk and President Trump..While Tesla's core EV business continues to struggle, I think shares are poised for an epic comeback during the second half of the year..Let's explore a major update coming to Tesla soon and understand how this could fuel shares to new all-time highs. Is now the time to pounce on Tesla stock? Read on to find out..Tesla investors understand that Elon Musk's vision for the company is not just to sell the most EVs. Rather, Musk has been focusing on various elements of artificial intelligence (AI) and how the technology can be used to transform Tesla..Right now, the most immediate AI use case for Tesla is commercializing autonomous driving software. Tesla plans to leverage self-driving software across two applications: offering it as a feature in its cars and building a fleet of robotaxis for ride-hailing services..While the initial launch date for the Tesla Robotaxi was rumored to be June 12, more recent commentary from Musk himself suggests that the first rides will take place in Austin, Texas, later this month (potentially between June 22 and 28)..A successful robotaxi launch represents a transformative shift in Tesla -- from primarily a car manufacturer to more of an AI-powered services provider disrupting ride-hailing, car rentals, or logistics businesses..When it comes to popular stocks in the AI realm, I'm sure cloud hyperscalers Microsoft, Alphabet, and Amazon come to mind. Moreover, given Nvidia's ongoing rollout of its new Blackwell GPU architecture, the semiconductor king appears well positioned for further growth, too..Among Microsoft, Alphabet, and Amazon, these three cloud computing giants are forecast to spend nearly $260 billion in AI capital expenditures (capex) just this year.",https://finance.yahoo.com/news/prediction-artificial-intelligence-ai-stock-220000899.html," The news article about an AI stock being positioned for a comeback over the next six months is categorized as **moderate risk**. Here's why:  1. **Market Volatility**: The sudden surge in AI stocks could cause market volatility due to increased trading activity, potentially leading to price fluctuations.  2. **Competition from Other Technologies**: While machine learning (a subset of AI) may offer competition, the broader context includes emerging technologies like quantum computing that could overshadow AI in specific applications.  3. **Regulatory Risks**: The rise of AI brings concerns over data privacy, bias in algorithms, and job displacement. Regulatory changes or legal challenges could impact the stock negatively.  4. **Operational Risks**: Companies might face operational challenges such as talent shortages (specialized AI engineers), integration difficulties with existing systems, or supply chain issues.  5. **Market Overvaluation**: The stock may become overvalued quickly if there's a positive reaction without considering fundamental changes, potentially leading to a correction.  6. **Economic Conditions**: The overall state of the economy could affect companies regardless of AI trends, and inflationary pressures might impact performance.  7. **Supply and Demand Dynamics**: A surge in demand due to increased supply could lead to unexpected market movements if fundamentals don't support rapid growth.  8. **Unexpected Events or Announcements**: Major news, positive or negative, related to AI could cause unexpected market shifts.  9. **Liquidity Issues**: A sudden rush of buying could affect liquidity and price dynamics.  10. **Long-Term vs Short-Term Impact**: While AI is expected to perform well in 2025, future outcomes depend on its actual impact beyond this period.  11. **Investor Sentiment Driven Bubbles**: Investor excitement about AI without solid fundamentals could lead to overvaluation and subsequent corrections.  Thus, while the potential for growth exists, moderate risk is appropriate due to these factors that could negatively impact the stock."
2025-06-19 04:33:00,"Top Analyst Reports for NVIDIA, Visa & Exxon Mobil","NVDA, V, and XOM lead Zacks' top analyst picks with standout gains driven by AI, digital payments, and upstream strength.","Wednesday, June 18, 2025The Zacks Research Daily presents the best research output of our analyst team. Today's Research Daily features new research reports on 16 major stocks, including NVIDIA Corp. (NVDA), Visa Inc. (V) and Exxon Mobil Corp. (XOM), as well as two micro-cap stocks Omega Flex, Inc. (OFLX) and Weyco Group, Inc. (WEYS). The Zacks microcap research is unique as our research content on these small and under-the-radar companies is the only research of its type in the country.These research reports have been hand-picked from the roughly 70 reports published by our analyst team today.You can see all of today’s research reports here >>>Ahead of Wall StreetThe daily 'Ahead of Wall Street' article is a must-read for all investors who would like to be ready for that day's trading action. The article comes out before the market opens and attempts to make sense of that morning's economic releases and how they will affect that day's market action. You can read this article for free on our home page and can actually sign up there to get an email notification as this article comes out each morning.You can read today's AWS here >>> Homebuilding Down, Jobless Claims Up; Fed News LaterToday's Featured Research ReportsNVIDIA’s shares have outperformed the Zacks Semiconductor - General industry over the past year (+6% vs. +4.1%). The company is benefiting from the strong growth of artificial intelligence (AI), high-performance and accelerated computing. The growing demand for generative AI and large language models using graphic processing units (GPUs) based on NVIDIA’s Hopper and Blackwell architectures is aiding data center revenues. Continued ramp-up of Ada RTX GPU workstations in the ProViz end market, following the normalization of channel inventory, is acting as a tailwind. Collaborations with over 320 automakers and tier-one suppliers are likely to advance its presence in the autonomous vehicles space. The Zacks analyst expect NVIDIA’s revenues to witness a CAGR of 28.95% through fiscal 2026-2028. However, a limited supply of Blackwell and Ada GPUs could hinder its ability to meet demand. Rising costs associated with the production of more complex AI systems will hurt margins.(You can read the full research report on NVIDIA here >>>)Shares of Visa have outperformed the Zacks Financial Transaction Services industry over the past year (+32.6% vs. +26.6%). The company’s strong market position is underpinned by consistent volume-driven growth, acquisitions and technological leadership in digital payments. Expansion in cross-border volumes, rising digital transactions, and investments in AI and stablecoin infrastructure enhance its future prospects.A robust financial position with ample liquidity and shareholder returns further supports long-term growth. Visa shares outperformed the industry over the past year. However, the company faces rising client incentives and expenses, which may weigh slightly on margins. Regulatory pressures and potential legislative changes pose additional risks to its fee structures. While declining cash volumes align with Visa’s digital strategy, regional softness warrants monitoring. Moreover, the stock’s premium valuation suggests limited near-term upside.(You can read the full research report on Visa here >>>)Exxon Mobil’s shares have outperformed the Zacks Oil and Gas - Integrated - International industry over the past year (+9.3% vs. +3.6%). The company’s high-value assets in the Permian Basin and Guyana are driving robust production growth, doubling upstream earnings since 2019. The Pioneer acquisition and Guyana ramp-up have enhanced profitability, while a robust structural savings strengthen resilience.  With a lower exposure to debt capital, XOM supports steady cash flows, dividends, buybacks and investments in high-return projects. The Exxon Mobil reported better-than-expected Q1 earnings fueled by higher production from Guyana, the Permian and structural cost savings.Yet, refining profits weakened due to a significant fall in industry refining margins. The refining margin pressure intensifies the reliance on upstream operations, which is vulnerable to fluctuating oil and gas prices. Commodity price volatility challenges profitability, especially as crude prices dipped due to the impact of trade tariffs.(You can read the full research report on Exxon Mobil here >>>)Shares of Omega Flex have underperformed the Zacks Steel - Pipe and Tube industry over the past year (-39.9% vs. +21.8%). This microcap company with a market capitalization of $330.79 million is facing ongoing construction market weakness led to a 7.5% sales decline in Q1, with additional risk from distributor concentration and decarbonization headwinds affecting core gas piping demand. Operating income fell 19.9% YoY, reflecting deleverage. Trading at 12.8X EV/EBITDA, the stock lags sector peers and has dropped 39% over 12 months.Nevertheless, Omega Flex offers a resilient investment profile backed by a strong balance sheet, market leadership, and high-margin product innovation. The company ended Q1 2025 with $49.2 million in cash and no debt, providing ample flexibility. Despite macro headwinds, it generated $1.6 million in operating cash flow and maintained dividend consistency. Omega Flex dominates the U.S. flexible metal hose market via its TracPipe and CounterStrike lines. Expansion into safety-critical applications like MediTrac and DoubleTrac diversifies revenues and supports margins. (You can read the full research report on Omega Flex here >>>)Weyco’s shares have outperformed the Zacks Shoes and Retail Apparel industry over the past year (+10.3% vs. -32.7%). This microcap company with a market capitalization of $286.69 million has a solid balance sheet — with $77.9 million in cash, no debt, and strong cash flow — and supports dividends, buybacks, and strategic investments without external funding. Florsheim’s 7% Q1 growth and traction in “refined casual” styles offset weakness in legacy brands like Nunn Bush and Stacy Adams. Retail gross margins held at 66.6%, underscoring pricing power and digital focus. A special dividend and a 4% dividend hike show a commitment to shareholder returns. Strategic inventory buildup cushions tariff risks and ensures supply continuity.However, margin pressure from steep tariffs, BOGS weakness, wholesale softness and geographic concentration pose risks. Ongoing supply chain shifts away from China are necessary, but may disrupt operations. Despite these headwinds, shares appear undervalued at 0.74X EV/sales and 5.63X EV/EBITDA, below industry and market medians. (You can read the full research report on Weyco here >>>)Other noteworthy reports we are featuring today include Wells Fargo & Co. (WFC), McDonald's Corp. (MCD) and Blackstone Inc. (BX).Mark VickerySenior EditorNote: Sheraz Mian heads the Zacks Equity Research department and is a well-regarded expert of aggregate earnings. He is frequently quoted in the print and electronic media and publishes the weekly Earnings Trends and Earnings Preview reports. If you want an email notification each time Sheraz publishes a new article, please click here>>>",https://finance.yahoo.com/news/top-analyst-reports-nvidia-visa-203300812.html," The primary risk associated with the news article is **market risk**, as the companies' performance is sensitive to market trends, regulatory changes, and industry shifts affecting their respective sectors."
2025-06-19 03:48:00,"Buy Nvidia, AMD Supplier Micron Stock Down 20% for AI Growth","Micron is a compelling long-term AI investment because it's a leader in high-bandwidth memory chips, trading 20% below its highs and it offers enticing value even though it crushed Tech the last 20 years.","Micron Technology, Inc. MU stock has soared 90% since early April and 45% in 2025, retaking critical technical levels in the process..Despite the rally, the semiconductor stock trades 20% below its June 2024 highs because its earnings outlook faded within the historically cyclical memory segment. .Now looks like a wonderful opportunity to buy Micron for long-term artificial intelligence upside before its Q3 FY25 release on June 25..Micron is a compelling long-term AI investment because it is a leader in high-bandwidth memory chips that are critical for AI workloads. MU works directly with AI chip powerhouse Nvidia and its closest rival, AMD..Micron’s earnings and revenue growth outlook is staggering in FY25 and FY26. It also trades at a huge discount to Tech, though its stock has outpaced the sector for the last 20 years. .Micron makes DRAM and NAND memory and storage chips that are critical components within devices from smartphones to AI data centers. Its growth and innovations in a key segment of the semiconductor industry helped MU stock climb roughly 1,100% in the past 20 years to crush the Zacks Tech sector’s 770%..The company works closely with Nvidia, and it is expanding its manufacturing footprint in the U.S. as part of the larger reshoring boom. Micron is a vertically integrated semiconductor company. This means it designs, manufactures, and tests most of its chips in-house, unlike fabless companies such as Nvidia that outsource manufacturing to foundries like TSMC..Speaking of, Micron announced on June 12 that it is expanding its U.S. investments to $200 billion, including $150 billion for memory chip manufacturing and $50 billion for R&D, to boost domestic semiconductor production. .Micron, boosted by help from the U.S. government, aims to produce 40% of its DRAM in the U.S. On top of that, the “co-location of these two Idaho fabs with Micron’s Idaho R&D operations will drive economies of scale and faster time to market for leading-edge products.”.Image Source: Zacks Investment Research.MU’s memory segment has been one of the most boom-and-bust parts of the historically cyclical semiconductor industry. Micron’s revenue has fluctuated alongside consumer spending and production cycles across smartphones, PCs, laptops, vehicles, and more..The rise of data centers and, most recently, artificial intelligence, could see Micron become a bit more decoupled from those business cycles..The company’s advanced high-bandwidth memory (HBM) technologies are critical to AI because they provide the high bandwidth and large memory capacity needed to quickly move massive data sets for training and running complex AI models. ",https://finance.yahoo.com/news/buy-nvidia-amd-supplier-micron-194800256.html," The risk associated with the article can be classified as **market sentiment risk** due to a 20% decline in Micron's stock. The article indicates that while Micron has strong fundamentals—being a key supplier to AI growth—the current stock price doesn't reflect this value yet. Investors might react negatively, leading to further declines and a self-reinforcing downward trend.  ### Key Risks: 1. **Market Sentiment Risk**: Investors may panic sell due to the drop, causing a negative feedback loop and exacerbating the decline. 2. **Sector Risk**: The AI sector's rapid expansion could lead to investor distrust if Micron's performance doesn't meet expectations, prompting a shift to cheaper alternatives. 3. **Competitive Risk**: With strong competitors like AMD and Nvidia, Micron might struggle to maintain its dominance as the AI market evolves.  This risk is primarily psychological, driven by investor reactions rather than just numerical data, making it crucial for understanding potential investment outcomes."
2025-06-19 03:19:00,Agents Are the Hot Thing in AI. These Stocks Could Win.,"Agentic AI is expected to change the internet for good, and BofA Securities has identified a few companies it believes are set to reap the benefits.  Generative AI has taken the world by storm as chatbots grow in popularity, bringing more specific and conversational answers to questions.  Tech experts foresee yet more change, saying agentic AI could be the next big thing.","Agentic AI is expected to change the internet for good, and BofA Securities has identified a few companies it believes are set to reap the benefits. Generative AI has taken the world by storm as chatbots grow in popularity, bringing more specific and conversational answers to questions. Tech experts foresee yet more change, saying agentic AI could be the next big thing.",https://finance.yahoo.com/m/34dd024d-616b-3fea-af93-27c8b6655f34/agents-are-the-hot-thing-in.html," The news article discusses AGENTIC AI's potential impact on certain stocks. The associated risks include:  1. **Volatility Risk**: The stock market can experience significant price swings due to the emergence of new technologies, leading to rapid increases or decreases in value.  2. **Sentiment Risk**: Investor confidence and optimism about AGENTIC AI could fluctuate, affecting stock prices accordingly.  These factors contribute to exposure that investors might face based on market reactions and investor sentiment towards the technology."
2025-06-19 02:49:00,"Nvidia Goes Nuclear, Investing in Bill Gates’ Start-Up","NVentures, Nvidia’s venture-capital arm, was part of the latest funding round for TerraPower, a nuclear developer founded by Bill Gates.","NVentures, Nvidia’s venture-capital arm, was part of the latest funding round for TerraPower, a nuclear developer founded by Bill Gates.",https://finance.yahoo.com/m/41d9679a-c7cc-3909-bbdc-fc5dd4979314/nvidia-goes-nuclear-.html," The article about Nvidia investing in Bill Gates' start-up, TerraPower, involves several types of risks:  1. **Operational Risk**: Potential shutdowns or legal issues if the project fails, particularly concerning nuclear energy's safety concerns like past incidents such as Chernobyl.  2. **Financial Risk**: The investment carries the risk of loss if the project proves too risky to sustain in the long term, leading to financial losses for both Nvidia and NVentures.  3. **Regulatory Risk**: Compliance challenges with strict nuclear regulations could lead to legal issues or project delays requiring costly changes.  4. **Competitive Risk**: Competing with established companies like Microsoft and OpenAI might affect Bill Gates' existing businesses, potentially reducing their competitiveness and forcing diversification efforts.  5. **Reputational Risk**: Success or failure of the project could impact Bill's reputation as a founder of major tech companies, affecting public trust in his other ventures.  6. **Strategic Risk**: Entering the nuclear energy sector involves complex political, regulatory, and ethical considerations with potential geopolitical implications.  In summary, while the investment represents an opportunity due to its strategic depth, it also entails significant operational, financial, regulatory, competitive, reputational, and strategic risks that need careful consideration."
