Datetime,headline,description,article,link
2025-06-17 12:03:00,Bear of the Day: PDD Holdings (PDD),"Though Temu parent PDD Holdings has carved out an impressive niche in the global e-commerce landscape, the company faces signficant headwinds, including, tarriffs, a weak Chinese economy, and intense competition.","Zacks Rank #5 (Strong Sell) stock PDD Holdings (PDD), also known as Pinduoduo, is a multinational e-commerce company that operates in China and globally. PDD, which was based originally in Shanghai, enjoys it’ largest market in China and operates under the Pinduoduo name. Meanwhile, PDD’s US and international businesses operate under the ‘Temu” umbrella. PDD has gained a foothold in several international markets by offering competitive and often cheaper prices than competitors such as JD.com (JD), Alibaba (BABA), and Amazon (AMZN)..In its Chinese market, another key differentiator for PDD Holdings is that it offers a group buying model that allows customers to unlock lower prices by encouraging family and friends also to purchase items. The team purchase model does this through an interactive and social shopping experience. In addition, PDD can often offer lower prices because it removes the middleman and connects users directly with agricultural producers, allowing the company to provide fresh, affordable produce. Beyond its e-commerce platform, PDD has vertically integrated its business with a vast network of sourcing, logistics, and fulfillment capabilities..Last quarter, PDD’s net profit plunged nearly 50%, and the company fell short of Zacks Consensus Estimates by an ugly 37%..Image Source: Zacks Investment Research.PDD is suffering amid three major challenges, including:.·       Tariff Turmoil: PDD was one of the most adversely impacted businesses in the tit-for-tat tariff war between the US and China.Though tensions have cooled between the world’s two largest economies, the US still has a tariff on China of around 50%, likely making goods from the Temu website far more expensive for Americans..·       A Weak Chinese Economy: An ongoing housing crisis, rampant unemployment, and sluggish domestic consumption are all factors causing PDD’s Chinese business to suffer..·       Intense Competition: The Chinese e-commerce market is highly competitive. Though PDD missed estimates, JD beat estimates in the recent quarter – an ominous sign..PDD is not only suffering from sluggish demand but also weak profit margins. In fact, quarterly margins have been cut in half since 2024..Image Source: Zacks Investment Research.PDD shares are stuck in a downtrend, exhibiting relative weakness, and are carving out a bear flag chart pattern..Image Source: Zacks Investment Research",https://finance.yahoo.com/news/bear-day-pdd-holdings-pdd-080000362.html
2025-06-17 12:03:00,Prediction: 2 Stocks That'll Be Worth More Than Apple 5 Years From Now,"Apple is one of the largest companies in the world, but its growth has slowed, and it is lagging in AI.  Amazon, meanwhile, is an AI leader, using the technology to drive growth and efficiencies.  Meta Platforms is also at the forefront of AI, using the technology to increase user engagement on its platform and improve the effectiveness of its ads.","Apple is one of the largest companies in the world, but its growth has slowed, and it is lagging in AI..Amazon, meanwhile, is an AI leader, using the technology to drive growth and efficiencies..Meta Platforms is also at the forefront of AI, using the technology to increase user engagement on its platform and improve the effectiveness of its ads..10 stocks we like better than Apple ›.With a market capitalization of just a tad under $3 billion, Apple (NASDAQ: AAPL) is one of the largest companies in the world. However, its revenue growth over the past few years has been modest, while much of its stock gains have come from multiple expansions, as its price-to-earnings (P/E) ratio has been increasing..The company also appears to have fallen behind in the artificial intelligence (AI) race, with Apple Intelligence features reportedly consistently running into delays. In addition, some high-gross-margin revenue from a revenue-sharing agreement that allows Google to be the exclusive search engine for Safari on Apple devices is at risk after Alphabet lost an antitrust trial where the agreement was at the center of the case. While the company likely wouldn't lose all of this revenue, there is a risk that some of it would go away if it gave users the option to choose their default search engine..Against this background, the upside for Apple may be limited over the next several years, opening the door for other companies to become larger than Apple. Let's look at two companies that could exceed Apple's market cap in the next five years..With a market cap of roughly $2.3 billion, Amazon (NASDAQ: AMZN) is well-positioned to overtake Apple in size over the next few years. The company is the market-share leader in two important segments: e-commerce and cloud computing. And while Apple has lagged on the AI front, Amazon has gone all in, incorporating AI throughout its businesses to help make them more efficient and drive growth..Its e-commerce business has settled into being a high single-digit, low double-digit percentage revenue grower. The segment is seeing strong margin expansion and operating leverage, which are powering profitability growth. Its high-gross margin, sponsored-ad business is playing a big part, with revenue climbing 19% year over year last quarter to $13.9 billion..Amazon is also seeing a lot of operational efficiencies. The company now incorporates AI throughout its warehouse and logistics operations to improve efficiencies and lower costs. It is developing AI-powered robots that can perform multiple tasks and even detect damaged items, helping the company save money on labor and costly returns. Meanwhile, it's using AI in its logistics business to help drivers save time and fuel by planning better routes and helping them more easily locate hard-to-find addresses in places like large apartment complexes.",https://finance.yahoo.com/news/prediction-2-stocks-thatll-worth-074500784.html
2025-06-17 12:03:00,2 Top Buffett Stocks to Buy and Hold for the Long Haul,Amazon is the top online retailer and is improving efficiency with AI technology.  Visa's massive payment network gives it a wide moat and financial stability.  Both of these Buffett stocks have a good chance of outperforming the market.,"Amazon is the top online retailer and is improving efficiency with AI technology..Visa's massive payment network gives it a wide moat and financial stability..Both of these Buffett stocks have a good chance of outperforming the market..10 stocks we like better than Amazon ›.Warren Buffett is the quintessential long-term investor. He says that you shouldn't buy stocks unless you expect to hold them for a very extended period, and he has followed that approach with the companies he invests in through Berkshire Hathaway. He has held on to many stocks for decades..Considering Buffett's approach, and his impressive track record, Berkshire's portfolio is a great place to get investment ideas. Here are two Buffett stocks worth checking out..Berkshire owned 10 million shares of Amazon (NASDAQ: AMZN) as of its 13F filing on May 15. Given Amazon's dominance over e-commerce, as well as its cloud services and use of artificial intelligence (AI), it's an excellent stock to buy and hold..Amazon is the top online retailer in the world as measured by revenue, and even though this is an established company, it's still seeing good revenue growth. Net sales were $155.7 billion in the first quarter of 2025, a 9% year-over-year increase. Analysts expect the global e-commerce market to continue growing -- Grand View Research is projecting annual growth of 11.6% until 2030 -- which should mean plenty of growth to come for Amazon..Online sales isn't the only place where Amazon is No. 1. Amazon Web Services (AWS) is the top cloud service provider by market share, with 30% of the global market at the end of 2024..Last but not least, Amazon has been leveraging generative AI technology to improve efficiency for itself and its sellers. It currently has about 1,000 generative AI applications in use, including tools that drastically cut down the time it takes for sellers to list their products..Despite being one of the largest companies in the world, Amazon is still focused on innovation and expansion. I think it's a quality investment right now and will continue to be 10 and 20 years down the road..Visa (NYSE: V) is one of the companies that Buffett has held for more than a decade. He started investing in 2011, and Berkshire now owns 8.3 million shares, good for just over 1% of its stock holdings..As a payment network, Visa has a simple, effective business model. When people pay with their Visa debit or credit cards, Visa collects a fee from the merchant. Credit card fees can be particularly lucrative, as they generally range from 1.1% to 3.15% of the transaction, according to data compiled by Motley Fool Money, a personal finance brand by The Motley Fool. Visa gets a portion of the fee, and the bank that issued the payment card gets the rest.",https://finance.yahoo.com/news/2-top-buffett-stocks-buy-073500744.html
2025-06-17 12:03:00,"Best credit card deals of the week, 18 June","Discover the best credit cards to save money, earn rewards and travel smarter","Credit cards aren't just about spending. They are also powerful tools that, when used wisely, can help you save money, manage debt and even earn rewards. Whether you're looking to cut down on interest payments, earn cashback on everyday purchases, rack up air miles for your next holiday, or avoid fees while traveling abroad, there's a credit card tailored to your needs..In this guide, we’ll break down the best options on the market for balance transfers, purchases, cashback, air miles and travel spending. We'll show you how to use these cards to your advantage, ensuring you get the most value while avoiding common mistakes..If you're struggling to keep up with credit card payments, a balance transfer credit card can be a lifesaver. These cards allow you to transfer existing credit card debt onto a new card with a 0% interest rate for a set period, potentially saving you hundreds of pounds in interest..Read more: Bank of England expected to hold interest rates as oil prices rise and UK growth falters.However, there are some crucial rules to follow to make the most of these deals:.Always pay the minimum monthly repayment. Missing a payment could result in losing your 0% interest deal, incurring fines, and damaging your credit score..Clear the debt within the interest-free period. To avoid paying interest after the promotional period ends, make sure you can pay off the entire balance within the 0% timeframe..Don’t use the card for new purchases. The 0% deal usually applies only to transferred balances, and using the card for new spending could result in hefty interest charges..Check your credit score. The best deals are often reserved for those with a strong credit rating, so it's worth checking your score before applying..Kate Steere, a credit card expert at personal finance comparison site finder.com, said: “NatWest (NWG.L) is leading the pack this week with 34 months at 0%. However, its transfer fee at 3.49% is slightly higher than that of HSBC (HSBA.L) and Tesco Bank at 3.19%, which are still offering a top-of-market deal of 0% at 33 months..""The longest 0% deals always come with these painful, percentage-based balance transfer fees. So if you’re in the market for a balance transfer and don’t think you’ll need such a long period to clear your card debt, then first consider the longest no-fee deals on the market (Barclaycard (BARC.L) currently offers 14 months with no transfer fee)..""But if you do know you'll need longer to clear your debt, then a balance transfer fee could be worth shouldering. Tesco has a respectable 'Goldilocks' deal, if you'd like something in the middle: a 0.99% transfer fee in return for 18 months at 0%.""",https://finance.yahoo.com/news/best-credit-card-deals-093401129.html
2025-06-17 12:03:00,Why the UK's AIM is struggling 30 years on,The UK's alternative investment market has seen some major successes since launching 30 years ago but has recently struggled to attract and retain companies.,"The UK's alternative investment market (AIM) has seen some major successes since its inception 30 years ago but has struggled to attract and retain companies in recent years..Launched on 19 June 1995, AIM was set up to help smaller and high-growth companies get more access to capital. When it started out, the UK's junior market comprised of just 10 companies, with a total market valuation of £82m..Eleven of the companies that joined AIM in its first six months of existence are still on the UK stock market today and eight of those companies are still on the junior market today, according to AJ Bell (AJB.L). Since launch, AIM has helped more than 4,000 companies raise nearly £136bn..Well-known companies that started out on AIM include travel company Jet2 (JET2.L), online retailer ASOS (ASC.L) and drink mixer producer Fevertree (FEVR.L)..While AIM has produced a number of successes, it has also had its fair share of failures. That includes ""cash shell"" Langbar International, which claimed to have £370m in bank deposits but collapsed in 2005 after discovering these funds were non-existent..Another high-profile example was the collapse of cafe chain Patisserie Valerie in 2019 on the back of an accounting scandal..Such disasters have led to AIM being described as the ""Wild West"", though it is said to be the most active growth market in Europe, with 45% of the capital raised on European growth markets over the past five years raised on AIM, according to the London Stock Exchange (LSE)..Read more: Bank of England expected to hold interest rates as oil prices rise and UK growth falters.In addition, an analysis conducted by Grant Thornton found that, in 2023, AIM companies contributed £68bn in gross value added to the UK economy and supported more than 770,000 jobs..Even so, AIM has had a challenging time in recent years and research has suggested that its troubles are set to continue. According to investment bank Peel Hunt (PEEL.L) and Aberdeen Investments, AIM is set to shrink by a fifth this year, as 61 companies representing £12.3bn of market capitalisation have announced plans to leave the junior market — either to move to the main market, to delist or because they've been subject to mergers and acquisitions (M&A). If all of these moves go ahead, AIM is set to shrink by 20%..“AIM was once a thriving market, but it has been brutally knocked back by outflows in recent times,"" said Abby Glennie, co-manager of the Abrdn UK Smaller Companies Fund and the Abrdn UK Smaller Companies Growth Trust plc (AUSC.L). ""As a result, we’re seeing many of the biggest and best AIM companies moving to a main market listing.""",https://finance.yahoo.com/news/why-uk-aim-struggling-alternative-investment-050024609.html
2025-06-17 12:03:00,AI Startup Anysphere Fields VC Offers at Over $18 Billion Valuation,"(Bloomberg) -- Anysphere Inc., the developer of the popular artificial intelligence code editor Cursor, has been approached by investors about a deal that would double its valuation in a new funding round, according to a person familiar with the matter. Most Read from BloombergSecurity Concerns Hit Some of the World’s ‘Most Livable Cities’How E-Scooters Conquered (Most of) EuropeAs Part of a $45 Billion Push, ICE Prepares for a Vast Expansion of Detention SpaceJFK AirTrain Cuts Fares 50% This Su","(Bloomberg) -- Anysphere Inc., the developer of the popular artificial intelligence code editor Cursor, has been approached by investors about a deal that would double its valuation in a new funding round, according to a person familiar with the matter..Most Read from Bloomberg.Security Concerns Hit Some of the World’s ‘Most Livable Cities’.How E-Scooters Conquered (Most of) Europe.As Part of a $45 Billion Push, ICE Prepares for a Vast Expansion of Detention Space.JFK AirTrain Cuts Fares 50% This Summer to Lure Riders Off Roads.Taser-Maker Axon Triggers a NIMBY Backlash in its Hometown.In recent weeks, investors have floated a funding deal that would value the startup at $18 billion to $20 billion, said the person, who asked not to be identified because the information is private. The offer arrives shortly after the startup, which launched in 2023, surpassed $500 million in annualized revenue..The company didn’t initiate the conversations, the person said, and may decide not to raise money at this time..“We have not engaged with or spoken with any investors about financing since our Series C,” Chief Executive Officer Michael Truell said in a message to Bloomberg. “We’re not focused on fundraising and have lots to do on building the technology, product, and team. Cursor can be made much more useful, and we’re spending time on that.”.While the startup isn’t in need of cash, given the favorable terms, it could choose to add more capital to its balance sheet. Earlier this month, Anysphere said it raised $900 million at a valuation of $9.9 billion, including the new investment, in a round led by Thrive Capital. Andreessen Horowitz, Accel and DST Global also participated..Following that deal, Silicon Valley investors are eager to put more capital into what they say is the fastest-growing startup of all time in terms of revenue. The company’s annualized sales have exploded in recent months as Cursor has added more enterprise users. Companies like OpenAI, Spotify Technology SA, Major League Baseball and Instacart are all users of Cursor, which analyzes a programmer’s actions and suggests lines of code..The tools make it easier for people without technical expertise to create computer programs, a trend sometimes called vibe coding, as well as making regular software developers more efficient..Earlier this month, Truell told Bloomberg that more than half of Fortune 500 companies use Cursor, and more than 1 million people use the service every day..Still, the startup faces fierce competition, including from GitHub Copilot and Amazon CodeWhisperer. One of its biggest competitors, Windsurf, has agreed to sell to OpenAI for $3 billion, Bloomberg reported, although the deal has yet to be finalized.",https://finance.yahoo.com/news/ai-startup-anysphere-fields-vc-010417332.html
2025-06-17 12:03:00,Andy Jassy is the perfect Amazon CEO for the looming gen-AI cost-cutting era,The Amazon chief's public memo about AI's impact on the workforce raises numerous questions. But there's one clear takeaway if you've been paying attention to the company.,"Amazon CEO Andy Jassy told hundreds of thousands of his employees on Tuesday that generative AI is coming for their jobs and that their best bet is to embrace the technology..“Those who embrace this change, become conversant in AI, help us build and improve our AI capabilities internally and deliver for customers, will be well-positioned to have high impact and help us reinvent the company,” he wrote in a companywide email that was also published on Amazon’s corporate blog..But no matter how geeked Amazon employees get over new AI tools, Jassy also made a point to note that there’s not room on the bus for everybody: “We expect that this will reduce our total corporate workforce as we get efficiency gains from using AI extensively across the company.”.As I read this note—and I recommend reading the whole thing—some questions quickly came to mind. Are some parts of Amazon’s vast organization highly resistant to the new technology and perhaps in need of a public nudge (or kick in the butt), in Jassy’s view? Seems likely. Is the public memo a wink-wink to Wall Street that the company’s heavy AI investments will eventually pay off by delivering significant cost reductions? I suppose..Is the note meant to provide some glossy AI cover for imminent or future mass layoffs that may have nothing, or just something, to do with AI actually eating some corporate tasks? I guess that’s possible too, though I find it less likely..And are the parts of the essay where Jassy methodically outlines the various ways Amazon already uses gen AI—a ritutal he has performed publicly on more than one occasion this year—designed to thrust Amazon into AI-dominated news cycles that often feature many other companies not named Amazon? Perhaps..No matter the exact goal or impetus, and Amazon isn’t saying what exactly the impetus for this public memo was, Jassy seems like the right leader for the current job—especially on the cost-cutting, or, as he referred to it in his annual shareholder letter in April, the “cost avoidance and productivity” bucket of gen-AI impact..I don’t mean to discount Jassy’s ability to lead on the innovation front. He transformed and led Amazon Web Services, after all, from its infancy into the behemoth cloud provider it is today..But ever since taking over as CEO from Jeff Bezos in 2021, Jassy has also become the company’s chief cost-cutter and has appeared comfortable in the role..He has overseen the largest corporate layoffs in company history in recent years, joining other Big Tech companies like Meta, Alphabet, and Salesforce, which all slashed headcounts after overhiring in the pandemic.",https://finance.yahoo.com/news/andy-jassy-perfect-amazon-ceo-224456799.html
2025-06-17 12:03:00,"Senate passes stablecoin bill, a major victory for the crypto world","The Senate on Tuesday passed a bill that would establish the first federal framework for dollar-backed cryptocurrencies known as stablecoins, a major victory for an industry that has pushed for more favorable oversight in Washington, D.C.","The Senate on Tuesday passed a bill that would establish the first federal framework for dollar-backed cryptocurrencies known as stablecoins, a major victory for an industry that has pushed for more favorable oversight in Washington, D.C..Though passage of the GENIUS Act in the upper chamber by a vote of 68-30 won’t yet make the new legislation law — it still needs approval from the House and President Trump — the crypto world is already lauding the bill’s swift progress as a major step..“I feel really good about [this bill],” said Dante Disparte, chief strategy officer and head of global policy and operations at Circle (CRCL), the largest US stablecoin issuer..Circle’s stock has soared roughly 400% since its debut day of trading on June 5, a sign of growing investor enthusiasm for stablecoins as the legislation advances in Congress..Coinbase (COIN) chief legal officer Paul Grewal said on X that ""a year ago I would’ve thought this at best was a fever dream. Think for a moment on how far we’ve come."".The GENIUS Act, which stands for “Guiding and Establishing National Innovation for US Stablecoins,” sets a framework for how US companies can issue and manage dollar-backed stablecoins for payments..It bans members of Congress and their families from earning profits from stablecoins but not President Trump and his family, an omission that has irked some Democrats and slowed progress on the legislation this spring..Read more: Trump has called for a strategic bitcoin reserve. How it would work..Trump is deepening his own financial involvement in stablecoins as the legislation advances. World Liberty Financial, a new crypto startup backed by President Trump and his sons, has launched its own US-dollar-pegged stablecoin (USD1) in partnership with BitGo..If the legislation clears the House, it is expected to unleash a wave of new stablecoin entrants as traditional companies ranging from reportedly giant lenders to mega retailers are already considering whether to issue their own coins..“We're working with the industry, working individually,” Bank of America (BAC) CEO Brian Moynihan said of BofA’s stablecoin prospects last week at a Morgan Stanley conference..Earlier this month, Bank of America and other big banks convened to explore prospects for launching a collaborative stablecoin network. The Wall Street Journal also reported last week that Amazon (AMZN) and Walmart (WMT) are exploring stablecoin opportunities..The new wave of competition could upend the traditional payment system, especially if merchants look to get around conventional card-based networks such as Visa (V) and Mastercard (MA).",https://finance.yahoo.com/news/senate-passes-stablecoin-bill-a-major-victory-for-the-crypto-world-214918446.html
