Datetime,headline,description,article,link
2025-06-17 12:03:00,2 Top Stocks to Buy Now at Big Discounts and Hold for Years,RH (formerly Restoration Hardware) is more than just a furniture store; it's a lifestyle brand.  Roku's large audience reach just landed it a game-changing deal with Amazon.  Investors who can see through the stock volatility and focus on the key signals that set a company up for long-term success can be rewarded with outsize gains over time.,"RH (formerly Restoration Hardware) is more than just a furniture store; it's a lifestyle brand..Roku's large audience reach just landed it a game-changing deal with Amazon..10 stocks we like better than RH ›.Sometimes Wall Street can be very slow to understand the real value of a business. The competitive advantage and growth strategy of a company can be misunderstood, leading to depressed valuations and underperforming share prices..Investors who can see through the stock volatility and focus on the key signals that set a company up for long-term success can be rewarded with outsize gains over time..Here are two stocks of market-leading brands that are trading well off their previous highs and could be significantly undervalued..RH (NYSE: RH), the company formerly known as Restoration Hardware, emerged as a prominent luxury furniture brand over the past decade. In the past year, however, the business struggled with several macroeconomic headwinds, such as a weak housing market and uncertainties over tariffs..Questions about near-term demand have sent the stock down 52% this year, but this is a great buying opportunity for a long-term investor..RH's trailing-12-month revenue of $3.3 billion is below its previous peak of $3.9 billion a few years ago, but it just reported a strong first quarter. Revenue grew 12% year over year in the quarter, outperforming the rest of the industry..RH is expanding its addressable market to hospitality offerings in its design galleries, such as restaurants and wine bars, which has elevated the shopping experience to something that cannot be replicated by e-commerce competitors..Moreover, the company entered the $200 billion North American hotel industry with RH Guesthouses, and it offers much more, including private jets and luxury yachts for charter in the Caribbean and Mediterranean. All this creates an ecosystem of services meant to showcase the RH lifestyle and raise the brand to something more than just furniture products..It's for these reasons that RH has a history of reporting much higher margins than the average furniture store. Its adjusted operating margin was 7% in the first quarter, below its previous 10-year average of 12%. It should return to those higher margins in a strong housing market, and this is not reflected in the stock's valuation..Over the last 10 years, the stock traded at a price-to-sales multiple ranging from 0.48 to 6.59. The average was just over 2 times sales, with the stock currently trading at a multiple of 1.16. Investors who buy shares at these lower discounted prices and hold until the housing market is fully recovered should be well rewarded.",https://finance.yahoo.com/news/2-top-stocks-buy-now-081000878.html
2025-06-17 12:03:00,Amazon's Powerful AWS Custom Chip To Get An Upgrade - Why Is It Important?,"Amazon.com, Inc (NASDAQ:AMZN) Amazon Web Services could soon announce an update to its Graviton4 chip, sparking a rivalry with Intel Corp (NASDAQ:INTC) and Advanced Micro Devices (NASDAQ:AMD). The chip could include 600 gigabits per second of network bandwidth, CNBC reported on Wednesday. Benzinga has reached out to Amazon for its comment. Hyperscalars like Amazon, Microsoft Corp (NASDAQ:MSFT), Alphabet Inc (NASDAQ:GOOGL), and Meta Platforms (NASDAQ:META) migrated towards custom chips to curtail","Amazon.com, Inc (NASDAQ:AMZN) Amazon Web Services could soon announce an update to its Graviton4 chip, sparking a rivalry with Intel Corp (NASDAQ:INTC) and Advanced Micro Devices (NASDAQ:AMD)..The chip could include 600 gigabits per second of network bandwidth, CNBC reported on Wednesday. Benzinga has reached out to Amazon for its comment..Hyperscalars like Amazon, Microsoft Corp (NASDAQ:MSFT), Alphabet Inc (NASDAQ:GOOGL), and Meta Platforms (NASDAQ:META) migrated towards custom chips to curtail costs, tackle compatibility issues, and address supply crises..Trending: Maker of the $60,000 foldable home has 3 factory buildings, 600+ houses built, and big plans to solve housing — this is your last chance to become an investor for $0.80 per share..According to Amazon, its latest cloud computing chip, Graviton4, offers significant advancements in performance and energy efficiency. It’s the fourth generation of AWS’s custom-engineered data center chips, first introduced in 2018..Graviton4, based on Arm-architecture, boasts four times the performance of Graviton1 and is even more energy-efficient than its predecessor, Graviton3. With 73 billion transistors, it’s being adopted by major customers like SAP and Epic Games for high-performance and reliable cloud experiences. This innovation, alongside other custom AWS chips like Trainium and Inferentia for AI, underscores Amazon’s leadership in cloud computing technology..Amazon manufactures Graviton4 central processing unit at its Annapurna Labs in Austin, Texas..Rami Sinno, director of engineering at Amazon Web Services (AWS) Annapurna Labs, cited strong demand for chips that outpaced the supply..AWS Senior Director Gadi Hutt told CNBC about Amazon’s initiatives to provide an alternative to Nvidia Corp’s (NASDAQ:NVDA) costly graphics processing units..Hutt told CNBC. that Anthropic’s Claude Opus 4 AI model launched on Trainium2 GPUs and Project Rainier. Trainium3 is coming up in 2025, he said..See Also: Peter Thiel turned $1,700 into $5 billion—now accredited investors are eyeing this software company with similar breakout potential. Learn how you can invest with $1,000 at just $0.30/share..AWS has committed $8 billion to Anthropic. Also, Amazon chief Andy Jassy recently highlighted the company’s extensive leveraging of Generative AI to drive value..Jassy highlighted Generative AI’s crucial role within AWS for developers and optimizing internal functions such as fulfillment and customer service. He also pointed to developing AI agents to automate tasks and accelerate innovation.",https://finance.yahoo.com/news/amazons-powerful-aws-custom-chip-003103475.html
2025-06-17 12:03:00,Amazon Just Bet $4 Billion on South Korea's AI Boom -- Here's Why It Could Be a Game-Changer,Massive $5B AI data center deal with SK Group sends Korean tech stocks soaring and reshapes Asia's digital future,"Amazon Web Services (NASDAQ:AMZN) and SK Group are teaming up to build what could become South Korea's most powerful AI infrastructure project to date. The two giants are putting roughly $5.11 billion on the table$4 billion from AWS aloneto develop a hyperscale data center in Ulsan. Construction is scheduled to start in September, with a 100MW launch target by 2029. But that's just the beginning. SK Group Chairman Chey Tae-won told investors the plan is to scale to one gigawatt down the road, potentially transforming Ulsan into a global nerve center for AI computing..The announcement wasn't just corporate theater. South Korean President Lee Jae Myung and tech leaders showed up in force, signaling just how strategic this move could be for the country's long-term growth. President Lee pointed out that building next-gen tech infrastructure outside the capital is more than a regional development playit might be a template for the nation's high-tech decentralization. Chey, for his part, sees the AI race as a core pillar of Korea's future economic engine. If SK can deliver on the capacity, this site may serve as a launchpad for global AI trafficnot just domestic..Investors were already connecting the dots. On Friday, AI-linked names rallied hard. SK Hynix (HXSCL) gained over 3%, Kakao popped 11%, and LG CNS surged 9%, lifting the KOSPI above 3,000 for the first time in over three years. The market response suggests traders aren't just excited about another data centerthey're betting this investment could be a catalyst for Korea's next AI leap..This article first appeared on GuruFocus.",https://finance.yahoo.com/news/amazon-just-bet-4-billion-221715471.html
2025-06-17 12:03:00,"Big Retail, Stablecoins, and Dividends. Oh My!","Why Walmart and Amazon are considering launching their own stablecoins.  Two dividend stocks Matt thinks are worth getting on your radar: Whirlpool and Owens Corning.  To catch full episodes of all The Motley Fool's free podcasts, check out our podcast center.","In this podcast, Motley Fool analysts Jason Moser and Matt Argersinger discuss:.Why Walmart and Amazon are considering launching their own stablecoins..Roku and Amazon expanding their partnership..Two dividend stocks Matt thinks are worth getting on your radar: Whirlpool and Owens Corning..To catch full episodes of all The Motley Fool's free podcasts, check out our podcast center. When you're ready to invest, check out this top 10 list of stocks to buy..A full transcript is below..Before you buy stock in Amazon, consider this:.The Motley Fool Stock Advisor analyst team just identified what they believe are the 10 best stocks for investors to buy now… and Amazon wasn’t one of them. The 10 stocks that made the cut could produce monster returns in the coming years..Consider when Netflix made this list on December 17, 2004... if you invested $1,000 at the time of our recommendation, you’d have $659,171!* Or when Nvidia made this list on April 15, 2005... if you invested $1,000 at the time of our recommendation, you’d have $891,722!*.Now, it’s worth noting Stock Advisor’s total average return is 995% — a market-crushing outperformance compared to 172% for the S&P 500. Don’t miss out on the latest top 10 list, available when you join Stock Advisor..See the 10 stocks ».*Stock Advisor returns as of June 9, 2025.This podcast was recorded on June 16, 2025..Jason Moser: Big retail's taking a closer look at stablecoins. You're listening to Motley Fool Money. Welcome to Motley Fool Money. I'm Jason Moser. Joining me today, it's senior analyst Mr. Matt Argersinger. Matt, thanks for being here..Matthew Argersinger: You bet, Jason. Always glad to be with you..Jason Moser: On today's show, we're talking Amazon and Walmart's potential stablecoin aspirations. Roku and Amazon are teaming up in the ad market. We'll also take a look at a couple of Matt's favorite dividend stocks. But before we dive in, let's take a look at a few of the headlines driving the market today. After a tough Friday, markets are up today as the conflict between Israel and Iran continues. Now, according to Middle Eastern and European officials, Iran is signaling that it seeks an end to hostilities and wants to resume talks over its nuclear programs. Oil prices recently spiked because of the conflict, with WTI crude price up 11% over the last week. However, prices are down today on the news that Iran does seek to end hostilities. Let's hope that's the case. Finally, it's Fed Week. The Federal Reserve Interest rate decision is out on Wednesday at 2:00PM, with Chairman Powell's press conference to follow at 2:30.",https://finance.yahoo.com/news/big-retail-stablecoins-dividends-oh-215900458.html
2025-06-17 12:03:00,"Filecoin is building the 'Airbnb for file storage', says exec",Web3 infrastructure aims to bring trustless storage to the masses—without the Big Tech price tag.,"Filecoin is building the 'Airbnb for file storage', says exec originally appeared on TheStreet..In a digital world where nearly all web data flows through Amazon, Google, or Microsoft, Marta Belcher and Filecoin are flipping the script..“Think of it like Airbnb for file storage,” said Belcher, President and Chair of the Filecoin Foundation, in a recent conversation with TheStreet Roundtable. “People all over the world can rent out unused storage space on their hardware to store encrypted shards of data—securely, privately, and without relying on centralized entities.”.At its core, Filecoin is building what Belcher calls “foundational technology for the next generation of the web,” offering a decentralized alternative to cloud giants like AWS. The goal? Resilience, security, and control—values often missing from the current data ecosystem..When most investors hear the word “crypto,” they think price charts, digital assets, and decentralized finance. But according to Marta Belcher, President and Chair of the Filecoin Foundation, that’s only scratching the surface..“Crypto isn’t just about finance,” Belcher said. “The real innovation is in programmable money.”.Filecoin is showing what that means—starting with decentralized file storage. At first glance, the network looks like a Web3 challenger to Amazon Web Services, allowing anyone in the world to rent out unused storage space and get paid in FIL tokens. But it’s the how that’s revolutionary: payments on Filecoin are automated, granular, and permissionless..“You can write a smart contract to pay a storage provider in real time, based on their uptime and performance,” said Belcher. “Or pay a songwriter a fraction of a cent for every second a song is streamed. These kinds of micro-transactions were never possible before crypto.”.It’s a bold reframe of what blockchain technology can do. Instead of speculative hype or abstract decentralization, Filecoin is highlighting a tangible use case: letting people earn, store, and interact with data and payments in programmable ways—no middlemen required..“Web3 lets us build systems where rules are baked into code,” Belcher added. “That opens up entirely new business models—ones where creators, consumers, and infrastructure providers are all directly connected.”.As regulators and investors continue to debate the future of digital assets, Filecoin is already shipping it. For Belcher and her team, the message is simple: crypto isn’t a bet on finance. It’s a bet on the programmable economy..Filecoin is building the 'Airbnb for file storage', says exec first appeared on TheStreet on Jun 20, 2025.This story was originally reported by TheStreet on Jun 20, 2025, where it first appeared.",https://finance.yahoo.com/news/filecoin-building-airbnb-file-storage-215818126.html
2025-06-17 12:03:00,Stocks Settle Mostly Lower as Chip Makers Fall,"The S&P 500 Index ($SPX ) (SPY ) Friday closed down -0.22%, the Dow Jones Industrials Index ($DOWI ) (DIA ) closed up +0.08%, and the Nasdaq 100 Index ($IUXX ) (QQQ ) closed down -0.43%. September E-mini S&P futures (ESU25 ) are down -0.21%, and September E-mini Nasdaq futures...","The S&P 500 Index ($SPX) (SPY) Friday closed down -0.22%, the Dow Jones Industrials Index ($DOWI) (DIA) closed up +0.08%, and the Nasdaq 100 Index ($IUXX) (QQQ) closed down -0.43%.  September E-mini S&P futures (ESU25) are down -0.21%, and September E-mini Nasdaq futures (NQU25) are down -0.40%..Stock indexes on Friday gave up an early advance and finished mostly lower on weakness in chip makers after a report from The Wall Street Journal stated that a top US official had told top global semiconductor makers that the US might revoke waivers for allies with semiconductor plants in China.  .Negative trade news also pressured stocks after the Financial Times reported that Japan had canceled a top-level trade meeting with the US, set for July 1, following a request from the Trump administration for Japan to increase its defense spending. Investors are bracing for more negative tariff news within the next week or so following President Trump's announcement last Wednesday that he intends to send letters to dozens of US trading partners within one to two weeks, setting unilateral tariffs ahead of the July 9 deadline that came with his 90-day pause..Stocks initially moved higher on Friday, driven by a Reuters report that the Iranian government said it is ready to discuss limitations on its uranium enrichment..Stocks were supported Friday by speculation that the US will give negotiations a chance before deciding to enter the Israel-Iran war, following the White House's announcement on Thursday that President Trump would decide within two weeks on any US involvement in the conflict, and there is still a ""substantial chance"" of a negotiated settlement..Stocks also had support from dovish comments on Friday from Fed Governor Waller, who said, ""I think we have room to bring interest rates down as early as July, and then we can see kind of see what happens with inflation."".Friday's US economic news was negative for stocks.  The June Philadelphia Fed business outlook survey was unchanged at -4.0, weaker than expectations of an increase to -1.5.  Also, the May index of leading economic indicators (LEI) fell -0.1% m/m, right on expectations, and the sixth consecutive month the LEI has declined..Hostilities between Israel and Iran entered an eighth day Friday with no signs of easing. Israel struck more of Iran's nuclear and missile production sites Friday and warned it could bring down Iran's leadership.  Meanwhile, Iran said it won't negotiate with the US while Israel's assault continues.  Iranian President Pezeshkian said the only way to end the imposed war is to ""unconditionally stop"" the enemy's aggression.  Iran showed no signs of backing down and reiterated an intention to respond with force if the US were to get directly involved in Israeli attacks.",https://finance.yahoo.com/news/stocks-settle-mostly-lower-chip-205136092.html
2025-06-17 12:03:00,Disney Just Struck a Deal with Amazon. Should You Buy DIS Stock Here?,The partnership is between Disney’s Real-Time Ad Exchange and Amazon’s Demand Side platforms.,"Disney (DIS) has reportedly formed a partnership with e-commerce giant and cloud services titan Amazon (AMZN) to enhance ad targeting for streaming television. Under this partnership, Amazon’s Demand Side Platform (DSP) will have access to Disney’s content library..Commenting on the partnership, which is expected to launch in the third quarter of this year, Matt Barnes, vice president of programmatic sales at Disney Advertising, sounded optimistic, “By building a direct path connecting Amazon’s commerce insights to the full scale of Disney’s streaming ecosystem, we’re enabling greater accessibility to inventory and audience signals that translate into meaningful results for advertisers leveraging Amazon DSP.”.Dear Tesla Stock Fans, Mark Your Calendars for June 30.The ‘Golden Era’ for Tesla Starts June 22. Should You Buy TSLA Stock First?.Nvidia Is Quickly Approaching a New Record High. Is It Too Late to Buy NVDA Stock?.Markets move fast. Keep up by reading our FREE midday Barchart Brief newsletter for exclusive charts, analysis, and headlines..Now, although this is a positive development and makes the case for owning Disney stock even stronger, there are many more compelling reasons to own the “House of the Mouse.”.One of the most recognized global entertainment conglomerates, Disney’s operations span across media, TV & cable networks, streaming platforms, and experiences. Disney owns vastly popular intellectual property such as the Marvel Cinematic Universe, Mickey Mouse, and Star Wars, among others..Commanding a market cap of $211.9 billion, DIS stock is up about 5.6% on a YTD basis and 15.5% over the past year. While the stock currently offers a dividend yield of 0.85%, Disney's payout ratio of just 15.8% leaves enough room for growth..Disney continues to demonstrate meaningful operational momentum under CEO Bob Iger, with recent results pointing to a sustained recovery. Since Iger resumed his role, the entertainment giant has posted compound annual growth rates of 7.07% in revenue and 43.76% in earnings, an indication that the restructuring efforts are beginning to deliver..Notably, in the second quarter of its fiscal 2025, Disney reported a top-line beat with revenue reaching $23.6 billion, up 6.8% from the year-ago period. The company also returned to profitability, swinging from a loss of $0.01 per share last year to earnings of $1.81 per share this quarter, comfortably surpassing analyst expectations..Cash flow metrics came in strong. Operating cash flow surged to $6.8 billion, up from $3.7 billion in the same quarter last year, while free cash flow rose to $4.9 billion from $2.4 billion. Overall, Disney’s liquidity position remained solid as the company closed the quarter with a cash balance of $5.95 billion.",https://finance.yahoo.com/news/disney-just-struck-deal-amazon-193518990.html
2025-06-17 12:03:00,"The Smartest Growth Stock to Buy With $5,000 Right Now",It's been a good week for Roku shareholders. The next few quarters could be even better.,"An exclusive TV advertising partnership between Roku and Amazon is a big win for everyone..At least three analysts pushed their price targets on Roku higher following the news, including one outright upgrade..Roku stock is rolling over the past year, but it should turn even more heads as it returns to profitability later this year..10 stocks we like better than Roku ›.It's been quite the week for Roku (NASDAQ: ROKU) and its shareholders. The country's leader in getting folks streaming from their TVs kicked off the fireworks by announcing a transformative deal with Amazon (NASDAQ: AMZN) on Monday. An analyst upgrade and a pair of other firms jacking up their price targets followed..The stock is up nearly 10% heading into the final trading day of the week. Roku is a name that has fallen off of many growth investing radars, but the shares are now up 55% over the past year. With its solid growth, continuing niche dominance, and projected return to profitability for the second half of this year, it's a name you should probably start paying attention to again..At its frenzied peak in 2021, a $5,000 investment could barely be exchanged for 10 shares. That same $5,000 today could have you walking away with 60 shares. This is the kind of math that can burn investors if they're buying a falling stock with dim prospects, but today's Roku is in much better shape than it was four years ago..Roku's revenue and time spent on its platform have both nearly doubled since the shares peaked six times higher four summers ago. However, just saying that Roku is a larger company than it was back in 2021 isn't enough to convince you that this is the smartest growth stock for your next investment. Roku's success in continuing to gain market share as North America's leading streaming operating system for TVs will continue to open doors; doors like the one that was slammed off its hinges on Monday with its new partnership with Amazon..The leading online retailer runs a popular programmatic demand-side ad buying platform, and this week it turned heads by striking an integration deal with Roku. The two companies are typically competitors in the streaming space; Roku's platform competes with Amazon's Fire TV. But despite the wide gap in market cap -- Roku at $12 million and Amazon at $2.3 billion -- the online retailer doesn't attract the same captive U.S. audience as the pioneer..In the spirit of the ""if you can't beat 'em, join 'em"" adage, Amazon advertisers will now have access to Roku's massive reach of roughly 80 million U.S. households spending an average of more than four hours a day cradling the Roku remote. The early tests were fruitful. Amazon found that teaming up with Roku would deliver its connected TV clients 40% more unique viewers with the same budget. With better ad targeting and the ability to lower the instances of viewers seeing the same ads repeatedly, Amazon points out that its advertisers can generate a lot more value on Roku through this partnership.",https://finance.yahoo.com/news/smartest-growth-stock-buy-5-185037246.html
