Datetime,headline,description,article,link
2025-06-17 12:03:00,Stock-Split Watch: Is This AI Stock That's Soared 300% Next on the List?,"Only one ""Magnificent Seven"" company hasn’t yet split its stock.  Stock splits make it easier for a broader range of investors to buy the shares.  Stock splits have fascinated investors over the past few years, with even the biggest artificial intelligence (AI) names -- such as Nvidia and Amazon -- completing such operations after their stock prices skyrocketed.","Only one ""Magnificent Seven"" company hasn’t yet split its stock..Stock splits make it easier for a broader range of investors to buy the shares..10 stocks we like better than Meta Platforms ›.Stock splits have fascinated investors over the past few years, with even the biggest artificial intelligence (AI) names -- such as Nvidia and Amazon -- completing such operations after their stock prices skyrocketed. But one AI stock, in particular, hasn't ever launched a split, and that's Meta Platforms (NASDAQ: META)..Here's why this company, which has soared more than 300% over the past three years, could be next on the list..Before diving in, though, let's take a closer look at how and why companies split their stocks. These operations are used to lower the price of each individual share -- so companies generally do this after their stock prices have made significant gains and have arrived at a price that may discourage some investors from buying..For example, as stocks approach the $1,000 mark, even if valuation looks fine, they still may be viewed as expensive by certain investors. And investors who don't have access to fractional shares might find it difficult to buy a stock at these levels. These two elements could weigh on demand for the company's stock, limiting its potential for further gains..Companies split their stock by simply offering more shares to current holders -- the number of shares depends on the ratio of the split. So, for example, in a 10-for-1 split, if you originally held one share, you would hold 10 post-split. The value of each share would be worth less than it was prior to the operation, but the total value of your holding would remain the same..All of this means a stock split doesn't change anything fundamental about the company or the stock, but it does make it easier for a broader range of investors to buy..As mentioned, Nvidia and Amazon completed splits, along with other technology giants such as Broadcom and Alphabet. And, over time, almost every member of the ""Magnificent Seven"" -- a group of tech stocks that led the stock market higher last year -- has completed a stock split. The exception is social media and AI powerhouse Meta..Like its fellow Magnificent Seven players, Meta has delivered impressive stock performance -- and actually is the second-best performer over the past three years, after AI chip giant Nvidia..Today, Meta shares trade for more than $600, outpacing the rest of these star tech stocks -- Microsoft is the closest, with shares trading for about $470.",https://finance.yahoo.com/news/stock-split-watch-ai-stock-081000729.html
2025-06-17 12:03:00,Amazon to invest £40 billion in U.K. over next three years,"Investing.com -- Amazon.com Inc (NASDAQ:AMZN) plans to invest about £40 billion in the United Kingdom (TADAWUL:4280) over the next three years to boost innovation and support the country’s artificial-intelligence drive, according to the company on Tuesday.","Investing.com -- Amazon.com Inc (NASDAQ:AMZN) plans to invest about £40 billion in the United   Kingdom   (TADAWUL:4280) over the next three years to boost innovation and support the country’s artificial-intelligence drive, according to the company on Tuesday..The investment of 40 billion pounds will increase the U.K.’s gross domestic product, contributing an estimated additional 38 billion pounds, Amazon said..The initiative includes the creation of four new fulfillment centers and new delivery stations nationwide, as well as upgrades and expansions to the company’s existing network of over 100 operations buildings across the U.K..Amazon plans to add 2,000 jobs at a fulfillment center in Hull and 2,000 jobs at another in Northampton, plus additional positions at new sites in the East Midlands and at delivery stations across the country..Part of the investment includes £8 billion previously announced in September 2024 for data centers in the U.K. through 2028, aimed at supporting the country’s artificial intelligence computing capacity..Prime Minister Keir Starmer described the investment as ""a massive vote of confidence in the UK as the best place to do business,"" while Amazon CEO Andy Jassy noted the company’s 27-year presence in the U.K. has grown to include over 100 communities nationwide..The investment also covers continued development at Bray Film Studios in Berkshire and other creative industry initiatives, alongside sustainability projects including the recent order of more than 140 electric heavy goods vehicles for Amazon’s transportation network..Related articles.Amazon to invest £40 billion in U.K. over next three years.Approval for AstraZeneca’s Datroway drug a ’minor positive’ for shares: JPMorgan.U.K. regulator proposes designating Google with strategic status",https://finance.yahoo.com/news/amazon-invest-40-billion-u-065207542.html
2025-06-17 12:03:00,"Amazon to Invest Around $54 Billion in U.K. to Support Innovation, AI Push",The plan also includes the creation of four new fulfillment centers and new delivery stations nationwide.,The plan also includes the creation of four new fulfillment centers and new delivery stations nationwide.,https://finance.yahoo.com/m/bfe50230-ddb5-3167-8e03-ae9132351ee3/amazon-to-invest-around-54.html
2025-06-17 12:03:00,Amazon to invest $54 billion in Britain over next three years,"LONDON (Reuters) -Amazon has deepened its commitment to Britain, with the e-commerce giant saying it plans to invest 40 billion pounds ($54 billion) over the next three years, a move the UK government hailed as a vote of confidence in its economic policies.  Elected in 2024, the Labour government has made boosting Britain's anaemic growth a priority and wants to see a step up in foreign investment.  Amazon said on Tuesday its expansion in Britain, its third biggest market after the United States and Germany, would create thousands of jobs.","By James Davey.LONDON (Reuters) -Amazon has deepened its commitment to Britain, with the e-commerce giant saying it plans to invest 40 billion pounds ($54 billion) over the next three years, a move the UK government hailed as a vote of confidence in its economic policies..Elected in 2024, the Labour government has made boosting Britain's anaemic growth a priority and wants to see a step up in foreign investment..Amazon said on Tuesday its expansion in Britain, its third biggest market after the United States and Germany, would create thousands of jobs. It currently employs 75,000 in the UK, making it a top ten private sector employer..Its plan includes building two new state-of-the-art fulfilment centres in the East Midlands, central England, expected to open in 2027, as well as previously announced new centres in Hull, northern England, and Northampton, central England, that will open this year and next year respectively..The Hull and Northampton sites will each create 2,000 jobs..Amazon also plans new delivery stations across the UK, upgrades and expansions to its existing network of over 100 operations buildings, investment to enhance its transport infrastructure, two new buildings at its corporate headquarters in London and the redevelopment of the Bray Film Studios in Berkshire, southern England..The 40 billion pounds figure includes part of the 8 billion pounds announced by Amazon's cloud computing arm in September 2024 for building, operating, and maintaining data centres in the UK from 2024 to 2028. It also includes salaries for Amazon employees..Prime Minister Keir Starmer, whose government on Monday detailed its industrial strategy, said Amazon's plans represented ""a massive vote of confidence in the UK as the best place to do business."".On Friday, Britain's grocery regulator launched an investigation into Amazon, probing whether it breached rules on timely supplier payments..($1 = 0.7423 pounds).(Reporting by James Davey, Editing by Nick Zieminski)",https://finance.yahoo.com/news/amazon-invest-54-billion-britain-230918673.html
2025-06-17 12:03:00,Amazon’s new UK warehouses to hire thousands as Starmer hails ‘win’ for Britain,Prime Minister Sir Keir Starmer hailed the expansion plans as a ‘major win’ and a vote of confidence in the UK.,"Amazon has said thousands of jobs will be created at new UK warehouses in locations including Hull and Northampton as part of a £40 billion investment over the next three years..Prime Minister Sir Keir Starmer hailed the expansion plans as a “major win” for the UK, while Amazon’s boss stressed the investment will boost areas outside of London and the south east of England..The technology giant confirmed that some 2,000 jobs will be created for a new fulfilment centre in Hull, set to open this year, and another 2,000 for a site in Northampton, due to open in 2026..It also announced that two new warehouses will be built in the East Midlands, due to open in 2027..Amazon did not confirm the locations of the sites..It is understood they will lead to the recruitment of thousands of additional roles..Fulfilment centres are large warehouses where customer orders can be picked, packed and shipped – some of which use the latest technology including robotics..Amazon – which hires more than 75,000 people in the UK and is one of the country’s biggest private sector employers – also confirmed significant expansion plans for its London headquarters..This will form part of the £40 billion investment and will see the opening of two new buildings at the corporate office in the Shoreditch area..The investment also includes the majority of the £8 billion already earmarked for data centres across the UK, as well as spending on upgrading operations and infrastructure such as drone technology, its streaming service Prime, and staff wages and benefits..Sir Keir said: “Amazon’s £40 billion investment adds another major win to Britain’s basket and is a massive vote of confidence in the UK as the best place to do business..“It means thousands of new jobs – real opportunities for people in every corner of the country to build careers, learn new skills, and support their families.”.Chancellor Rachel Reeves said the investment was a “powerful endorsement of Britain’s economic strengths”..Amazon’s chief executive Andy Jassy said: “When Amazon invests, it’s not only in London and the South East – we’re bringing innovation and job creation to communities throughout England, Wales, Scotland, and Northern Ireland, strengthening the UK’s economy and delivering better experiences for customers wherever they live.”",https://finance.yahoo.com/news/amazon-uk-warehouses-hire-thousands-230100287.html
2025-06-17 12:03:00,Experian Chooses Amazon (AMZN) AWS to Power Its Cloud and AI Transformation,"Amazon.com, Inc. (NASDAQ:AMZN) is one of the 10 AI Stocks in the Spotlight. On June 19, the company announced that Experian, a global data and technology company, has selected AWS as its preferred cloud. Experian will be leveraging AWS’s advanced cloud capabilities to offer faster and scalable solutions to deliver deeper insights and more secure data services […]","Amazon.com, Inc. (NASDAQ:AMZN) is one of the 10 AI Stocks in the Spotlight. On June 19, the company announced that Experian, a global data and technology company, has selected AWS as its preferred cloud. Experian will be leveraging AWS’s advanced cloud capabilities to offer faster and scalable solutions to deliver deeper insights and more secure data services to its customers..The transition from mainframe computers and multiple on-premises servers to the cloud will help the company centralize its technology platforms in the cloud and use its data to enhance performance, scalability, and data-driven insights..A close-up of a computer monitor showing a complex web of cloud-based technology..The two companies have partnered in a 10-year strategic agreement, with Experian choosing AWS as its strategic partner for generative artificial intelligence (AI) and developing more than 100 generative AI use-cases. The collaboration strengthens Experian’s ability to better serve clients and reinforce its leadership in data and technology..“AWS is delighted to partner with Experian to unlock opportunities that drive innovation, increase agility, and accelerate their modernization. As they build intelligent data platforms, develop cutting-edge applications with generative AI, and gain real-time insights, Experian is demonstrating how organizations can reinvent their operations while maintaining security, compliance, and resilience at scale.” -Scott Mullins, Managing Director, Worldwide Financial Services at AWS..Amazon.com Inc. (NASDAQ:AMZN) is an American technology company offering e-commerce, cloud computing, and other services, including digital streaming and artificial intelligence solutions.",https://finance.yahoo.com/news/experian-chooses-amazon-amzn-aws-223509311.html
2025-06-17 12:03:00,Tesla Shares Jump Most in Two Months on Robotaxi Rollout,"(Bloomberg) -- Tesla Inc. shares climbed after the automaker rolled out its long-promised driverless taxi service to a handful of riders, a modest debut for what Elon Musk sees as a transformative new business line.Most Read from BloombergBezos Wedding Draws Protests, Soul-Searching Over Tourism in VeniceUS State Budget Wounds Intensify From Trump, DOGE Policy ShiftsThe first robotaxi trips were limited to a narrow portion of Tesla’s hometown of Austin on Sunday, with an employee sitting in the","(Bloomberg) -- Tesla Inc. shares climbed after the automaker rolled out its long-promised driverless taxi service to a handful of riders, a modest debut for what Elon Musk sees as a transformative new business line..Most Read from Bloomberg.Bezos Wedding Draws Protests, Soul-Searching Over Tourism in Venice.US State Budget Wounds Intensify From Trump, DOGE Policy Shifts.The first robotaxi trips were limited to a narrow portion of Tesla’s hometown of Austin on Sunday, with an employee sitting in the front passenger seat of each vehicle to monitor for safety. The carmaker hand-picked a friendly group of retail investors and social-media influencers to serve as initial riders and live-stream their trips..In one video, Herbert Ong, who runs a fan account, marveled over the speed of the vehicle and its ability to park autonomously. Another influencer with the X handle @BLKMDL3 deemed his trip smoother than with a human driver. Sawyer Merritt, a Tesla investor who runs an account focused on the company, called the experience “awesome.”.With no kickoff event and little in the way of formal announcements, Tesla relied largely on word of mouth and media coverage ahead of the robotaxi launch. The unveiling was uncharacteristically low-key for a company that held a “Cyber Rodeo” to mark its Texas factory opening in 2022 and an invite-only party last year near Hollywood to unveil autonomous vehicle prototypes..While Musk has cautioned that autonomy is unlikely to “move the financial needle” at Tesla for at least another year, progress toward getting the service started has boosted the company’s shares. The stock jumped 8.2% — the biggest gain in two months — to close regular trading in New York on Monday at $348.68..Musk has been reorienting the carmaker around still-unproven technologies including self-driving vehicles and humanoid robots. Some investors are counting on new business segments to revive Tesla from a vehicle sales slump and consumer backlash against its chief executive officer. The company’s shares are still down 20% this year..“While Tesla appears to be well positioned, we believe the opportunity is already priced into the stock,” Joseph Spak, a UBS Group AG analyst with a sell rating on the shares, wrote in a report Monday. He raised his price target to $215, well short of its close at $322.16 last week..Explainer: Why Tesla’s Valuation Rests on Musk More Than Reality.Videos of the robotaxi launch posted Sunday were mostly mundane, showing Model Y SUVs driving short distances, navigating intersections, avoiding pedestrians and parking — all with no one sitting in the driver’s seat. The debut was “largely uneventful” and free of major missteps, with the start of revenue service marking a “critical milestone” for bulls in the stock, Barclays analyst Dan Levy said in a note.",https://finance.yahoo.com/news/tesla-starts-long-awaited-robotaxi-003252048.html
2025-06-17 12:03:00,"Top Stock Reports for Amazon.com, Home Depot & Cisco Systems","AMZN gains 12.7% as AWS growth, Prime momentum, and GenAI focus offset mixed Q2 outlook and tariff risks.","Monday, June 23, 2025The Zacks Research Daily presents the best research output of our analyst team. Today's Research Daily features new research reports on 16 major stocks, including Amazon.com, Inc. (AMZN), The Home Depot, Inc. (HD) and Cisco Systems, Inc. (CSCO), as well as two micro-cap stocks United Homes Group, Inc. (UHG) and The Eastern Company (EML). The Zacks microcap research is unique, as our research content on these small and under-the-radar companies is the only research of its type in the country.These research reports have been hand-picked from the roughly 70 reports published by our analyst team today.You can see all of today’s research reports here >>>Ahead of Wall StreetThe daily 'Ahead of Wall Street' article is a must-read for all investors who would like to be ready for that day's trading action. The article comes out before the market opens and attempts to make sense of that morning's economic releases and how they will affect that day's market action. You can read this article for free on our home page and can actually sign up there to get an email notification as this article comes out each morning.You can read today's AWS here >>> Pre-Markets Look Toward Sunny ClimesToday's Featured Research ReportsShares of Amazon.com have gained +12.7% over the past year against the Zacks Internet - Commerce industry’s gain of +18.2%. The company’s top line is driven by steady momentum in Prime and AWS. A strengthening AWS services portfolio and its growing adoption rate contributed well to AWS performance. Ultrafast delivery services and expanding content portfolio were beneficial. Strengthening relationships with third-party sellers was a positive. Robust advertising business contributed well. Amazon’s expanding global presence, growing capabilities in grocery, pharmacy, healthcare and autonomous driving are key positives. Deepening focus on GenAI is a major plus. The Zacks analyst expects 2025 net sales to increase 8.5% from 2024. However, Amazon announced mixed guidance for the second quarter. High tariffs imposed by President Trump on goods imported from China have cast uncertainty on retailers such as Amazon. AMZN's free cash flow has decreased significantly.(You can read the full research report on Amazon.com here >>>)Home Depot’s shares have outperformed the Zacks Retail - Home Furnishings industry over the past year (+2.2% vs. -2.5%). The company’s performance is supported by strong execution across key growth initiatives. Home Depot continues to benefit from its progress in building an interconnected shopping experience, synergies from the SRS acquisition, expansion of its Pro ecosystem, strategic digital investments, and new store openings. These factors contributed to robust top-line growth in the first quarter of fiscal 2025, driven by increased engagement in Spring-related purchases and smaller-scale home improvement projects. However, HD faces softer demand in big-ticket discretionary categories, reflecting consumer caution amid high interest rates. Margin pressure, currency headwinds, and macroeconomic uncertainty also remain key risks. HD is also navigating a complex global trade environment, with rising tariffs.(You can read the full research report on Home Depot here >>>)Shares of Cisco Systems have outperformed the Zacks Computer - Networking industry over the past year (+44.7% vs. +43.5%). The company’s business model has evolved with subscription revenues accounting for more than half of its total revenues. Increases in recurring revenue bases bodes well for investors. Its Splunk acquisition enhances the recurring revenue base.The buyout significantly expands Cisco’s portfolio of software-based solutions, contributing more than $4 billion in ARR and makes it one of the largest software companies in the world. The launch of AI-powered Hypershield, which combines security and networking, strengthened Cisco’s security portfolio. However, it has been suffering from sluggish networking sales, primarily due to lackluster demand from telecommunication and cable services providers, as well as stiff competition. Cisco’s prospects are further challenged in the AI-driven networking space due to stiffening competition.(You can read the full research report on Cisco Systems here >>>)United Homes’ shares have underperformed the Zacks Real Estate - Development industry over the past year (-37.4% vs. -5.6%). This microcap company with a market capitalization of $193.97 million is facing challenges which include persistent margin pressure, declining orders and execution risk tied to unproven strategies. Despite this, shares trade at deep discounts, suggesting an upside if execution improves.Nevertheless, United Homes is executing a strategic transformation focused on margin expansion and operational efficiency. A shift toward refreshed home designs, now yielding 24% gross margins, supports profitability and reduces reliance on discounting. UHG’s pre-sale strategy improves margin visibility and working capital efficiency while rebidding efforts and faster build cycles enhances cost control. Though volume and margin remain under pressure amid soft demand, UHG is expanding into high-growth Southeastern markets, with a land-light model supporting disciplined capital returns. The recent debt refinancing improves liquidity and reduces dilution risk.(You can read the full research report on United Homes here >>>)Shares of Eastern have underperformed the Zacks Security and Safety Services industry over the past year (-1.3% vs. +6.3%). This microcap company with market capitalization of $142.05 million has risks like elevated SG&A amid restructuring, cyclical reliance on Class 8 OEMs, weak R&D investment, and recent negative cash flow due to working capital drag. Valuation remains attractive at 0.62X EV/S and 6.88X EV/EBITDA versus peers. Nevertheless, Eastern Company’s performance is driven by Velvac’s market share gains and operational enhancements in the Class 8 truck segment, including vertical integration and aftermarket expansion. Despite industry softness, Eastern sustains profitability, posting Q1 2025 adjusted EBITDA of $4.6 million and net income of $2 million, with a gross margin of 22.4%. A leaner balance sheet and improved working capital reinforce financial flexibility. Strategic manufacturing footprints across the United States, Mexico, and China support tariff agility and local sourcing trends. Capital returns remain robust with a long-standing dividend and a new buyback program.(You can read the full research report on Eastern here >>>)Other noteworthy reports we are featuring today include Shell plc (SHEL), Quanta Services, Inc. (PWR) and Becton, Dickinson and Co. (BDX).Mark VickerySenior EditorNote: Sheraz Mian heads the Zacks Equity Research department and is a well-regarded expert of aggregate earnings. He is frequently quoted in the print and electronic media and publishes the weekly Earnings Trends and Earnings Preview reports. If you want an email notification each time Sheraz publishes a new article, please click here>>>",https://finance.yahoo.com/news/top-stock-reports-amazon-com-205600251.html
2025-06-17 12:03:00,Nuclear Power’s Biggest IPO in Years Is on the Way,Holtec CEO says the plan is to go public within several months. The IPO may be coming at just the right time.,Holtec CEO says the plan is to go public within several months. The IPO may be coming at just the right time.,https://finance.yahoo.com/m/57144676-fd88-3576-9758-6635055b1367/nuclear-power%E2%80%99s-biggest-ipo.html
