Datetime,headline,description,article,link
2025-06-17 12:03:00,Shoppers say they’re ‘not interested’ in Amazon’s longer Prime Day sale,Could making the 2025 Amazon Prime Day event four days long backfire? Here’s what retail analysts think.,"Is this really a prime time for a shopping event?.After all, U.S. retail sales took a hit for a second straight month in May. The trade wars remain largely in effect, with President Donald Trump’s tariff pause due to end in July. Plus, there’s now a major conflict between Israel and Iran, which is already causing some global economic jitters..‘I’m at my wit’s end’: My niece paid off her husband’s credit card but fell behind on her taxes. How can I help her?.Why the biggest-ever ‘triple witching’ options expiration could deliver a jolt to Friday’s trading.Israel-Iran clash delivers a fresh shock to investors. History suggests this is the move to make..‘I prepaid our mom’s rent for a year’: My sister is a millionaire and never helps our mother. How do I cut her out of her will?.I’m 75 and have a reverse mortgage. Should I pay it off with my $200K savings — and live off Social Security instead?.And yet, Amazon AMZN is set to expand its July Prime Day shopping event from two to four days, banking on consumer sentiment to be strong enough in spite of all these obstacles..Retail analysts and experts who spoke with MarketWatch are fairly bullish on Amazon’s  strategy. But shoppers appear to be signaling some caution, based on survey data..Amazon announced the Prime Day expansion this week, setting the event for July 8-11 and saying it’s a boon for shoppers. “With an extended four-day event, our Prime members will have more time and flexibility to conveniently shop, while enjoying exclusive deals and incredible savings,” an Amazon spokesperson told MarketWatch..Certainly, the company has fared very well over the years with its summertime retail extravaganza. Last year’s two-day event saw consumers spend $14.2 billion, setting a new record for the event, according to data from Adobe Analytics. Prime Day 2024 was subsequently described by Amazon as its “biggest Prime Day shopping event ever.”.But there are certainly headwinds going into the expanded summer 2025 event — and that perhaps explains why consumers seem skittish..A new RetailMeNot survey found that interest in Prime Day should remain strong — 84% of U.S. shoppers say they plan to participate, up from 81% in 2024. But the survey also showed that those shoppers won’t be digging as deep into their wallets, with the anticipated spend at Amazon being $242 during the event, a decline of $58 from the previous year..Polls conducted by MarketWatch on various social-media platforms Tuesday showed limited enthusiasm for a four-day Prime Day event. On X, far more respondents said they were “not interested” in the extended sale versus those who said they “love” the idea. MarketWatch polls on both Instagram and WhatsApp found that the majority of survey respondents voted “Not interested [in the expanded Prime Day event] because I need to save money right now.”",https://finance.yahoo.com/news/shoppers-not-interested-amazon-longer-173500566.html
2025-06-17 12:03:00,"Corporations Have A 'Shady New Way To Charge You More.' It's Called Surveillance Pricing, And It's Weaponizing Your Own Data Against You","Imagine buying a TV online and paying $500, only to find out someone else paid $400 for the exact same one, and another person got it for $350. No discounts. No loyalty cards. Just different prices for different people. The Hidden Cost Of Personalized Pricing “You’d be outraged,” said former Federal Trade Commission Chair Lina Khan in a new video posted by economist and former Labor Secretary Robert Reich. “You would demand to know why you were being charged more than someone else for the exact","Imagine buying a TV online and paying $500, only to find out someone else paid $400 for the exact same one, and another person got it for $350. No discounts. No loyalty cards. Just different prices for different people..“You’d be outraged,” said former Federal Trade Commission Chair Lina Khan in a new video posted by economist and former Labor Secretary Robert Reich. “You would demand to know why you were being charged more than someone else for the exact same TV, on the exact same day.”.Don't Miss:.Maker of the $60,000 foldable home has 3 factory buildings, 600+ houses built, and big plans to solve housing — this is your last chance to become an investor for $0.80 per share..Deloitte's fastest-growing software company partners with Amazon, Walmart & Target – Many are rushing to grab 4,000 of its pre-IPO shares for just $0.30/share!.As Reich said, it’s a “shady new way to charge you more for something than anyone else is paying,” and according to Khan, that scenario isn't hypothetical. It’s already happening, quietly and behind the scenes. The tactic is called surveillance pricing, and it uses your personal data to determine how much you’re charged. “Businesses may be using this trove of personal information to charge each of us a different price for the exact same product or service,” she explained..Our phones and computers collect huge amounts of data on us every day. Companies tap into that data—like your location, income level, browsing habits, even your mouse movements—to figure out your “pain point,” or the highest price you’re likely to pay..“And unlike being in a physical store where you generally see the same price tag as everyone else,” Khan said, “online shopping is an individualized experience.”.The goal? Maximize profit by charging each person as much as possible, without them even realizing it..Trending: Maximize saving for your retirement and cut down on taxes: Schedule your free call with a financial advisor to start your financial journey – no cost, no obligation. .This isn’t just theory. It's already happening across industries. Here are some examples Khan mentioned in the video:.The Princeton Review charged higher prices for test prep to customers in ZIP codes with higher Asian populations..Rideshare apps charged more to users with low phone battery life..People booking hotel rooms from wealthier cities like San Francisco were shown prices up to $500 higher per night..Some internet providers charged the same fees for slower speeds in poorer, less white neighborhoods.",https://finance.yahoo.com/news/corporations-shady-way-charge-more-150148693.html
2025-06-17 12:03:00,Amazon Eyes Bedrock Makeover Amid AI Wars,"Revamped runtime may host rival AI models, boosting cross-cloud flexibility","Amazon (NASDAQ:AMZN) Web Services is overhauling its Bedrock AI cloud service to simplify customer workflows and challenge competitors like Google Cloud and Microsoft Azure..Warning! GuruFocus has detected 2 Warning Sign with AMZN..In an effort to strengthen Bedrock's runtime performance, AWS engineers are adding modular components that let generative models hosted on rival clouds run seamlessly within Bedrock environments..Sources tell The Information that these enhancements could be unveiled as early as next month. Since its April 2023 debut, Bedrock has supported Amazon's own Titan and Nova models alongside third-party offerings from Stability.ai, AI21 Labs and Anthropic, but customers have pressed AWS for greater flexibility and cross-platform compatibility..By enabling clients to deploy OpenAI-trained models or Microsoft's Azure-hosted services within the Bedrock framework, Amazon aims to stem customer attrition and capture workloads migrating between clouds..Google Cloud's Vertex AI has gained traction by integrating diverse foundation models into a single platform, and AWS seeks to reclaim momentum by positioning Bedrock as an agnostic runtime hub. An AWS business-partner executive notes that enterprises want the freedom to run our code on AWS but tap the best models wherever they live..Why It Matters: The Bedrock upgrade could reinforce AWS's lead in cloud infrastructure by blending multi-vendor AI models under one roof, potentially reducing vendor lock-in and speeding time to production..This article first appeared on GuruFocus.",https://finance.yahoo.com/news/amazon-eyes-bedrock-makeover-amid-143524593.html
2025-06-17 12:03:00,Amazon to invest $233M to enhance its India infrastructure,"Amazon is investing $233M in its India business to expand operations infrastructure, build new tools for its delivery network, and work on employee safety.","Amazon said on Thursday that it would invest about $233 million in its India business to further build out its operations infrastructure, develop new tools for its delivery network, and work on employee safety and well-being programs..The company said the investment helps it double down on its efforts to deliver to all pin-codes in the country..“This investment will enhance processing capacity, improve fulfilment speed, and increase efficiency across the company’s operations network,” Amazon said in a blog post..As part of the investment, the company will continue work on some initiatives to support its contractors and employees, including rest spots for delivery personnel; financial education and support; scholarships for associates’ children; and healthcare support for truck drivers..Amazon said it is also developing new software and tools to help delivery personnel with navigation, safety, and the overall delivery process.",https://finance.yahoo.com/news/amazon-invest-233m-enhance-india-143455180.html
2025-06-17 12:03:00,Microsoft Plans Thousands of Job Cuts. How AI Is Reshaping the Labor Market.,"Microsoft will cut thousands of jobs in its sales department and other teams from July, The Wall Street Journal reported. Here's how AI is contributing to mass layoffs.","Microsoft will cut thousands of jobs in its sales department and other teams from July, The Wall Street Journal reported. Here's how AI is contributing to mass layoffs.",https://finance.yahoo.com/m/1aad655f-26de-3cc4-a230-684eb99c12a7/microsoft-plans-thousands-of.html
2025-06-17 12:03:00,Experian Accelerates Migration to AWS to Drive Innovation with Generative AI,"SEATTLE, June 19, 2025--Amazon Web Services, Inc. (AWS), an Amazon.com, Inc. company (NASDAQ: AMZN), today announced that Experian, a global data and technology company, is embarking on the next phase of its cloud migration and has selected AWS as its preferred cloud. By leveraging AWS’s advanced cloud capabilities, Experian can provide faster, more scalable solutions that empower clients with deeper insights and more secure data services.","Global data and technology leader expands its cloud footprint to enhance performance and reliability, using AWS analytics and AI capabilities to give financial organizations access to real-time intelligence.SEATTLE, June 19, 2025--(BUSINESS WIRE)--Amazon Web Services, Inc. (AWS), an Amazon.com, Inc. company (NASDAQ: AMZN), today announced that Experian, a global data and technology company, is embarking on the next phase of its cloud migration and has selected AWS as its preferred cloud. By leveraging AWS’s advanced cloud capabilities, Experian can provide faster, more scalable solutions that empower clients with deeper insights and more secure data services..Experian's cloud first strategy, in partnership with AWS, accelerates innovation by enhancing performance, scalability, and reliability, while enabling the company to better serve its clients with innovative products and solutions. By migrating off mainframe computers and moving multiple on-premises servers to the cloud, Experian is able to centralize its technology platforms in the cloud and use its data to drive deeper insights and predictive capabilities. Leveraging AWS's robust infrastructure, Experian can quickly adapt to evolving client needs, ensuring secure and efficient data handling..As part of this new 10-year strategic agreement, Experian has selected AWS as their strategic partner for generative artificial intelligence (AI), developing more than 100 generative AI use-cases. This collaboration will drive operational efficiency, democratize data technologies for employees, and develop new credit and financial analytics offerings. With the integration of generative AI, Experian is streamlining the complex process of database migrations, automating and optimizing the transfer of vast datasets, reducing downtime, improving data accuracy, and further solidifying its position as a leader in the global data and technology industry..""AWS is delighted to partner with Experian to unlock opportunities that drive innovation, increase agility, and accelerate their modernization,"" said Scott Mullins, Managing Director, Worldwide Financial Services at AWS. ""As they build intelligent data platforms, develop cutting-edge applications with generative AI, and gain real-time insights, Experian is demonstrating how organizations can reinvent their operations while maintaining security, compliance, and resilience at scale."".""Our initial migrations gave us enhanced performance, security, and reliability, making it an easy choice to take that a step farther and embrace a cloud-first strategy,"" said Rodrigo Rodrigues, Chief Technology Officer at Experian. ""Having our data readily available in the cloud sets us up to invest in new capabilities like generative AI and advance products and solutions for our clients with proven security. By moving to AWS, we've reduced our data processing time by 60%, improved our ability to launch new products from months to weeks, and can now analyze credit data in real-time to better serve our customers.""",https://finance.yahoo.com/news/experian-accelerates-migration-aws-drive-130000365.html
2025-06-17 12:03:00,This Week In E-Commerce - Digital Commerce Insights Forecasting Future Market Dynamics,"The latest ""Digital Commerce Market: 2025-2029"" report offers an exhaustive examination of the rapidly expanding digital commerce sector, providing detailed analysis and strategic recommendations for stakeholders. This comprehensive research covers pivotal segments such as Digital Banking, eCommerce, and Proximity Payments, analyzing market trends and challenges across 60 countries. It offers critical insights into key growth drivers and constraints, enabling stakeholders to refine their...","The latest ""Digital Commerce Market: 2025-2029"" report offers an exhaustive examination of the rapidly expanding digital commerce sector, providing detailed analysis and strategic recommendations for stakeholders. This comprehensive research covers pivotal segments such as Digital Banking, eCommerce, and Proximity Payments, analyzing market trends and challenges across 60 countries. It offers critical insights into key growth drivers and constraints, enabling stakeholders to refine their strategies within digital commerce. Accompanied by extensive benchmark forecasts, the report serves as a crucial resource for understanding market dynamics and preparing for future developments within this evolving industry..In other market news, Groupe Dynamite was a notable mover up 15.8% and ending trading at CA$22.72, close to the 52-week high. This week, the company raised its earnings guidance for 2025, projecting higher comparable store sales growth. At the same time, Microalliance Group trailed, down 20% to end trading at $1.00..Seize the opportunity as Amazon leverages AI to boost AWS and ads. Dive into the full narrative to explore Amazon's growth potential and strategic moves..For a deeper understanding of the e-commerce landscape, revisit our Market Insights article highlighting the pivotal role of logistics automation in driving industry growth; essential reading as the landscape rapidly evolves..NIKE ended the day at $59.51 down 0.8%. On Tuesday, Cathleen Benko informed the company of her decision to retire from the Board of Directors effective after the 2025 annual meeting..Amazon.com closed at $212.52 down 1.1%. This week, Amazon saw key partnerships with Tufin and CSG to enhance cloud security and transformation solutions..Alibaba Group Holding settled at $113.49 down 1.3%. Alibaba recently presented at MWC Shanghai 2025, two days ago, highlighting insights from Vice President Steven Hoi..Unlock our comprehensive list of 252 E-Commerce Stocks like Arvind Fashions, STO ExpressLtd and Weimob by clicking here..Interested In Other Possibilities? AI is about to change healthcare. These 22 stocks are working on everything from early diagnostics to drug discovery. The best part - they are all under $10b in market cap - there's still time to get in early..This article by Simply Wall St is general in nature. We provide commentary based on historical data and analyst forecasts only using an unbiased methodology and our articles are not intended to be financial advice. It does not constitute a recommendation to buy or sell any stock, and does not take account of your objectives, or your financial situation. We aim to bring you long-term focused analysis driven by fundamental data. Note that our analysis may not factor in the latest price-sensitive company announcements or qualitative material. Simply Wall St has no position in any stocks mentioned.",https://finance.yahoo.com/news/week-e-commerce-digital-commerce-123737985.html
2025-06-17 12:03:00,"Amazon to invest $233 million in India to expand operations infrastructure, improve tech","The investment builds on top of Amazon's prior investments for the creation of an operations network to deliver to all serviceable pin-codes in the country, it added.  In June 2023, the e-commerce major - which competes with Walmart's Flipkart and billionaire Mukesh Ambani's Reliance Retail in India - had said it will take its investments in the country to $26 billion by 2030, without providing a breakdown.","(Reuters) -Amazon (AMZN) will invest more than 20 billion rupees ($233 million) in India in 2025 to expand and update its operations infrastructure, develop new technology for its fulfilment network and improve delivery safety, it said on Thursday..The investment builds on top of Amazon's prior investments for the creation of an operations network to deliver to all serviceable pin-codes in the country, it added..In June 2023, the e-commerce major - which competes with Walmart's Flipkart and billionaire Mukesh Ambani's Reliance Retail in India - had said it will take its investments in the country to $26 billion by 2030, without providing a breakdown..The new investment will be used to launch new sites and upgrade existing facilities across its fulfilment and delivery network, improving speed and processing capacity, it said..Additionally, Amazon plans to use technology to alert delivery associates about unsafe speeds and ensure equitable distribution of delivery routes..Some of the funds will also be used to expand initiatives to improve the health and financial well-being of its employees, the company said..In March, India's information technology ministry said Amazon's cloud services provider, Amazon Web Services, will invest about $8.2 billion in the country..($1 = 86.7100 Indian rupees).(Reporting by Ananta Agarwal in Bengaluru; Editing by Janane Venkatraman).By subscribing, you are agreeing to Yahoo's 
                        
                            Terms
                        
                     and 
                        
                            Privacy Policy
                        
 ",https://finance.yahoo.com/news/amazon-invest-233-million-india-121604621.html
2025-06-17 12:03:00,"Down 25%, Is Now the Time to Pounce on IonQ Stock for Just $40?",IonQ has become a popular name surrounding quantum computing stocks over the last several months.,"Investors have identified quantum computing as one of the next big tailwinds in the AI revolution..Integrations with Microsoft, Alphabet, and Amazon have helped land IonQ on the radar of investors..While shares are down 25% from peak levels, a valuation analysis suggests IonQ stock remains pricey..10 stocks we like better than IonQ ›.Over the last several months, a new pocket of the AI realm called quantum computing has started to garner quite a bit of attention from the investment community. What's unique, however, is that the usual suspects of Nvidia, Microsoft, Alphabet, and Amazon aren't really pegged to the rising interest in quantum computing technology..Rather, a new cohort of rising stars such as Rigetti Computing, D-Wave Quantum, and IonQ (NYSE: IONQ) are among the most popular quantum computing stocks right now. With shares down by 25% from their peak over the last year, IonQ stock trades for roughly $40 as of this writing. Is now a good opportunity to pounce on the stock?.Quantum computing is not a widely used application in artificial intelligence (AI) today. Yet despite its developmental stage, global management consulting firm McKinsey & Company is forecasting that quantum computing could be a $131 billion opportunity in the coming decades. With the potential for such enormous upside, it's not entirely surprising that investors were quick to look at which companies are involved with quantum computing development..One reason that I think IonQ has emerged as a favorite in the quantum computing market is the company's impressive partnerships with cloud hyperscalers Microsoft, Amazon, and Alphabet. With the stock sliding as of late, investors may be wondering if the sell-off is an opportunity to buy the dip..Despite working with major AI developers, IonQ has little to show in terms of tangible growth. Over the last year, the company has only generated $43 million in revenue. Meanwhile, the company's net losses are in the hundreds of millions (and worsening)..In a way, this financial profile actually makes some sense. As I alluded to above, quantum computing is not yet commercially used in AI development. Given those dynamics, IonQ's revenue potential is fairly limited for the time being. The unfortunate reality is that the company will likely remain a high-cash-burn operation as it continues building out its platform..But still, for just $40 could IonQ be worth a look? Well, smart investors understand that the stock price alone does not determine the worth of a business. As of this writing, IonQ boasts a market capitalization of nearly $10 billion. This implies that IonQ is trading for a price-to-sales (P/S) ratio of 195.",https://finance.yahoo.com/news/down-25-now-time-pounce-110000459.html
2025-06-17 12:03:00,Amazons AWS fires back at Nvidia with Graviton4 and Trainium3,Graviton4 upgrade and Trainium3 could lure cost-sensitive AI workloads,"Amazon's AWS is sharpening its AI edge with custom chipsan upgraded Graviton4 CPU and a forthcoming Trainium3 GPUthat could start chipping away at Nvidia's (NASDAQ:NVDA) market stronghold in AI training and inference..CNBC reports AWS will soon launch a Graviton4 update boasting 600 Gbps of network bandwidth, courtesy of its Annapurna Labs design, with availability expected by month's end..Later this year, AWS plans to roll out Trainium3, promising 50% better energy efficiency versus Trainium2, which underpins Anthropic's Claude Opus 4 model. While Nvidia's Blackwell GPU retains a rawperformance lead, Trainium2 already offers superior cost-performance ratios, according to AWS Senior Director Gadi Hutt..Developers eyeing Trainium will need to retool workloads away from Nvidia's CUDA ecosystem and validate modelaccuracy parity on AWS's frameworks..Nvidia has dominated AI compute thanks to unmatched throughput and the ubiquity of CUDA in developer toolchains..By delivering strong price-performance and energy gains via Graviton4 and Trainium3, AWS aims to lure hyperscalers and cost-sensitive enterprises that run massive inference fleets or large-scale training jobs..If AWS can minimize migration friction and prove equivalent accuracy, it could open the door for a meaningful shift in AI infrastructure spend..The real test will come when Graviton4 benchmarks are published and Trainium3 previews hit developer hands..Watch for cloudnative AI workloads running on non-CUDA stacks and for enterprise case studies highlighting total cost-of-ownership savings. Those signals will reveal whether AWS can genuinely erode Nvidia's GPU hegemony..This article first appeared on GuruFocus.",https://finance.yahoo.com/news/amazons-aws-fires-back-nvidia-104926638.html
